Tweets	partition	Topics
nation passenger isolated jkia showing ebola like symptom test negative check kemri dr muraguri c	train	0
waiting bae quit giving silent treatment like	train	0
th doctor dy exposure sierra leone fight disease doctor die	train	0
stupid spread ebola prevention news spread god word	train	0
lagbaja ebola common	train	0
nd witness anthony fauci national institute allergy amp infectious disease director giving powerpoint presentation	train	0
max life cut short due winifred sucking question ponder far often	train	0
typically person displaying symptom ebola able infect others infected unsymptomatic pers	train	0
symptom include fever headache joint muscle pain followed vomiting diarrhea rash internal exter	train	0
looking beyond disease need even thn	train	0
answer gd question	train	0
symptom find picture	train	0
thing much competency testing come treatment prevention	train	0
one health worker patient transferred treatment	train	0
amp one might expect country near unlimited amp	train	0
thing know alternet	train	0
research reveals potential ebola treatment thomson reuters via	train	0
nigerian beware lagos state oooo another report ebola disease	train	0
hosting phone bank web chat today pm pm call ask question	train	0
scale scared concerning ebola virus	train	0
question concern ncdhhs new web page answer please retweet	train	0
disease contact die next day hiv b ebola c aid	train	0
fujifilm drug eyed possible treatment ebola virus via	train	0
stop chain transmission	train	0
geneticist talk screening disease going able able drastically reduce genetic disease	train	0
become contagious untill symptom start show evrybody need know	train	0
answer common question next ebola airborne	train	0
ontario man treated brampton hospital ebola like symptom	train	0
good news today nigeria amp senegal declared disease free u thomas duncan contact clear day	train	0
depends type question	train	0
patient ebola like symptom isolation hospital near toronto	train	0
spanish priest ebola land madrid treatment government	train	0
canada quarantine man ebola symptom	train	0
disease scarier ebola via	train	0
natural artificial yoghurt yh regular eatin gala yoghurt possible cure ebola	train	0
assures risk transmission air travel low urge caution cc ht	train	0
ebola victim dy saudi arabia man treated ebola like symptom dy saudi arabia	train	0
sign good night wake completed step	train	0
finding ebola virus list truth prevention warning	train	0
dr fauci announces vaccine clinical trial progress amp transfer nurse specialized treatment ctr	train	0
dey crazy hell nooooo slap ebola patient	train	0
flat earth society congress questioning head cdc role united state	train	0
judicial watch obama bring non american ebola victim treatment	train	0
infectious disease contagious ebola virus	train	0
congratulates senegal ending transmission	train	0
liberia declares state emergency ebola disease outbreak	train	0
ebola five undergoing test nasarawa olaoluwa folalu fear outbreak ebola virus disease	train	0
sign animated deaf interpreter nyc press conference go viral	train	0
breaking news dead hospitalised high salt consumption ebola prevention via	train	0
worried want help clear thing tweet u question day long using	train	0
ebola fear people west forgotten deal untreatable disease	train	0
thing know killer disease ebola cnns dr gupta via	train	0
handy venn diagram v symptom	train	0
spread ebola prevention news spread god word	train	0
compare infectious disease term contagiousness deadliness	train	0
husband ebola patient monitoring sign disease	train	0
start w typical symptom including muscle ache	train	0
expert caution using salt ebola treatment	train	0
ebola disease causing quite stir	train	0
woman show symptom infectious disease berlin ebola virus feared via	train	0
trust cdc ebola also bear mind thought hiv gay man disease year	train	0
graphic show difference btwn amp symptom http	train	0
medium quick tell u pres uhuru issue educate kenyan ebola symptom asking nati	train	0
lrt keep thinking ebola mysterious disease u happens serum disease death rate hmmmm	train	0
contagious disease dr luk answer question	train	0
ebola tobacco drug join duckweed plant war disease bloomberg	train	0
uhm maybe co guy busy checking muslim passenger worry carrier deadly disease	train	0
country ebola transmission conduct exit screening person international airport	train	0
answer question asked new ebola drug zmapp	train	0
symptom appear day exposure	train	0
ebola released air pls safe take bath warm water nd salt prevention better cure	train	0
educated peep go popping bathin salt water juice ebola prevention die learner	train	0
patient symptom prompt lock amarillo tx flight w nd vic	train	0
ebola virus disease update west africa august total new case ebola virus	train	0
guide distinguishing disease found	train	0
husband american patient watching sign disease	train	0
cdc review human human transmission virus	train	0
ebola canada patient returning virus stricken west africa tested disease	train	0
scary ebola reason fear united state top disease detective call ebola pain	train	0
let victim disease fly passenger could potentially knowing disease	train	0
symptom please help keep people know	train	0
australian doctor put alert sign ebola virus	train	0
lwkmd whaaaa r mad wallah form word ebola ola eba	train	0
nano silver nigeria potential ebola treatment unlikely work gtnews	train	0
u raise question safety nano silver ebola treatment sahara reporter	train	0
note treatment doctor give patient fluid oxygen keep	train	0
potential ebola treatment find backer crowd funded campaign via	train	0
smh av find riri ebola free lol riri love sleep today	train	0
spanish priest ebola fly home treatment	train	0
american doctor infected ebola say getting stronger treatment atlanta hospital	train	0
obama said early send experimental vaccine africa want disease kill	train	0
tkm ebola treatment allowed emergency use u canada govts canadian drugmaker tekmira pharmaceutical	train	0
patient kept isolation nyc mount sinai hospital tested negative virus disease cdc determi	train	0
nd nurse come emory treatment detail arrival	train	0
ebola transmission aerosol confirmed virus survives day outside infected host	train	0
well according sign fixed barrier around roadworks complete october	train	0
two american caught ebola west africa brought u treatment	train	0
bbc news growing concern air transmission ebola	train	0
question handling case u call medical swat team	train	0
breaking news dead hospitalised high salt consumption ebola prevention via	train	0
henry l niman phd transmission lagos hospital treated patrick sawyer hcw exposure	train	0
column show federal spending infectious disease like gong back	train	0
weh fenton deh jamaican medical doctor asks several question country preparedness	train	0
proof obama secure usa ebola czar illegal alien disease czar	train	0
september nigeria declared ebola virus disease free world health organisation	train	0
nope ebola airborne disease	train	0
look like nonsense person asked question could answer	train	0
tweet facebook u question get answer throughout day today	train	0
obscure biotech firm hurry ebola treatment	train	0
joint statement ontario health minister chief medical officer health preparedness virus disease	train	0
defense conceded le u time look	train	0
identify gryffindor hufflepuff serious question	train	0
response need response jamaica disease spreading far causing los	train	0
today ebola outbreak u regulator approves drug human treatment	train	0
nigerian died cancer flight via uae show sign ebola	train	0
mention one thing overrated	train	0
fear evd otherwise known ebola virus disease beginning long life	train	0
specific treatment disease yet available	train	0
ebola two lagos doctor nurse woman discharged treatment centre chukwu four	train	0
cdc creating designated treatment facility state mean civil liberty http	train	0
instead eating bitter cola n bathing salt n water ebola prevention eat word god n bathe jesus blood	train	0
information quarantined disease nyt op ed	train	0
ethicist discus get experimental treatment	train	0
good news test show yale new patient ebola like symptom	train	0
gop called austerity lack funding hurt research disease like	train	0
spread prevention measure ebola virus spread jesus cure world sin http	train	0
le afraid swine flu sars mad cow disease afraid girlfriend discovering passcode	train	0
confirms patient symptom cruise ship coast via	train	0
nigerian lady started rumour use salt water cure ebola virus disease apologised	train	0
survivor join fight deadly disease	train	0
bath salt water cure prevention ebola take via	train	0
man strange symptom ebola omg hospitalized nyc test turn negative ebola almost ebola develo	train	0
yale nh hospital patient w possible symptom per hartford courant	train	0
committee country transmission conduct exit screening intl airport seaport major land crossing	train	0
obscure biotech firm hurry ebola treatment	train	0
ebola drug zmapp raise ethical question get experimental treatment	train	0
history repeat equal access treatment time ebola stop playing game	train	0
mp question sh ebola emergency fund	train	0
pres believe point airborne transmission bodily fluid hold virus become airb	train	0
jigawa strengthens disease surveillance system following report spread ebola virus	train	0
able elbo form word ebola	train	0
prayer best prevention	train	0
elect america hating banana republic dictator whose goal third world diseased toilet amerika	train	0
monitored symptom ohio	train	0
night dallas health worker reported symptom shared plane people cdc want find	train	0
problem initial symptom mimic ache amp pain everyday oppression	train	0
administration ignored cdc outbreak prevention advice given wa time	train	0
world health org say ebola spread faster control amd might spread thru airborne transmission	train	0
anti ebola man meet survivor dreaded disease	train	0
declares ebola international health emergency death toll nears warning come u authority warn disease	train	0
second nurse flown specialized treatment via	train	0
stop hysteria yale new hospital patient test negative displaying symptom	train	0
form word ebola old able	train	0
hope become epidemic u biggest reason saying hospital capable treatment	train	0
people unable contact ebola disease expert	train	0
cdc put new webpage entitled infection prevention amp control recommendation hospitalized patient w known	train	0
great news free virus transmission	train	0
obama planning bringing patient treatment tag trending	train	0
ebola prison compound inmate death raise new question	train	0
stand elegant contrast loony think keeping ebola patient keep disease	train	0
probably obvious clarify monitoring mean take temp twice day watch symptom	train	0
know ebola even worst disease heard	train	0
confused contagious symptom present newest patient flew plane symptom big deal	train	0
speak many question cdc leave duncan incompetent hospital	train	0
published earlier today virus disease west africa first mo epidemic forward projection	train	0
find information ebola prevention quite vague	train	0
new ebola hospital overwhelmed desperately ill ebola patient come new center treatment	train	0
updated precaution taken patient brampton hospital ebola like symptom	train	0
happening amp federal ministry health holding joint press conference declare nigeria virus disease free	train	0
man caught dumping formaldehyde liberian water well causing symptom	train	0
breaking new patient reporting symptom transferred hospital two nurse infected	train	0
difference zombie amp republican nothing brain dead spreading disease	train	0
brampton civic hospital treating patient came africa fever ebola like symptom game	train	0
tkmr drugmaker closer getting approval treatment combat	train	0
coordinating w partner stem amp provide treatment west ht	train	0
today ebola outbreak jigawa strengthen disease surveillance system	train	0
patient hospitalized ebola like symptom brampton ontario	train	0
q someone able spread w day person show symptom	train	0
yale new reporting patient admited overnight symptom	train	0
man treated ebola like symptom dy saudi arabia could latest outbreak first	train	0
liberia red cross train operates dead body management team job important stopping transmission amp dignity dead	train	0
fong life collab epidemiology disease control centre currently training youth sensitisati	train	0
vinson advanced symptom though flight symptom contagious	train	0
w highly contagious disease come door every day ready respond	train	0
question people flock outbreak tweet per hour	train	0
guess white secret people give enough shit try new treatment save life fata	train	0
bio war eek treatment center ebola victim looted bloody sheet mattress stolen	train	0
look question science still struggling answer	train	0
nawazsharif nucleus status co c resigns whole status co fall apart like paradigm ik alone pak wid	train	0
unprofitable disease political economy life dy	train	0
support conservation treatment injured koala one koala hospital	train	0
cdc response unreliable life death disease political answer medical fact time replace	train	0
ebola prevention nigeria stop commercial driver carry three behind one reduce body contact	train	0
true dat ebola ph n owerri co message makin round dat shud bath wit salt n water prevention	train	0
world dozen flock new ebola treatment center	train	0
cc gt cc tweep think symptom ebola	train	0
fact symptom take time develop day day person	train	0
need mask lagbaja ebola common	train	0
africa need nuclear bombed stop disease coming like aid r fkin dumb	train	0
current set sicken people previous outbreak disease combined	train	0
ebola virus dangerous disease pls stay away pls b careful	train	0
red cross injecting people go develop symptom	train	0
jumped ebola bandwagon website promoting nonsense prevention	train	0
plain language overview common symptom know time worry	train	0
run bed available treatment facility	train	0
republican hate everybody ann coulter slam free medical treatment american patient	train	0
plan protocol place responding infectious disease outbreak	train	0
giving gej zmapp u pledge support nigeria fight ebola virus disease	train	0
question stealthy virus	train	0
new york hospital patient test negative ebola new york patient gastrointestinal symptom	train	0
explanatory interactive tour ebola symptom	train	0
ebola nurse boyfriend reportedly admitted symptom update via	train	0
mt sinai cdc determined patient kept isolation since tested negative ebola virus disease	train	0
effective current screening many refused boarding due symptom w african airport	train	0
pres sign executive order authorizing reservist help fight n w africa	train	0
health care worker interim guidance monitoring movement person virus disease exposure	train	0
nash got one question like one direction song yes	train	0
situation appears stabilized disease still control west africa htt	train	0
hot zone author answer pressing ebola question surprising reddit ama	train	0
shitting situation worrying one symptom	train	0
scgh confirms woman treated ebola like symptom patient yet diagnosed hospital	train	0
small thing bath salt water cure prevention ebola take na wa oo salt go finish naija	train	0
sign house making fat photo getty image	train	0
liked video ebola virus shock ebola virus released atlanta sewage treatment plant	train	0
ron paul panic much dangerous disease	train	0
avast nurse becomes first infected ebo	train	0
dr ben carson ebola patient united state treatment	train	0
dr recommend salt n water bath prevention	train	0
wen bh war end wen chibok abducted girl come home wen ebola disease end selection dis	train	0
dr ben carson call question cdc secrecy ebola testing	train	0
steadfastly stated past africa disease	train	0
texas nurse nina pham meet president release hospital treatment	train	0
female student started salt amp water ebola virus prevention rumour come tender apology	train	0
follow newsfeed emphasis ecological aspect need stop disease	train	0
first heard brampton civic treating patient ebola like symptom diagnosis confirmed	train	0
breaking patient symptom prompt lock amarillo tx flight w nd vic	train	0
horror movie hype ebola distracting real infectious disease threat	train	0
passengr alert ovr u nurse	train	0
odh ebola call center number providing hour answer question ohioan	train	0
reported boyfriend st infected nurse admitted hospital w like symptom	train	0
still throw peace sign picture people say hi ruining life literally	train	0
course stine topic disease subtopic ebola definition energy needed end life	train	0
cure aid ebola amp woman woman life incurable disease smh	train	0
ontario hospital treating patient ebola like symptom recently nigeria	train	0
shld better shut uch manage ebola disease say cmd	train	0
good night listening morning view aqueous transmission incubus	train	0
update u canada allow emergency use tekmiras ebola treatment reuters	train	0
dr fauci announces nina pham heading n h special clinic treatment	train	0
min set seven sin last night check	train	0
natural disease called	train	0
video inside liberia ebola treatment centre following earlier denial liberia admitted	train	0
infection prevention control recommendation hospitalized patient known suspected ebola cont	train	0
herald anti ebola man meet survivor dreaded disease	train	0
stupid question surviving ebola confer immunity	train	0
created amp spread aid africa guess w h unproven treatment vitamin	train	0
day isolation period almost thomas eric duncan family family friend tell showing sign vi	train	0
sometimes need pray hard fight serious disease	train	0
virus could mutate become airborne danger cross specie transmission	train	0
discussion legislative meeting morning lot question	train	0
health authorize tekmira provide tkm treatment	train	0
guy hear pls use warm water nd salt bath dis morning ooooooooh also pray god save u dis ebola disease virus pls	train	0
u president maintains still difficult disease catch close contact bodily fluid	train	0
day lockdown recorded confirmed case disease test result	train	0
return sender patient dallas texas arriving atlanta treatment	train	0
still paranoid animal deal disease	train	0
need know document expose lie day quarantine contagious w symptom	train	0
jesus stand rock christ every virus ebola aid disease kill heathen shall kill u	train	0
prevention one way prevent ebora disease called ebola put little salt	train	0
telling peole year never evolved	train	0
shirt front disease	train	0
travel country ebola source case banned disease already spreading nation	train	0
cdc answered question yesterday available storify get fact	train	0
video ebola drug pose ethic question	train	0
canada test patient flu like symptom ebola article first appeared independent hosp	train	0
ebola taking heavy toll disease pose greater risk expert say death toll via avma	train	0
nurse may symptom flying reveals	train	0
pls join campaign fb twitter victim ebola disease	train	0
hit hard ebola liberia rd treatment center thanks aka doctor w border via	train	0
potus philosophical objection travel ban needed expert inf disease say effecti	train	0
salty mocking rumoured ebola treatment salty	train	0
tennessee usa knoxville breaking news ebola outbreak fear treatment	train	0
googled symptom ebola worry guy safe	train	0
pres lot question situation	train	0
federal government confirmed two case ebola virus disease lagos	train	0
develop symptom flight may take stop hour huh ban flight	train	0
epidemiologist dr michael oguntoye friday cautioned use salt treatment ebola virus disease	train	0
ebola fact person infected contagious symptom appear	train	0
ebola treatment raise ethical question	train	0
effort stop outbreak leave behind stronger lab emergency ops center amp prevent future disease spread	train	0
u cdc guide ebola symptom ebola patient experience fever headache joint muscle ache	train	0
health ministry prevention plan light announcement	train	0
lmaoo dy tell dis child protected frm ebola frm every viral disease life lol	train	0
one patient tx presby transported emory today treatment according live	train	0
concern local doctor break fear v fact answer commonly asked question	train	0
breaking news four ebola patient discharged disease free minister	train	0
ebola sexually transmitted disease people mind	train	0
cdc ebola question answer	train	0
canada allow emergency use tekmira ebola treatment via	train	0
american still question transmitted need know	train	0
ex holy none disease christ healer pdf	train	0
question news team write u twitter facebook speaking expert midday	train	0
far aware three week onset time may showing symptom airport screening	train	0
mashable cdc frontier airline say second health care worker flew cleveland dallas day presenting symptom	train	0
nurse contractd calld flight	train	0
obama fast tracking visa ben kinchlow question logic leader washi	train	0
people apparently faking get faster medical treatment	train	0
stay calm carry per disease w border number via	train	0
obama administration ignored cdc ebola outbreak prevention advice given washington time	train	0
governor fashola lagos state friday said state fully equipped handle patient symptom ebola virus disease	train	0
dr carrie delone pa physician general take question state readiness	train	0
two patient ebola brought atlanta treatment hospital	train	0
unicef procured delivered ton material essential drug treatment center	train	0
thetrent breaking news dead hospitalised high salt consumption ebola prevention	train	0
ebola treatment get africa like really want get liberia since started	train	0
prevention everyone need adhere liberia pas	train	0
breaking news woman treated symptom perth detail	train	0
eden well epidemiologist u system control disease w	train	0
dr margaret chan declares current outbreak ebola virus disease public health emergency potential spread	train	0
hospital toronto treating patient ebola like symptom	train	0
watch share collaborated video help dispel myth spread promotes prevention	train	0
medical expert tell u best way stop disease stop source obama	train	0
real question bath bond bubble bar use	train	0
see photo year old sierra leonan boy amp others survived ebola viral disease	train	0
survivor lost member family disease august http	train	0
fever symptom masked w otc medicine aspirin amp trusted screen airline passenger	train	0
money talk drug development pipeline via investor pump prospect unproven ebola treatment	train	0
great piece sun candidate creative question good idea	train	0
center disease cntl website info airport traveler health worker etc	train	0
scariest part u apparent unprepared truly dangerous disease u heal	train	0
question whose daughter podium idea	train	0
cousin correct renamed called disease dangerous get	train	0
confirmed ebola case nigeria one nurse dy disease undergoing treatment isolated location lagos	train	0
ebola symptom prevention	train	0
country w transmission intl travel contact case unless travel part appropriate medical ev	train	0
president considers one person charge prevention response	train	0
country shld conduct exit screening person w ebola symptom intl airport seaport mjor land cross	train	0
amp trust nigga	train	0
white house question quarantine nurse plan lawsuit reuters	train	0
remedy prevention crotalus horridus daily	train	0
thing say perhaps calm please read lot amp transmission worry le	train	0
answer question yes	train	0
hahahah got email saying ebola disease fast spreading death count rising	train	0
corruption essentially hemorrhaging disease say governance part cure ht	train	0
obama understand people scared remember airborne disease easy catch	train	0
imagine young girl symptom ebola go hospital find pregnant say thank god	train	0
two american got ebola virus disease treated ebola serum hundred dying african	train	0
great visualization show spread slower fatal disease	train	0
infectious disease expert say transmittable via cough via via	train	0
prevention concentrating effort educating public order prevent panic	train	0
ix prevention control hospitalized patient w known suspected ebola	train	0
true salt bath ebola prevention shit please	train	0
officially declares outbreak commends country diligence end transmission	train	0
ebola transmission review literature	train	0
grayson county high school suicide prevention benefit	train	0
ebola transmitted people wild animal spread human population human human transmission p	train	0
usa ebola outbreak fear treatment serum u ebola outbreak janinebuck	train	0
obscure biotech firm hurry ebola treatment	train	0
ceo sat discus treatment	train	0
flu must ebola soccerball disease feeling sick	train	0
new video bat transmit many disease like ebola	train	0
ebola virus nine thing know killer disease cnn	train	0
salt water whatever cure prevent ebola dangerous rumour haeew nigerian	train	0
look ebola treatment faced resistance experiment outbreak	train	0
really question follow twitter right food blogger chef travel reviewer promoter restaurant	train	0
republic benin announced currently treating nigerian man suspected ebola symptom	train	0
new situation report make depressing reading transmission intense rampant increasing tak	train	0
hav screening nd waiting disease break preventive measure r better curative	train	0
icymi strike texas nurse test positive fatal disease story	train	0
cdc concerned airborne transmission ebola virus	train	0
ebola fact ebola scary disease kill time cure	train	0
ebola virus disease update president goodluck jonathan declares national emergency ebola stop movement	train	0
symptom please share follow	train	0
new tattoo design island pride	train	0
doctor ebola received blood transfusion year old survivor disease	train	0
ebola going come close friend amp family member ijn claim	train	0
quick ebola fact e everyone get b body fluid contact infected people aid transmission	train	0
