Tweets	partition	Topics
health ministry ebola prevention plan light announcement x helpline open saturday pa	train	0
healthcare provider question join twitter chat pm et use hashtag	train	0
experimental treatment something good tobacco plant	train	0
obama allowing enterovirus disease criminal amp terrorist spread u little precaution	train	0
traveled liberia w symptom	train	0
bubble watch biotech boom go far beyond ebola treatment	train	0
transferring patient west africa isolation hospital well resourced country treatment	train	0
prior current outbreak considered rare disease clinical information limited	train	0
time take every precaution contain disease please share	train	0
disease would ebola another thing people seem wearing ridiculous hat	train	0
ok bad disease redundant pay attention really going	train	0
appalling disease setting treatment centre help prevent death	train	0
stupid stupid question ebola million aid money	train	0
set hour hot line ohioan question call detail	train	0
vancouver company ebola treatment clear fda roadblock	train	0
study scientist show ebola virus airborne disease prevented clean keeping	train	0
hr hotline set ensure ohioan timely accurate info question call	train	0
dead hospitalised high salt consumption ebola prevention gistreel dead hospitalised	train	0
know first heard ebola thot sexually transmitted disease speak bemba sound	train	0
ohio usa toledo breaking news ebola outbreak fear treatment serum	train	0
declares ebola international emergency yet another disease africa u	train	0
need immediate quarantine need obama cdc step aside travel issue stop grandstanding nocurenotreatment	train	0
second u healthcare worker diagnosed w walk onto plane headed atlanta treatment	train	0
top ebola doctor dy disease treating dozen cbs news	train	0
screening airport joke people show sign day shut flight africa alre	train	0
know symptom ebola include fever vomiting diarrhea bleeding	train	0
depends long stay without internet	train	0
probably half reason given treatment ebola natural germ could placed	train	0
breaking news confirmed ebola originated vagina virus disease escape conceive child	train	0
ekiti state government set ebola prevention committee	train	0
obscure biotech firm hurry ebola treatment	train	0
people hyping killed worse disease around called killed open eye	train	0
provides information symptom ebola explains virus actually hope dispel false information	train	0
amber vinson boarding private flt emory hosp atlanta treatment	train	0
canada quarantine patient ebola like symptom	train	0
iu health arnett spokesperson say person ebola like symptom came afternoon know yet person	train	0
come best meet childrens need advice infectious disease expert	train	0
lmao aswear talk ebola alone kill befor disease infects naija na wa oh	train	0
nigeria call ebola help question	train	0
ebola survivor describes like horrifying disease via	train	0
wise given ebola take week show symptom weak system affected country	train	0
cable network two question kill everyone love public overreacting	train	0
qld health australia risk getting disease extraordinarily low	train	0
question join happening nigeria	train	0
ebola disease people love fear	train	0
cdc medium stop telling american infectious person showing symptom	train	0
cdc fact person infected contagious symptom appear	train	0
researcher developed potential treatment one small tweak virus molecule	train	0
ebola killer disease stay safe use chlorine wash hand	train	0
virus disease information worker setting	train	0
potus sign executive order authorizing deployment national guard amp reservist support ops west af	train	0
breakthrough u regulator approves drug human treatment	train	0
patient new york ebola like symptom hospital say	train	0
worried answer question	train	0
easiest way dump girlfriend tell police ebola like symptom	train	0
testing underway ontario patient ebola like symptom	train	0
cidrap confirms transferable breath suppressing treatment http	train	0
concern ontario patient nigeria flu symptom via	train	0
scientist warn transmission may airborne urge full respirator frontline health worker	train	0
new newsfeeds committed ecological aspect disease stopping source	train	0
new post ebola expert say transmission ebola virus air possible via	train	0
like fever maybe cc cdc mt fact spread people showing symptom	train	0
mn macy hiring seasonal loss prevention security guard rosevi	train	0
careful deadly ebola disease stay away people fluid sneeze coughing saliva kissing blood etc	train	0
every animal disease man ebola signifies batman time	train	0
update canada allow emergency use tekmira ebola treatment	train	0
canada allow emergency use tekmira ebola treatment reuters canadian drugmaker tekmira	train	0
hot stock update canada allow emergency use tekmira ebola treatment sept reuters canadia	train	0
longer trust authority got ask tough question starting w buddy	train	0
uch manage ebola disease say cmd via	train	0
one intelligent design try better lol	train	0
ebola symptom start malaria cold vomiting weakness joint amp muscle ache stomach pain lack appetite	train	0
quarantine found old testament combat spread disease leviticus amp combine faith practical wisdom	train	0
scientific evidence use bitter kola would either prevent cure ebola virus disease honourable minister health	train	0
spot midst reporting disease west compare cove	train	0
announces explore use experimental treatment ebola death w africa rising	train	0
obama say disease easy catch yet medical worker infected know	train	0
mr flouz nothing funny ebola virus seek allah protection deadly disease instead	train	0
deadbody found near wellawaththa beach police said victim police sergant sign stabbing	train	0
priest miguel pajares flown spain ebola treatment nbc	train	0
african die ebola world say cure american fall ill disease vaccine pop	train	0
national institute allergy amp infectious disease national institute health want vaccinate whole country	train	0
meanwhile everyone know symptom low grade fever low grade fever symptom	train	0
spanish priest become first person infected ebola virus flown europe treatment	train	0
chans latest terrible prank convincing west african ebola doctor actually worship disease	train	0
ferociously googling symptom ebola virus chick behind train coughing storm stay back bitch	train	0
symptom ebola include fever vomiting diarrhoea bleeding	train	0
infection double every week race time amp fund help dr saphire find treatment	train	0
patient commercial flight night reported symptom low grade fever	train	0
love garrix animal amstelveen netherlands	train	0
fear ebola hospital low expectation treatment amp confusion cholera malaria ebola symptom raise motality	train	0
statement travel transport relation ebola virus disease evd outbreak august pm	train	0
allpassengers arriving airport screened symptom st	train	0
largest outbreak record killed deadliest disease	train	0
aerosol transmission real possibility good data dr lisa brosseau univ il http	train	0
apparently patient infectious others exhibit symptom around day	train	0
ebola spread u inevitable say health chief head centre disease control say deadl	train	0
patient still transmit virus week surviving disease discharged	train	0
kenya zimbabwe week waiting period flying stop transmission usa b c	train	0
husband ebola patient watching sign disease david writebol taking temperature every day	train	0
terio like obesity diabetes heart disease high cholesterol sleep apnea gout ebola ebola	train	0
salt water bath theory please ebola virus air borne disease disregard trash seek correct inf	train	0
dallas nurse matt lauer treatment watched violate basic principle nursing	train	0
asked make people go killing people answer question	train	0
house panel questioning cdc go live coverage	train	0
usa ebola outbreak fear treatment serum u ebola outbreak heyyouapp	train	0
stop disease dead track via bb app	train	0
icymi update story north city facility accept waste	train	0
infectious disease expert think answer either immunotherapy putting serum patient vaccine	train	0
new york man hospitalized ebola like symptom going africa test negative virus	train	0
full report possibly airborne transmission	train	0
ebola virus hiv fear evale	train	0
unapproved treatment know work significant number	train	0
launched urgent crisis appeal raise fund help stop spread disease donate	train	0
infectious disease expert concerned mutating becoming airbornec	train	0
reading going yesterday west africa ebola virus disease outbreak prayer go	train	0
concerned ebola worrying wrong disease	train	0
outbreak began december involves transmission guinea	train	0
omfg obama even answer simple question whether would supply drug country help	train	0
thirsty fact ebola check article	train	0
done help nurse say sign failing	train	0
panicking going help could far worse overall impact disease	train	0
second drug allowed treatment ebola	train	0
nigeria asks u ebola treatment drug obama turn request read	train	0
cdc joke controlling disease low list priority blew massive budget inane issue	train	0
four suspected case spain test negative disease	train	0
pittsburgh need attend fox chapel event topic inc senior crime prevention amp downsizing	train	0
nina pham boyfriend symptom amid rumor others quarantined well let socialist misinformation campaign begin	train	0
anyone u contract ebola entire disease government oriented population control	train	0
source yale graduate student symptom child	train	0
know deserve treatment almost every morning driving back amp forth	train	0
min join chat ask expert question	train	0
checked onset suspicious symptom wash sanitize hand regularly protect caring	train	0
patient fully recovered msf treatment centre guinea amp sierra leone	train	0
someone died ebola sawyer came nigeria would know honest question	train	0
naija people pls stop spreading rumour dat dere cure ebola disease pls dere cure yet keep urself clean dat wil help	train	0
discovered ebola virus	train	0
patient w symptom transported care frisco	train	0
believing even fun fortune teller horoscope sign prayer accepted day	train	0
hahaha till month back gentleman questioning mm silence amp lack communication press	train	0
number search reflects big news story ebola virus symptom treatment prevention	train	0
auburn university research team developed potential treatment deadly virus	train	0
day question god asking choose take father away would still	train	0
airborne cdc confirms concern airborne transmission ebola	train	0
lord save family deadly disease called ebola amen	train	0
widespread intense transmission continues must response	train	0
ebola fact website launched educate public ebola prevention ebola prevention	train	0
ebola outbreak fear treatment serum u ebola outbreak	train	0
midday health friday noon infectious disease	train	0
dr fukuda infectious disease contained mysterious disease stopped	train	0
aim bring non treatment	train	0
spanish ebola patient evacuated treatment	train	0
consortium led scripps research institute win million nih find best proposed ebola treatment htt	train	0
symptom early treatment mean much better chance survival	train	0
big fat lie bitterkola possible cure ebola virus disease cc	train	0
lol last person need mention resting ebola treatment	train	0
describe ex disease ebola	train	0
monday morning already serious question	train	0
know people contracting disease dying without noticed	train	0
looking information blog answer key question	train	0
charles watson say testing patient standard procedure infectious disease need panic	train	0
family dallas patient zero thomas quarantine sunday day symptom	train	0
qld health yo woman symptom fever resolved	train	0
pm mez patient shown sign ebola rushed kenyatta national hospital knh omg omg	train	0
much late u built ebola treatment center reportedly sit empty	train	0
symptom ebola please cautious careful	train	0
man like oasis desert msm crook post honest amp logical question	train	0
ebola virus hiv fear yeessssss b afraid wife gerrout hiv	train	0
regret spreading salt water solution ebola prevention mastermind behind reveal	train	0
unbelievable obama told second nurse diagnosed fly commercially even though symptom htt	train	0
funny wanted work cdc disease like scare forgot	train	0
watched talking sense danish tv amp failure innovation model tackling certain disease	train	0
inbox two people went er yesterday concerned showing symptom found require testing	train	0
even name disease ebola even ebola	train	0
finding difficult thing speak sensibly disease without speculating	train	0
evidence ebola drug work outbreak continues spread center disease control	train	0
ebola virus frequently asked question faq wh	train	0
spanish priest struck ebola becomes first person brought europe treatment	train	0
together stop prevention tip	train	0
spread others symptom begin get fact	train	0
people die patient flee hospital many ebola death helping spread disease	train	0
scale scared concerning ebola virus	train	0
natural make natural	train	0
fascinating know new video bat transmit many disease like ebola	train	0
used think viral disease authorised pentagon send troop w africa	train	0
study question day period	train	0
ebola becoming thing like new disease	train	0
g ebola npa issue guideline prevention spread port terminal management nigerian	train	0
programmed blotting paper could soon giving doctor simple disease test reveal infection min	train	0
nurse symptom boarding flight oct et	train	0
concerned ebola worrying wrong disease james ball	train	0
prevention better cure sometimes prevention cure	train	0
new york patient test negative ebola man recently traveled west africa reported symptom si	train	0
death sentence early treatment mean much better chance survival	train	0
congratulates ending transmission statement situation assessment	train	0
question asked morning man wearing protective gear transporting latest patient	train	0
confession apology dear nairalanders everyone heard ebola prevention news	train	0
patient beat disease beat disease stay vigilant president obama	train	0
solution ebola outbreak still u put stop dreaded disease god help humanity annihilation	train	0
black man disease two american able survive ebola	train	0
symptom nausea vomiting diarrhea bloody red eye chest pain amp cough stomach pain severe weightloss bleeding f	train	0
africa amp middle east open question ebola worry	train	0
podcast study blood survivor treatment explained min	train	0
question day want travel ban infected country	train	0
ebola avoided kenya far story disease opinion	train	0
protocol incredibly worrying statement texas nurse fiasco treatment dallas	train	0
judicial watch obama plan transfer ebola infected foreigner treatment	train	0
science answer question	train	0
fear treatment serum u ebola outbreak devastating ebola outbreak	train	0
investor pump prospect unproven ebola treatment	train	0
ebola disease old malaria unlike malaria easy contain follow simple prevention practises	train	0
sneaky skype quiz hahaha hope question easy time wish bored haha	train	0
ebola prevention pls put salt hot water nd bath dis morning spreed increasing day day pls resend save life	train	0
usa fear treatment serum u ebola outbreak usa devastating ebola outbreak	train	0
karen swamped sorry way late answer question donate sam heughan charity	train	0
patient like symptom quarantined	train	0
emergency helpline ebola virus treatment information india	train	0
negativity zimbabwean disease global epidermic avoid like ebola	train	0
question carrie gross charney life long learning	train	0
breaking employment agency berlin placed quarantine woman visited west africa collapse sign ebola b	train	0
need know cdc ebola alert center disease control prevention cdc	train	0
isolation unit case would taken treatment	train	0
st nurse w moved maryland treatment	train	0
please would mean much himd	train	0
bill gate polio treatment campaign say nothing desease contrarily allen m cofounder pledged r billion	train	0
waiting vinson moved flown atlanta begin treatment	train	0
thanks question interview tomorrow help spread word pm	train	0
u sending disease specialist west africa help combat ebola outbreak	train	0
ebola virus nine thing know killer disease cnn economic timesebola virus nine thing kno	train	0
ebola like symptom found brampton patient doctor warns jumping conclusion	train	0
ann coulter call africa disease ridden cesspool victim blaming ebola rant	train	0
unveils revamped prevention web page preparation measure	train	0
kin wicked disease called ebola god help u	train	0
nat l institute health confirms dallas nurse nina pham moved tonight nih hospital maryland treatment	train	0
sister paper live blogging press conf patient treated yale medical symptom	train	0
u doctor ebola victim held hand countless individual terrible disease took life	train	0
dr lisa basso sp mode transmission wholly known proximity infected person risk factor	train	0
judicial watch obama plan transfer foreigner treatment	train	0
april amazing west african ebola outbreak caused new strain disease study via	train	0
skeptical news tune question e	train	0
got authentic information one bank around synagogue ikotun lagos one staff ebola symptom	train	0
frequently asked question ebola virus disease	train	0
abiodun onafuye abeokuta bid ensure ebola virus disease make way ogun stat	train	0
shed light fact answer question	train	0
treatment center fresh body come disinfected amp stored morgue already full	train	0
uncomfortable ebola virus thing arithmetic progression mode transmission express death	train	0
people suspected confirmed w shld treated health worker treatment centre strict safe conds	train	0
ebola union bank worker wear glove prevent contacting deadly disease lagos via	train	0
cdc facing question dallas nurse say checked flying	train	0
malaria ebola symptom damn cold	train	0
marijuana popularly known weed cure ebola virus see gt gt	train	0
sat top infectious disease expert answered question hear say amp	train	0
lmao handle irony spread ebola prevention news spread god w	train	0
newsdesk u disease control call ebola emergency pls	train	0
ebola stuff getting serious every single person get disease double chance spreading nat	train	0
updated precaution taken patient toronto area hospital ebola like symptom	train	0
real fa another disease ebola madness sigh	train	0
study provided evidence transmission ebola specie possible	train	0
handle ebola turn case disease thousand	train	0
pathology disease exposure day temp spike amp come areasonable p	train	0
sailing storage unit used build treatment unit	train	0
study rhesus monkey conducted u army mriid led ebola treatment given health worker compassionate use doctrine	train	0
mumu talk ebola sexually transmitted actually co fluid transmission	train	0
man eindhoven ebola symptom hospitalized nijmegen radboud university hospital	train	0
expert say transmission ebola virus air possible gobe nla	train	0
supply small amount treatment patient	train	0
passenger south sudan placed isolation entebbe airport uganda showing ebola like symptom	train	0
cleveland airport day reported symptom	train	0
ebola epidemic begun need know fact terrifying disease http	train	0
wow look white people infected ebola flown africa expensive treatment america	train	0
know symptom ebola include fever vomiting diarrhoea amp bleeding information email ebolainfo	train	0
question ebola oakland county health division developed ebola virus disease evd web page	train	0
scary among biggest killer disease africa data	train	0
team present new data symptom case fatality rate incubation period may infected november	train	0
tweet note prayer ebola virus threatened african country	train	0
cure found u ebola cure put could prevent buy bathing drinking salty warm water	train	0
ignorance newest disease air kill faster ebola salt amp hot water remedy ebola	train	0
another lagos nurse show ebola symptom	train	0
taken america eye serious disease coming across border	train	0
way b truly safe educate everyone around prevention learn	train	0
bed treatment center open liberia	train	0
situation staff region mainly local treatment important preventing furthe	train	0
terrifying fact ebola disease	train	0
na lady wey sabi cook go get excuse food dey salty dem go say na ebola prevention	train	0
experimental ebola treatment ethical	train	0
early symptom include fever headache body ache cough stomach pain vomiting diarrhea	train	0
today center disease control prevention issue highest level alert ebola	train	0
intensive community health facility transmission pattern amp weak health system currently affected high risk cou	train	0
breaking memorial hospital monitoring patient symptom	train	0
infographic answer question ebola infographics	train	0
bbc news outbreak u nurse criticises quarantine treatment	train	0
patient nina pham moved bethesda md treatment	train	0
nigerian traveling via uae show ebola sign xinhua	train	0
health care worker aboard cruise ship monitored symptom	train	0
thetrent thing know killer disease ebola cnns dr gupta hundred people dead	train	0
even story around treatment center clean stuff	train	0
ebola virus disease evd implication introduction america	train	0
tygerberg hospital ready treat ebola disease	train	0
update declares nigeria free disease new case week	train	0
ebola prevention add maggi amp curry salt hot bathing water proper self cooking rubbish	train	0
brampton civic hospital treating patient africa ebola like symptom cra	train	0
probably created disease	train	0
young man recovered ebola lost family member disease powerful video kenema	train	0
lol racist racism race disease	train	0
fact spread people showing symptom learn	train	0
president declared state emergency amid outbreak show sign slowing	train	0
bioethics director robert klitzman comment ethic new treatment	train	0
asking interesting question lately answer choose though	train	0
dude disease happens	train	0
elderly spanish missionary infected deadly ebola virus fly home treatment	train	0
ebola ecology method transmition sign amp symptom prevented via	train	0
keep black occupied disease taking wealth aid man made aid ebola war depopulating africa day	train	0
updated precaution taken patient brampton hospital ebola like symptom	train	0
campaign target month supported	train	0
refuse call dallas case outbreak say involves worker tragically contracted disease	train	0
four ebola survivor lagos discharged four patient undergoing treatment deadly eb	train	0
fact amp state resource prevention preparedness go	train	0
mobile following nurse nina pham dallas love field prepares fly maryland treatment	train	0
scary ebola reason fear washington ap united state top disease detective	train	0
thetrent thing know killer disease ebola cnns dr gupta	train	0
breaking emergency madrid airport patient symptom flight paris	train	0
canada patient amp ebola like symptom amp	train	0
ebola case november changesthe park record beginning see sign response	train	0
roommate listening old school taylor swift giving questionably intimate massage tell dinner ready	train	0
bad news ebola one deadliest disease world nigeria good news preventable	train	0
airline people contacted gloved tsa officer patted put paid leave	train	0
ebola fear strike canadian hospital patient isolated following flu like symptom	train	0
inside cdc ebola war room cnn dr sanjay gupta take inside center disease control	train	0
judicial watch obama plan bring infected foreigner usa treatment another one	train	0
social mobilization public education critical community must understand importance prevention patient care	train	0
long ugly tradition treating africa dirty diseased place via	train	0
u sending cdc disease prevention specialist amp member usaid dart team help govt w ebola outbreak per	train	0
abiodun onafuye abeokuta bid ensure ebola virus disease make way ogun stat	train	0
fact sheet virus disease	train	0
new york hospital patient test negative ebola new york patient gastrointestinal symptom	train	0
good news nigeria officially disease free week new case	train	0
fg confirms two nigerian ebola virus disease	train	0
dislike virus ebola dislike abi	train	0
stomach pain lack appetite learn sign ebola	train	0
oooh good idea send patient white house treatment love	train	0
obama need release disease kill people fine job killing	train	0
fct school resume comply ebola prevention directive via	train	0
new disease town called idiotic	train	0
armed men loot treatment center patient freed large	train	0
guy remember aztec one wiped disease loll	train	0
proper prevention start proper precaution add community regard	train	0
awesome group climate change denier trying figure science disease doomed	train	0
theherald breakthrough u regulator approves ebola drug human treatment	train	0
health amp human service dallas hospital rep cdc nih usda etc amongst powerful panel captiol hill	train	0
medical news gt gt gt liberia facing massive shortage foreign help ebola n	train	0
question answered infographics	train	0
enters ebola treatment centre tickle diagnosed patient confirms laughing best medicine	train	0
build immunity fight infectious disease like	train	0
fong life collab epidemiology disease control centre currently training youth sensitisation	train	0
apparently someone brampton hospital ebola someone went west africa recently disease reached canada	train	0
long history infectious disease outbreak one concise infographic	train	0
really simple want patient imported homeland disease exist vote dem	train	0
q amp ebola compare infectious disease news	train	0
attempt class ebola international threat disguise fact ebola nigger disease stay away nigger	train	0
monitored symptom ohio none monitored sick	train	0
prop disease expert best counteract medium generated hysteria	train	0
contrary news message scientist saw sign airborne nearly three year ago	train	0
