Tweets	partition	Topics
whaa frieden confirms amber vinson called cdc boarding plane denies id symptom despite report	train	0
body dumped street liberia battle contain disease urban area report htt	train	0
california usa orange fear treatment serum u ebola ou	train	0
pastor e adeboye speaks deadly ebola virus disease lagos report second case deadly e	train	0
window seat airline cleaning process prevent spread disease	train	0
dear republican disease like fully funded cdc appointed surgeon general h	train	0
authority patient extensive contact w man died disease	train	0
unless healthcare worker directly worked elbola patient risk airborne disease	train	0
canada test patient flu like symptom ebola	train	0
evidence based measure prevent transmission mandatory quarantine health personnel via	train	0
huge global danger disease exported crowded nation w weak pub health think asian sub continent talk glo	train	0
ann coulter refers africa disease ridden cesspool victim blaming ebola rant	train	0
people keep coming outrageous symptom relax people	train	0
national institute communicable disease say irresponsible post false comment ebola social ne	train	0
nigeria war ebola disease editorial afrika	train	0
patient symptom contagious cdc partner watching traveler w symptom	train	0
ignorance disease co know people refuse shake hand bcos ebola	train	0
video inside liberia ebola treatment centre following earlier denial liberia admitted suspecte	train	0
true hospital w racist agenda treatment duncan expa	train	0
folly mass quarantine especially disease like ebola	train	0
investor pump prospect unproven ebola treatment drug development	train	0
tryna ebola conscious many people hugged today	train	0
republican budget cut delayed vaccine amp treatment	train	0
love fact love city pumpkin fuckin contest thing many question	train	0
experimental ebola treatment produced genetically modified plant	train	0
uncontrolled vomiting fever explosive diarrhea symptom ebola also symptom recent trip pizza hut	train	0
news update ebola death camp unveiled liberia disease victim rounded removed	train	0
year old ebola treatment could save kent brantly	train	0
strike texas nurse test positive fatal disease story	train	0
president threat humanity	train	0
trying get contact someone authority relation ebola treatment please someone contact soon possible	train	0
unprofitable disease political economy life dy	train	0
aid tuskegee experiment swine flu mad cow disease ebola mcdonalds damn need proof evil	train	0
heartbreaking photo health worker hold baby infected treatment center monrovia h	train	0
disease considered known used weapon include anthrax ebola source	train	0
reading tweet word ebola virus	train	0
go ebola test immediately notice symptom	train	0
da difference btn n one n one	train	0
another lagos nurse show ebola symptom	train	0
ebola next big thing nigeria	train	0
pierce nose pierce nose question ce	train	0
exclusive follows infectious disease drill fact pm tonight htt	train	0
obama spread direct contact bodily fluid patient showing symptom live update	train	0
woke morning finx	train	0
fashola inspects isolation ward prepared patient showing symptom ebola urge prompt report	train	0
ebola n spotlight climate change africa summit continent face unprecedented outbreak disease	train	0
ebola spread community human human transmission infection result broken skin mucous membrane	train	0
symptom may allah save country	train	0
op ed contributor grip ebola liberia leader first quarantined reporting disease	train	0
readme airborne day quarantine contagious w symptom unprotected nurse lying	train	0
nurse rip quarantine policy treatment airport	train	0
ebola treatment people ebola treatment involves providing relief ebola symptom body	train	0
wow pentagon employee went infected area amp show sign	train	0
r fabulous job amp v r proud question tb impact lung organ also	train	0
michael osterholm center infectious disease research amp policy possibility ebola become airborne	train	0
ebola virus disease deadly preventable get fact protect via	train	0
far beyond presidency amp politics kind person allows disease come country uh lawsuit	train	0
many fool trying label healthy respect deadly disease panic common sense	train	0
u built ebola treatment center reportedly sit empty liberia	train	0
second drug allowed treatment ebola	train	0
good question white house play role cdc delay response	train	0
spotlight emerging infectious disease journal	train	0
alert disease spreading india need guard	train	0
airport ask near someone ebola symptom basing test peopl	train	0
second dallas nurse took flight passenger day showing symptom	train	0
officially declares ended transmission within border	train	0
penn vet research may lead future treatment deadly ebola virus	train	0
long football player named ebola valid question	train	0
texas man traveled west africa last week isolation showing symptom	train	0
new post ontario hospital treating nigerian passenger ebola like symptom	train	0
question response affect legacy	train	0
airport staff must trained way world shout st ask question later	train	0
nigeria dynamic health minister onyebuchi chukwu contained resigns	train	0
fort worth doctor kent brantly grows stronger every day ebola treatment	train	0
video ebola drug pose ethic question	train	0
doctor question cdc guidance ebola patient	train	0
wow cdc investigating nd infected nurse showing symptom flew ohio day earlier tha	train	0
life would hav better people preach word god dem dey give attention ebola spread salt water treatment	train	0
second american ebola patient arrives treatment second two american stricken ebola	train	0
ebola question wondering question responded	train	0
obama bringing infected foreigner america treatment	train	0
main construct primary prevention creating awareness preventive measure contact tracing surveillance	train	0
ontario hospital treat patient ebola like symptom hospital ontario ca via	train	0
question concern starting pm call get phone bank web chat	train	0
another woman diagnosed ebola virus disease nnpc clinic facility sh ff	train	0
amazing hear news successful experimental treatment two people virus	train	0
saturday lecture series disease primer	train	0
cure prevention ebola drink petroleum bathe	train	0
tell amber vinson called tell temp symptom amp said could b	train	0
pres sirleaf yesterday announced response treatment training salary food	train	0
disease carrier liberian patrick sawyer urinated health worker told	train	0
big question outbreak answered	train	0
page hospital canada patient visited nigeria brought flu like symptom	train	0
cdc updated infection control guidance u hospital treatment suspected patient	train	0
woman perth assessed ebola returning west africa suffering symptom virus	train	0
plane carrying british army medic arrived sierra leone help run treatment centre official confirm	train	0
learn epidemiology pathogenesis amp clinical manifestation disease	train	0
symptom picture knowledge power share friend	train	0
detail pentagon send engineer amp logistical specialist help build treatment center	train	0
canada sending dos experimental vaccine switzerland trial treatment	train	0
believe trending stfu yet worried amp neither r disease likely get	train	0
reason mandate dallas hospital staff exposed quarantined hospital amp start pretreatment cont	train	0
ebola stricken missionary becomes first person brought europe treatment	train	0
happy salt day one misinformed ebola prevention method	train	0
staff brief pilgrim w info prevention prior departure lagos airport	train	0
basic explained read summary need know amp answer key question	train	0
omg please stop talking ask question	train	0
three generation goddess getting full veneffect treatment co bar woodland	train	0
follow trend tomorrow pm pm feel free ask question ebola cc	train	0
aid worker question government slow response ebola crisis	train	0
liberia managed pas mmia arriving liberia apparently displaying symptom full blown ebola disease	train	0
q amp w corruption permanent stain soul	train	0
ebola outbreak put cdc high alert reuters director center disease co	train	0
thetrent breaking news dead hospitalised high salt consumption ebola prevention	train	0
ebola sign symptom amp prevention tip	train	0
breaking news anonymous doctor release treatment ebola virus	train	0
dr anthony fauci director national institute allergy infectious disease	train	0
year old woman nigerian descent evaluated complaining symptom	train	0
africa health system struggle cope disease kill thousand	train	0
virus question answered center disease control cdc source national institute	train	0
u need get flu shot er like symptom give er break get shot	train	0
even question ameer abdullah	train	0
live chat end pm ask expert question	train	0
need know need get info ebola disease	train	0
nobody immune ebola virus spread message prevention cure wash hand often possible	train	0
virus know symptom	train	0
real suspect question cady heron	train	0
question afraid ask vox	train	0
world health organization frequently asked question virus disease	train	0
check yesterday w answering question available storify	train	0
official anthony fauci md answer question explains virus spread stopped	train	0
difficult issue perspective awful scourge many african still die disease gt http	train	0
ebola pastor e adeboye speaks gistreel lagos report second case deadly ebola disease pasto	train	0
maybe worthy reminder minority include people questionable reason	train	0
ebola patient flew day symptom	train	0
nigerian news alert taiwan raise travel warning nigeria ebola outbreak center disease cont	train	0
monitored ebola symptom ohio	train	0
first symptom headache myalgia fatigue fever many viral infection	train	0
man tested nyc hospital disease via	train	0
bbc news fear factor ebola concern disease	train	0
cdc ebola question answer	train	0
liberia say na pipo wey get ebola virus disease dey miss jagidijagan pipo go scatter heleth centre de carry dem keep	train	0
read drink rumoured salt water ebola cure	train	0
first american die disease	train	0
person infectious symptom appear	train	0
nigerian ask zmapp disease secret cure twitter hashtag	train	0
question cdc protocol via	train	0
ebola outbreak overview	train	0
budget cut delayed vaccine treatment http	train	0
southwestern college lock due student family member flu like symptom rpts student vomiting class unconfirmed	train	0
despite early sign ordinary outbreak aid lagged amp went data	train	0
ebola disease played plague inc shit going die probably greenland	train	0
doctor office screening questionnaire thank	train	0
subscribe youtube page everything	train	0
dozen flock new liberia ebola treatment center new liberia ebola treatment center receives	train	0
breaking news ebola patient discharged certified symptom free day blood test resu	train	0
ebola airborne disease amp cdc know think people intermingling w	train	0
get inequitable population destroys ecosystem leading abject poverty war disease	train	0
symptom show local er would call local er give head first yes	train	0
girl loyal sharp sharp ai breakup bf gf contact ebola	train	0
prudent political temporarily suspend travel infected country called prevention	train	0
patient last traveled liberia new patient isolation w ebola like symptom	train	0
school treatment disease agriculture outbreak dramatically affect everything	train	0
argument shld b worried disease like cancer taleb call empiricism idiot htt	train	0
rule engagement troop sacrifice ask question	train	0
authority two patient extensive contact man died disease	train	0
bring patient u treatment	train	0
asked question ebola answer	train	0
ebola jaunty feel good name ruined giving disease	train	0
opino juris today ebola changed rural virus urban disease became much easier disease reach epidemic level	train	0
risk virus arriving eu eliminated transmission stop west africa	train	0
scientist pioneered idea producing vaccine plant boldness treatment love	train	0
dr fukuda country transmission head state declare national emergency emergency committee	train	0
illegal migrant scared get treatment	train	0
ebola outbreak part africa serious may almighty protect u disease aameen	train	0
ebola saudi arabian man dy saudi man treated ebola like symptom died hospita	train	0
nurse nationwide made clear response ready disease	train	0
cdc nd dallas health care worker flew monday night reporting symptom	train	0
second nurse got ebola flew day symptom happened observation handling	train	0
risk catching ebola via	train	0
enjoyed meeting lovely team today thanks great question campaign	train	0
amber second nurse infected took flight one day reporting symptom	train	0
chaired cobr secure link new york uk leading international drive awful disease	train	0
liked video bat transmit many disease like ebola	train	0
disease undermines foundation long standing tradition	train	0
disease want tag along ebola spread usa inevitable sayscdc	train	0
wellness update sign symptom cc	train	0
woman treated ebola like symptom sir charles gairdner hospital	train	0
happy salt day may god save u frm dis filthy disease called ebola	train	0
said nd hosp worker plane even symptom b c treated	train	0
one question sanity	train	0
nope ebola airborne disease	train	0
smh trent breaking news dead hospitalised high salt consumption ebola prevention	train	0
sign liberian capital monrovia densely populated urban center	train	0
dozen flock new liberia ebola treatment center read	train	0
canada allow emergency use tekmira ebola treatment reuters canadian drugmaker tekmira pharmace	train	0
czar definition guy hired run disease control failing nee	train	0
airport high alert flier ebola symptom fox news video	train	0
right take chance feeling feeling cured disease would give	train	0
ebola scary disease kill amp cure good news get htt	train	0
taylor swift born day later would called really make think	train	0
interested ebola various possible treatment blog post worth reading gt	train	0
question night last night eyebrow still	train	0
new novation clinical resource guide provides education effective prevention protection	train	0
update four ebola patient discharged minister four patient undergoing treatment	train	0
free virus transmission	train	0
said rest assured catch unless patient showing symptom said would use contact tracing find peop	train	0
shaaaaaaaraaaaaap bath salt water nw hence forth prevention	train	0
read miasma history racist moral panic disease	train	0
read quartz daily brief question asked different deadlier disease ebola something airborne maybe	train	0
public ask question mean public hysteria medium pr suttle	train	0
liberian girl weeps death mother father ebola treatment center	train	0
ebola virus portion	train	0
fact person infected contagious symptom appear	train	0
recommendation testing virus disease confirming case	train	0
alert cdc admits possibility ebola airborne transmission	train	0
initiative provide valueable info ton question people knowledge	train	0
early treatment improves considerably chance surviving	train	0
asked question ebola answer start patient able survi	train	0
student recently returned research trip isolation w like symptom	train	0
people sac county monitored got back africa showing sign	train	0
pb update ebola expert say transmission ebola virus air possible via	train	0
polio vaccine experimental ebola treatment	train	0
breakthrough u regulator approves ebola drug human treatment	train	0
westchester ebola expert encourages education disease	train	0
de blasio say treatment nurse nj shameful cuomo give common sense loosens ny quarantine	train	0
know someone ebola follow hashtag learn sign	train	0
breaking individual international space station show ebola symptom white american scrap plan leave earth	train	0
know difference symptom flu enterovirus addition fever	train	0
first skeptical ebola thing might super disease going rekt world	train	0
ah see math question fuck math last time used algebra figure gas bill	train	0
gun violence flu pneumonia cancer heart disease	train	0
jamb question opposite ebola virus	train	0
say prospect containing nigeria hopeful would good thing positive sign guinea	train	0
whoa nurse may symptom day earlier thought took another commercial flight time htt	train	0
take fear disease cruise ship stuck sea bunch	train	0
ya know somehow believe cdc going high alert ebola govt sending people disease never heard u	train	0
world uganda patient ebola like sign test negative	train	0
ebola disease death sentence fashola governor babatunde fashola lagos state friday said	train	0
know ebola viral disease setting trend rumuors regarding going viral	train	0
remember specific question may call infoline press	train	0
usa fear treatment serum u ebola outbreak usa devastating ebola outbrea	train	0
like infectious disease visualisation thank sharing	train	0
pray god would mercy west africa intervene terminate deadly disease dr brantly	train	0
miasma history racist moral panic disease	train	0
state response amp prevention effort	train	0
ryt nw country lyk war diz dealy disease cal ebola	train	0
canada test patient flu like symptom ebola	train	0
nice chilly early morning recovery ride one week ago racing warm e keeping warm	train	0
except ebola killed month fear bola hit epidemic proportion	train	0
donation response fund help child lose parent disease	train	0
obama said jv disease	train	0
visualised compare infectious disease	train	0
patient canada symptom	train	0
missionary stricken ebola deserved special treatment access experimental drug expert say	train	0
unicef reached people w africa w prevention info working day amp night stop spread disease	train	0
aloe amp lobe form word ebola	train	0
new newsfeed twitter taking shape committed ecological aspect disease stopping source	train	0
u authorises canadian treatment developed military contract	train	0
time israel canada quarantine patient ebola like symptom doctor race diagnose man world	train	0
get ready ask question live call show starting p et today website	train	0
ogun writes adeboye protection ebola disease	train	0
infected patient usually contagious start showing symptom day infection	train	0
fear ebola assault kick back take sip malt disease disperse immerse amp f	train	0
outbreak journalist survived disease describes horror contracting	train	0
stuck sam admit beginning questioning sanity time let u enjoy	train	0
hey emoji yet vital question mainstream medium	train	0
transmission vector protect infection	train	0
breaking report suggest brampton civic hospital treating one patient ebola like symptom come	train	0
tkmr close getting approval treatment combat sending share http	train	0
student spent month researching liberia yale new hospital ebola like symptom	train	0
southwest memphis real question	train	0
disease expert dr paul keim explains danger virus via	train	0
please use salt warm water bath pls use soap sponge towel let dry body also drink ebola prevention	train	0
salt water prevention ebola thought people smoke weed	train	0
expanded gol elwa treatment centre largest facility history proud help	train	0
ebola virus fact risk treatment ebola virus disease ebola virus	train	0
reading disease punishes false confidence	train	0
ebola infected patient forced treatment clinic liberia thi	train	0
thing know killer disease ebola cnns dr gupta	train	0
ebola hotspot open new treatment center npr	train	0
meet center everything disease control gt	train	0
bath salt water cure prevention ebola take received several call text	train	0
bigger concern disease vanquished coming back cuz low rate	train	0
health worker flew hour reporting symptom official trying contact passenger	train	0
learn key prevention tip amp share violation	train	0
asked question ebola answer start patient able survive mor	train	0
woman survivor ebola still transmit disease	train	0
infectious disease specialist clear misconception ebola	train	0
symptom sudden onset fever weakness muscle pain headache sore throat followed vomitin diarrhea rash intern	train	0
experimental ebola therapy raise ethical question usa today	train	0
elife epidemiology mapping wild animal better disease control	train	0
epidemic liberia health system collapsing disease spread	train	0
air france plane isolated airport passenger report symptom	train	0
freak ebola freak disease much worse much common	train	0
via number person infected usually spread disease people ht	train	0
burkina faso banned special hunting bat due threat spreading ebola virus disease	train	0
powerful look treatment unit	train	0
woman lied symptom possibly get faster emt response	train	0
sick obama exposing child foreign disease	train	0
good info comparing symptom flu enterovirus	train	0
ebola question asking answered recording sort fact doomsday fiction consulted c	train	0
ten question ebola virus spanish ebola outbreak control africa	train	0
randomly get sick start google ing symptom	train	0
ebola union bank worker wear glove prevent contacting deadly disease lagos see photo pho	train	0
everything need know experimental ebola treatment zmapp mednews via	train	0
safe management patient ebola virus disease e	train	0
ebola fg withdraws approval nano silva treatment minister health prof onyebuchi chukwu	train	0
cdc said carrier pose risk symptom wash plane	train	0
ebola eff disease lnn	train	0
brampton civic hospital treating patient came africa fever ebola like symptom	train	0
cure ebola wish rite	train	0
preferential treatment two american v risking life experimenting rd world patient justified	train	0
ebola virus disease evd kill fourth doctor sierra leone dwnebolaupdate	train	0
teacher assigns partner class every class st week college	train	0
sure sure searched drawer america still find one teaspoon ebola cure west africa	train	0
patriot play itaky likesymptoms	train	0
disease cure elected president first	train	0
anyone know well visited bathroom today would question	train	0
outbreak global health authority warns spread disease international crisis	train	0
cdc quarantine station help limit introduction disease u amp prevent spread	train	0
latest sitrep pull punch saying transmission rampant	train	0
ebola deadly disease prevent today drink bath salty warm water love follower	train	0
breaking second dallas nurse infected travelled air day reported symptom	train	0
want control disease stop source bird http	train	0
early symptom ebola	train	0
patient fully recovered treatment centre guinea amp sierra leone	train	0
mr vaccine oughtta know spread slower fatal disease	train	0
ebola news question surrounding u researcg kenema sierra leone west africa u biological	train	0
compare infectious disease	train	0
dekalb board health hosted forum deadly disease fight fear fact	train	0
question bringing people infected ebola virus right	train	0
people government going start taking disease seriously may god protect u	train	0
thing know ebola nigeria infectious disease epidemiologist speaks	train	0
jackie baillie applying lamonts job struggled answering question	train	0
everything know ebola wrong scoop myth circulating viral disease	train	0
new york doctor get blood transfusion aid worker survived disease	train	0
virus survive surface object contaminated w bodily fluid may spread disease	train	0
u disease expert argues quarantine oct pm et	train	0
simple question aust devoting enough resource towards fighting instead	train	0
thetrent thing know killer disease ebola cnns dr gupta	train	0
release video nurse nina pham speaking trip bethesda md treatment	train	0
dh dozen flock new liberia ebola treatment center	train	0
obbo ebola avoided kenya far others story disease	train	0
sorry dallas nurse even called cdc boarding flight wtf thinking since symptom part problem also	train	0
american still question transmitted protect	train	0
breaking patient brampton civic hospital ontario reported ebola like symptom hospital hi	train	0
symptom ebola informed educated ignorant	train	0
u pres barack obama said premature send experimental medicine treatment ebola	train	0
fear ebola intensified late thursday	train	0
get experimental treatment ebola	train	0
blood test detect virus day exposure symptom appear w	train	0
yale doctoral student admitted yale new hospital symptom read	train	0
survived reason help others fight disease salome tell story	train	0
question answer ebola ebola hemorrhagic fever cdc	train	0
cdc new information show amber vinson may symptom early friday would include flight dallas	train	0
thing know killer disease ebola cnns dr gupta	train	0
good bad ugly disease	train	0
quarantine everyone country infectious disease specialist say time half measure	train	0
yes think saa stop flying west africa	train	0
ebola disease never catch wife husband son daughter member family mighty	train	0
bitter kola may work ebola prevention expert	train	0
virus cause fever headache sore throat symptom followed vomi via	train	0
breaking news emergency passenger symptom via	train	0
called ask mom question somehow conversation turned agreeing join family pumpkin carving tonight	train	0
sign best friend tweet eachother sitting next eachother	train	0
disease called ebola joke	train	0
inside cdc ebola war room cnn dr sanjay gupta take inside center disease control	train	0
nigeria free transmission say ebola run away usa scare p	train	0
digital health map track new ebola case real time disease tracking website developed boston childre	train	0
area intense transmission movement people shld reduced extra measure quarantine shld used	train	0
official mount sinai hospital ny city say man showed er fever symptom ebola tested negative	train	0
ron klain may infectious disease experience heard stay holiday inn express last night	train	0
unanswered question regarding new case raise concern disease	train	0
prevention far better wake neighbor try salt bath thing freeeee na ebola dey talk	train	0
secret serum called zmapp emerged primary treatment american infected ebola	train	0
