Tweets	partition	Topics
watching something first time asking hella question like know outcome	train	0
updated ontario hospital treating patient ebola like symptom	train	0
inside ward designed treat ebola patient deadly disease infected since march	train	0
luke please follow know annoying question would mean world sometimes funny x	train	0
patient flu symptom	train	0
cnns david mckenzie first journalist visit msf treatment center sierra leone take look	train	0
people got shot eblola ebola disease	train	0
form vaccination knw please prevention cure ebola entail staffing crush let know	train	0
australian border protection alert monitor arriving passenger sign deadly ebola virus	train	0
fourth doctor dy ebola sierra leone failed bid transfer abroad treatment	train	0
mr president spread ebola u exec order issuing tyrant lmao	train	0
asking said liberian imported ebola disease egyptian might import al sisi disease nigerian l	train	0
u patient new mexico treated symptom	train	0
ebola question wondering time	train	0
compare infectious disease graphic	train	0
spread direct contact w bodily fluid infected person w symptom	train	0
pedersen also nurse recently monrovia liberia working msfs largest ebola treatment centre	train	0
general overseer rccg ea speaks disease	train	0
hospital ontario canada testing patient exhibiting symptom ebola virus	train	0
ebola hemorrhagic fever disease caused one five different ebola virus	train	0
like bathe salt water onion curry nd thyme wen touch ebola going contact disease straight	train	0
treatment rare chance study ebola	train	0
uganda patient ebola like sign test negative virus	train	0
u africa leader summit press conference st question ebola nd pbo imperial president exec order	train	0
ebola marburg virus start show symptom approximately five day infection chill sore throat	train	0
dr nuttall intense transmission still occurring capital freetown surrounding district	train	0
ya allah prevent u filthy ebola disease disease ameen ya rabbi	train	0
spread continues raise question role national army	train	0
gr american catch bo sign executive order authorizing reservist help fight ebola west africa	train	0
yale research student admitted yale new hospital ct last night w ebola like symptom returned	train	0
need know ebola virus central african disease travelled country	train	0
educate people amp answer ebola	train	0
come strategy fight man made global warming keep deadly disease america	train	0
dr braden say typical symptom ohio	train	0
dozen flock new liberia ebola treatment center	train	0
immune system compromised	train	0
fight infectious disease like one affect everyone	train	0
nurse treated patient suspected first case disease	train	0
ebola patient nancy writebol still weak showed sign continued improvement	train	0
symptom please share follow	train	0
ebola virus frequently asked question faq wh	train	0
tonight question comment tweet	train	0
ultimate detection disease meet	train	0
cdc go level alert ebola first alert since center disease control	train	0
today local health expert take question facebook page	train	0
spanish priest virus arrived madrid carlos iii hospital treatment plane brought	train	0
breaking news obama plan let ebola infected foreigner treatment please retweet	train	0
plz do amp t prevent ebola virus prevention better cure	train	0
really answer question good day	train	0
outbreak ebola virus disease guinea ecology meet economy via	train	0
one many sign indicate ecosystem loss overpopulation inequity climate change war collapsing biosphere	train	0
spread people showing symptom learn	train	0
degette thing fortress america come infectious disease place stop africa	train	0
noo close sc second nurse taken emory hospital atlanta treatment	train	0
thing know killer disease ebola cnns dr gupta hund	train	0
opening island clinic new treatment unit bed	train	0
nurse bitten ebola patient flown switzerland treatment	train	0
ten thing must know	train	0
dislike virus ebola	train	0
patient quarantined ebola like symptom via	train	0
ebola lagos hospital matron took care late liberian victim also show symptom	train	0
ebola virus disease evd formerly known ebola haemorrhagic fever severe often fatal illness human	train	0
cure prevention existing ex	train	0
nearly million child vaccinated preventable disease could worse htt	train	0
bbc news growing concern air transmission	train	0
health care specialist consider different treatment ebola	train	0
early west african country ebola zmapp experimental drug secret serum ebola virus treatment obama	train	0
yale student hospitalized symptom	train	0
nd health worker exhibited sign symptom frontier airline flight passenger contact	train	0
ebola case could reach million month c c estimate report center disease contr	train	0
nurse said lied feel deserted frontlines deserve better treatment	train	0
cdc already taking active step related hospital preparedness treatment	train	0
gave obama admin page threat report prevention recommendation nothing http	train	0
prevention ebola eat bitter kola drink hot salt water bath hot salt water	train	0
theherald anti ebola man meet survivor dreaded disease	train	0
international response slow need help dr jerry brown head liberia largest ebola treatment uni	train	0
way hell getting plane anywhere confined space spread disease	train	0
question second nurse w ebola get cleveland flight info roundtrip reasonable flew roundtrip	train	0
pm exclusive look infectious disease drill hospital prep	train	0
know nov correct date contagiousw osymptoms	train	0
post ebola disease death sentence say fashola	train	0
big exhibition jewel lot people africa dangerous ebola virus disease	train	0
freedom anarchy campaign conscience natural treatment ebola virus exist research	train	0
u center disease control prevention kicked highest response mode outbreak	train	0
patient quarantined ebola like symptom	train	0
nd tx health worker confirmed tested positive amp traveled air reporting symptom	train	0
supposed h exam teacher came minute late min could used solve last question	train	0
deeply sorry texas hospital official apologises treatment mistake	train	0
question ask gt	train	0
ebola killed liberia sierra leone guinea nigeria died malaria diarrheal disease	train	0
new detection scanning device credited eradicating disease	train	0
spark major change	train	0
arabia moh denied rumor second suspected case virus disease	train	0
isbpl scary ebola reason fear united state top disease detective call	train	0
welcome olagbende ayo blog expert caution using salt ebola treatment	train	0
show symptom contagious shepard smith break hysteria	train	0
interviewed would one question	train	0
info south columbus woman claiming symptom told authority would recently traveled west africa	train	0
keep moving people place valid question	train	0
treatment u rare chance study ebola new york time	train	0
yale student treated ebola like symptom spy iwm dia e f qqq	train	0
fact spread others symptom begin learn sign symptom	train	0
michigan emerging disease page reading	train	0
west ham provide answer former man united gaffer question sure	train	0
ebola virus disease hit victoria island lagos nnpc clinic closed news story brought n	train	0
fed watch airline passenger ebola symptom kvvu la vega	train	0
live scott question keep resident visitor health worker safe	train	0
ethical question center ebola emergency	train	0
medium covering let damn disease country	train	0
medium release oxfam launch appeal stop disease deadly advance	train	0
diagnosis nd texas hospital worker raising question virus battle plan	train	0
nurse quarantined criticizes treatment	train	0
dallas presbyterian hospital became worst possible answer question work	train	0
texas nurse diagnosed arrives atlanta treatment	train	0
ebola virus prevention transmission	train	0
nano silver nigeria potential ebola treatment unlikely work	train	0
fact obama let u deadly southern border enter create	train	0
wife flu made look symptom ebola	train	0
common sense thing traveller remember via	train	0
handle ebola human right matter dealing w infectious disease	train	0
could go airborne dr david sander purdue university studied disease decade	train	0
leadership jigawa strengthens disease surveillance system following report spread ebola v	train	0
update cdc admits possible airborne transmission	train	0
learned total theory discovered ebola question wondering	train	0
new post historical view response amp prevention social issue viral mutation key outbreak	train	0
thinking telling leadership make individual sign varsity football player homecoming much work	train	0
man hospitalized new york city ebola like symptom deadly disease official say	train	0
ebola disease fear ebola concern deadly disease	train	0
disease ebola africa state	train	0
possible person symptom test negative later test positive risk patient still monitored	train	0
symptom specific first got high level suspicion scared elain	train	0
warris dis naaa cc tweep think symptom ebola	train	0
ebola experimental drug pose safety ethic question	train	0
u center disease control cdc seeking patent new hybrid strain deadly ebola virus	train	0
woman perth assessed ebola returning west africa suffering symptom virus	train	0
frontier air put crew leave w worry cdc tell frontier nurse vinson symptom f	train	0
succinct pile rot counter treatment virus	train	0
plan transfer foreigner treatment	train	0
researcher find potential treatment future ebola outbreak read	train	0
ebola virus disease become airborne spread physical contact reliable information http	train	0
liberian health worker face angry resident ebola death resident accuse worker spreading disease	train	0
dislike virus ebola yu mean	train	0
rise america stop obama bringing non american patient u treatment	train	0
question raised secrecy surrounding u ebola testing weighs	train	0
woman showing sign consistent ebola infection dy flight india via abu dhabi	train	0
igbo neighbor said someone get ebola disease following footstep jesus hear	train	0
ace blog ebola epidemiology transmission	train	0
symptom st day similar help medical community amp get	train	0
question someone known ebola sick openly leave country plane africa real	train	0
video ebola drug pose ethic question tarik jasarevic world health organisation told bbc th	train	0
never questioned power faith never however pls check ebola first discovered john g lake alive	train	0
latest cdc rd dallas patient nurse traveled air showing symptom	train	0
funny people laugh serious issue like ebola killer disease eyy joke	train	0
cnn three case ebola u one ending fatally two treatment	train	0
get gorgeous nail art charm coupon code design	train	0
fg withdraws approval nano silva ebola treatment produced nigerian scientist read full reason ht	train	0
come usa plane amp w africa temp halt pax travel help protect world first	train	0
hey mainstream medium hack begin ask tough question public get truth	train	0
pas k almost k killed disease eight country via ht	train	0
second worker flight add safety question	train	0
watching hearing congress people actually listen answer single question ask	train	0
priest miguel parajes becomes first ebola victim brought europe treatment warning graphic content mig	train	0
gt gt gt ferry gt war disease nature world today	train	0
ebola understanding transmission pathogenesis dog part conversation via	train	0
symptom sudden onset fever weakness muscle pain headache sore throat followed vomitin diarrhea rash internal external bleeding	train	0
congratulates ending transmission	train	0
question ebola answer question facebook	train	0
zmapp treatment human ebola victim year ahead schedule	train	0
pastor e adeboye speaks deadly ebola virus disease lagos report ff	train	0
tell think ebola symptom want skip work tomorrow help tell lie	train	0
u cdc say experimental ebola treatment unsafe via	train	0
ebola hotspot open new treatment center	train	0
blood ebola survivor may treat disease	train	0
experimental ebola treatment spark know debate	train	0
symptom fever headache muscle ache weakness appetite stomach pain vomiting diarrhea amp bleeding	train	0
question getting answer expert today tweet question get	train	0
gt tweet stupid question nigerian ask	train	0
follow ebola virus fact fallacy iatmusic ebola virus disease ebola vi	train	0
ebola coming plague newly emerging disease world balance book garrett laurie	train	0
prevention control ebola use hand sanitizer reducing risk	train	0
first nurse symptom fever cdc guideline feezie scared ticked govt	train	0
igbo boiz naija guy b lyk ebola prevention business deal salt amp bitter kola	train	0
interim guidance monitoring movement person virus disease exposure cdc	train	0
nurse quarantined tested negative criticizes policy amp treatment	train	0
cure virus bacteria cancer infection disease fuks fact	train	0
amp liberian radio station teaming spread word prevention	train	0
phyllis schlafly responsible ok	train	0
great news free virus transmission	train	0
news alert year old boy rushed hospital bronx ny showing sign symptom ebola	train	0
airborne transmission ebola highly unlikely according research monkey	train	0
health care worker dallas monitored symptom official say	train	0
patient ebola like symptom isolation brampton ont hospital	train	0
new post read gov babatunde fashola address lagosians ebola disease	train	0
woman ebola like symptom taken hospital berlin according german medium	train	0
fact ebola transmitted ebola symptom cause	train	0
second ebola patient arrives show sign improvement science wired	train	0
alien disease doctor nurse gagged threatened arrest talk	train	0
patient symptom force air france plane carrying quarantine madrid airport	train	0
proof obama secure usa ebola czar illegal alien disease czar	train	0
consider making experimental ebola treatment widely available free edi	train	0
building new treatment centre monrovia credit	train	0
breaking news dead hospitalised high salt consumption ebola prevention	train	0
investor pump prospect unproven ebola treatment drug development treat ebola virus far	train	0
question pasta printer invented yet	train	0
gt gt symptom early treatment mean much better chance survival	train	0
ebola contagious time infection manifestation symptom statement emphasi	train	0
prevention get sick	train	0
american still question symptom need know	train	0
fml tip sign high risk ebola zone port potty beach photo dish food menu penis	train	0
minute chat healthcare provider ask question amp participate using	train	0
important article priority virus disease response	train	0
african believe ebola myth perpetrated west treatment death sentence dying	train	0
shut give something cry disease scarier ebola mother jones	train	0
evidence primate transmit ebola air evidence primate transmission direct bodily contct	train	0
abia state health commissioner okechukwu ogah said outbreak ebola disease state	train	0
punchnews expert caution using salt ebola treatment epidemiologist kwara state mini	train	0
sign hope source tell u clt waman battling virus improving	train	0
ebola question judicial watch want answer obama bringing foreigner u ht	train	0
hit hard third treatment center	train	0
grabbing headline deadly disease r spot	train	0
ebola prevention tip also vist	train	0
deadly notorious disease called ebola fever drive numenclature greek word called ebeles mean end world	train	0
questioning stop probably get along	train	0
today announced initial recommendation texas task force infectious disease watch	train	0
climate change predict deadly disease like ebola	train	0
ebola virus disease evd ebola hemorrhagic fever ehf human disease caused ebola virus	train	0
ebola survivor describes like horrifying disease	train	0
second ebola patient wheeled atlanta hospital treatment	train	0
wonder still kept isolation scary similar symptom ebola ebola bit skeptical	train	0
natural reservoir deadly disease	train	0
fight infectious disease	train	0
know thing might come go like infectious disease	train	0
good question man plain clothes seen boarding ebola patient flight	train	0
neglected tropical disease looking different lens david molyneux	train	0
way treat bath tub make question home look like	train	0
threw like six time symptom ebola ebola	train	0
net breaking news dead hospitalised high salt consumption ebola prevention via	train	0
day quarantine contagiousw osymptoms unprotectednurses	train	0
scary ebola reason fear washington ap united state top disease detect	train	0
another shout fabulous patient fully recovered treatment centre guine	train	0
lmao yes breakup bf gf contact ebola	train	0
seekin sol frm afterall sol disease like	train	0
ontario hospital investigating patient ebola like symptom precaution	train	0
spin guaranteed though question raised role post containment	train	0
south arabia suspends hajj visa west africa following outbreak deadly disease called ebola	train	0
belize confirms dallas nurse symptom cruise ship coast	train	0
first call linda serious question	train	0
one person lafayette treated like symptom	train	0
awareness way prevent ebola virus country disease spread	train	0
gotten cure ebola disease	train	0
hse say woman taken mater hospital morning symptom virus thank fuck stupid bitch	train	0
time ask millie question	train	0
canada quarantine patient symptom	train	0
wow patient got shittiest healthcare treatment imaginable interesting detail come comparison stark	train	0
person infected w contagious started symptom	train	0
ebola hysteria raise key question decides live die	train	0
breaking spontaneous protest happening right outside whitehouse holding sign young conservative	train	0
god pray vaccine ebola virus found arresting deadly disease ijn amen	train	0
quarantined denigrated africa western imagination diseased blackness body	train	0
heyy guy join participate answer question win	train	0
answer come question virus via	train	0
survivor could play critical role fight disease via	train	0
obscure biotech firm hurry ebola treatment experimental medicine made mapp biopharma	train	0
colleague answering ebola question one answer info	train	0
nigerian drink bath salt hot water prevention cure really lot change	train	0
ebola last week patient remain isolation til symptom subside test come back negative virus	train	0
experimental ebola therapy raise ethical question usa today	train	0
investment sustainability build infrastructure prevention	train	0
obama ignored cdc advice outbreak prevention center disease	train	0
disease becoming worse everyday ebola may allah protect family friend	train	0
body made available disease transmission peecee amp stoopidity reached criticalmass	train	0
obama admin ignored cdc prevention advice given	train	0
ebola treatment african needed still need	train	0
ebola virus africa continent posing danger world r looking towards patanjali ayurvedic remedy disease	train	0
tony abbott wait get president obama attack disease source	train	0
usamriid yr disease outbreak amp threat public health	train	0
worst imaginable influenza say ebola survivor tom cairn contracted disease	train	0
strong keep going angry thing go wrong give almost sign pointing towards home	train	0
country check sign virus international departure	train	0
ebola symptom start malaria cold vomiting weakness joint amp muscle ache stomach pain lack appetite	train	0
evidence disease like clear work	train	0
inside cdc ebola war room cnn dr sanjay gupta take inside center disease control	train	0
live chat pm ask expert question	train	0
liberia ebola people believe disease curse cured prayer witchcraft	train	0
early symptom flu like season expected bring many false alarm live report	train	0
doh closely monitoring devt use experimental treatment v abroad via ht	train	0
ceo sat discus treatment aemd	train	0
obama vow aggressive ebola monitoring u govt allows nurse fly despite sign infection	train	0
tekmira pharma focus world awaits ebola treatment analyst blog	train	0
gym provide make sure take wit goin word enough wise prevention better cure	train	0
need k cancer treatment abroad please donate please	train	0
closest vaccine prevention let u reach ple minimal access info	train	0
yikes ebola alert burkinabe dy ebola like symptom ghana	train	0
brampton hospital treating patient ebola like symptom	train	0
heath official say risk transmission low went west africa home akron	train	0
statistic kill treatment slowed drug trial process	train	0
since ad photo day nokia hand refuse shake ebola	train	0
ebola craziness test positive symptom develop government testing low risk lab worker w	train	0
fighting dreaded ebola ebola disease death sentence say fashola	train	0
deadly disease set hit northern hemisphere coming month ebola	train	0
lot question nobody care work rather know want learn language historyt	train	0
share prevention info help stop disease spreading	train	0
cdc ebola question answer	train	0
containing worked area suppose become contagious symptom develop quarantine	train	0
find abstract doc	train	0
tobacco use may cancer heart disease emphysema also may cure ebola virus new rj reynolds african warning label	train	0
remember infoline question call press please retweet	train	0
african dhat kina nasty disease amp amp spreadin wdf ebola	train	0
canada quarantine patient ebola symptom	train	0
gbam foolishness kill faster ebola always use brain ebola airborne disease	train	0
breaking news dead hospitalised high salt consumption ebola prevention	train	0
ebola hearing detail real risk deadly disease hitting	train	0
one contact bbm said ebola biblical egyptian disease amp therefore christian protected felt sorry	train	0
israel leading ebola expert could eradicate disease whe u military investing via	train	0
despite easier transmission bush determined avian flu travel ban would ineffective	train	0
airborne cdc confirms concern airborne transmission ebola tkmr	train	0
tracing transmission spread research paper	train	0
experimental ebola treatment could tested infected	train	0
ebola victim generally contagious symptom start showing	train	0
canadian hospital isolates patient ebola like symptom	train	0
also ask military patent lyme disease well ebola virus former disabling agent	train	0
safe meet crew treatment unit bong tomorrow	train	0
nurse may infected passenger different flight especially disease airborne	train	0
woman perth assessed ebola returning west africa suffering symptom virus	train	0
airborne transmission unlikely useful fact today op ed page	train	0
international community really woke disease got america amp europe kofi annan	train	0
airplane spread nearly much disease might think	train	0
look ebola new disease spreading around start fever etc	train	0
symptom early treatment mean much better chance survival	train	0
nurse contracted allowed plane despite reporting fever	train	0
protocol questioned despite government confidence	train	0
smh marijuana popularly known weed cure ebola virus see gt gt	train	0
campaign target month supported	train	0
funny watch msnbc put infectious disease split screen infectious disease doctor reporter	train	0
ahmadiyyatimes u disease control call ebola emergency	train	0
sexual contact transmission mentioned medium know	train	0
ebola outbreak ogun state writes pastor adeboye following outbreak ebola disease nigeria	train	0
female student started salt amp water ebola virus prevention rumour come tender apology read wh	train	0
remember get direct contact person symptom	train	0
obama cancel thursday travel monitor ebola	train	0
obama reveals doctor leading successful prevention policy	train	0
nurse nina pham left texas presbyterian travel maryland treatment	train	0
question vinson fiance quarantined	train	0
nurse find sign southwestern student	train	0
catch africa teh chance die linked	train	0
infographics step effective prevention cc	train	0
question far obama wrap presser ebola domestic issue domestic issue russia	train	0
breaking air france plane isolated madrid airport passenger report symptom	train	0
symptom please share follow	train	0
answer question q turd sewer ebola yes live water	train	0
patrick sawyer question related ebola process one person waka	train	0
thetrent breaking news dead hospitalised high salt consumption ebola prevention	train	0
seems people spreading preventive measure ebola whether logical ebola airborne disease	train	0
ok friend two question haunted house going halloween party	train	0
cdc expert answer question live q amp pm et follow cdc facebook page participate	train	0
ebola severely ill patient require intensive care licensed treatment vaccine available use people pls r	train	0
seriousness outbreak powerful reminder infectious disease strike people anywhere h	train	0
first symptom usually flu like take slight fever cough running nose etc ser	train	0
state union exporting business importing infectious disease forward	train	0
brampton civic hospital treating patient came africa fever ebola like symptom	train	0
convene panel medical ethicist explore use experimental treatment ongoing outbreak west	train	0
forreal longer cartoon network boomerang anymore	train	0
every human author health disease bantu campaign ttg ebola jngan lupa hastag	train	0
special commentary addressing ebola virus disease trauma news sierra leone	train	0
single mistake process removing protective gear spread disease	train	0
breaking news someone suspected symptom south western college	train	0
ebola virus closer look disease	train	0
fujifilm drug eyed possible treatment ebola virus wall street journal blog	train	0
liberian government apologises nigeria ebola virus disease adage g ff	train	0
war ebola sierra leone loses fourth soldier disease	train	0
canada patient ebola like symptom	train	0
clarify point made hearing photo cdc guideline treatment	train	0
ebola virus disease	train	0
heard disease detective helping doctor spread word ebola	train	0
ebola airborne disease bet life gt	train	0
hate people ask stupid obvious question	train	0
