Tweets	partition	Topics
either somebody big as shook building earthquake	train	0
usgsvolcanoes earthquake sf bay area	train	0
one felt earthquake	train	0
ubc researcher unveil earthquake proof concrete	train	0
icing poop cake earth climaxing taking psychic dump	train	0
nepal earthquake thousand demand shelter country little able cope	train	0
bruh trippin earthquake	train	0
hello earthquake twitter waiting deets earthquakessf	train	0
holy fuck feel earthquake	train	0
got stay part lol	train	0
earthquake occurred near coast costa rica utc	train	0
uhh anyone else feel earthquake	train	0
near country magnitude tweet source vardaani baba allahabad prophecy	train	0
thefederman earthquake thanks	train	0
yo feel earthquake	train	0
nd earthquake today	train	0
hell na blood earthquake got fucked	train	0
follow lot northern californian probably seeing lot earthquake tweet	train	0
also felt earthquake ok well bye	train	0
teto reaction earthquake go look window better get kid earthquake training	train	0
ooh big one	train	0
jst may earthquake iwate ken oki	train	0
first earthquake felt day lmao woah	train	0
bruh know felt earthquake	train	0
think little earthquake	train	0
welp fun felt sharp jolt oakland california native even try	train	0
think little earthquake	train	0
woof fun lil earthquake sf cat terrified	train	0
fucking earthquake right	train	0
ok either hella high fat as earthquake	train	0
quick lul earthquake came wrong time	train	0
tweet earthquake haha bye	train	0
latest earthquake daily thanks mcmchoho disaworldnews safdarqiz	train	0
fucking crazy earthquake	train	0
wtf earthquake trippen	train	0
no vamos la verga uncle earthquake	train	0
well quick earthquake	train	0
usgs report norcal area km nw geyser ca utc	train	0
go earthquake post	train	0
remained bed hoped would stop damn prepared	train	0
hank hill gut havin earthquake walk as fat muthafucka	train	0
feel earthquake san francisco currently richmond district	train	0
holy shit please save u dear hanuman ji	train	0
waiting earthquake tweet lol	train	0
please tell someone felt earthquake	train	0
really thought dog went head first something nope earthquake sure anyways	train	0
omg scary as earthquake city lord client hurry as shower hair	train	0
earthquake eastern honshu japan utc epicenter ago depth km	train	0
earthquake trippin lmao	train	0
welcome home earthquake felt west oakland anyone else	train	0
holy crap experienced jolting earthquake right	train	0
reported user app earthquake network report radius km download app f	train	0
insert earthquake status	train	0
earthquake messed head whoa	train	0
jolty earthquake oakland	train	0
ktvu mini earthquake	train	0
earthquake occurred km wnw valdez alaska utc	train	0
actually felt earthquake time	train	0
guac feel come big earthquake stgo	train	0
ktvu bad one	train	0
jolt lt earthquake gt	train	0
apparently earthquake lol feel thing guy kl nk mookyblast wingedwheeler	train	0
could earthquake terrorist attack wildfire minute school still continue pile u work test	train	0
check twitter earthquake	train	0
josheberley mega earthquake heard middle school sure taking time myth start	train	0
bay area earthquake twitter party	train	0
mean want game come back geez earthquake bit much earth	train	0
jus experienced earthquake	train	0
earthquake miyagi ken oki magnitude depth km	train	0
felt baby earthquake sf	train	0
lit as earthquake lol	train	0
earthquake neighbor moving around reggieaqui drewtumaabc	train	0
damn felt glad game oakland happy new moon uranus moving taurus shake	train	0
moving back real time fuck shit pay enough	train	0
omg earthquake hella hard	train	0
anyone else feel slow roll san francisco	train	0
well definitely felt like earthquake	train	0
yo yo yo earthquake yo shoot shit	train	0
checking local twitter see anyone felt earthquake right	train	0
magnitude earthquake km ene west yellowstone montana	train	0
largest earthquake several year shake southern california causing landslide santa cruz island	train	0
mohurstjr mandatory california earthquake post	train	0
earthquake getting nerve trying find new twink outfit zelda right	train	0
building hold major earthquake via curbedla	train	0
little east bay	train	0
soooo baby earthquake	train	0
yo felt earthquake	train	0
holy earthquake batman first time almost got something	train	0
obligatory earthquake tweet long one	train	0
earthquake twitter hello	train	0
thought brother walkin hella loud bitch even home fasholy tiny earthquake	train	0
another earthquake going go another hyperventilating breakdown	train	0
omg earthquake scared tf outta	train	0
omg earthquake happened	train	0
felt earthquake east bay feel	train	0
everybody natural disaster california waiting earthquake like	train	0
earthquake san francisco apartment shaking	train	0
obligatory earthquake tweet	train	0
guess earthquake lmao	train	0
know feel earthquake	train	0
yes earthquake rumbled oregon april prepared major one	train	0
earthquake rock world	train	0
earthquake bay area fam	train	0
check bay area twitter see everyone felt earthquake lmaoo	train	0
woke sleep thinkin earthquake n started cryin saw sister shakin knowin wtf ta b	train	0
day back bay already earthquake	train	0
rip explosive fart cause earthquake end world beacuse wanted box fro	train	0
damn earthquake scared shit outta	train	0
whether convulsion antedeluvian imprest since earthquake pas ingenious idea	train	0
big as earthquake	train	0
stupid as earthquake waking nigga	train	0
timeline currently everybody saying earthquake	train	0
good shake sf	train	0
earthquake hawaii may occurred within	train	0
anyone feel earthquake bay area	train	0
earthquake san francisco quick good jolt sure	train	0
berkeleyside rocked hard college alcatraz	train	0
every time earthquake come straight twitter make sure trippen	train	0
lmao little earthquake	train	0
finally felt earthquake sf cancelled going home	train	0
jaysauceyy feel earthquake	train	0
lmaoooo come earthquake tweet	train	0
earthquake random fuck	train	0
oh good mini	train	0
hello mr earthquake	train	0
earthquake east bay ktvu	train	0
ummm know trippin felt earthquake	train	0
wow kind big earthquake made scarier wearing pant	train	0
holy shit sf amp felt big as earthquake	train	0
yep earthquake least short	train	0
whoa earthquake literally slammed whole apartment like swear felt like hulk smashed wall oh gosh	train	0
sheeesh fat as earthquake shook	train	0
tribelaw recently posted something earlier whoa small earthquake one earlier sorry	train	0
report earthquake sf	train	0
either whole bunch prankster stood outside shook entire house going earthquake	train	0
cool earthquake east bay right nd half p	train	0
earthquake g though	train	0
magnitude earthquake near piedmont california united state san francisco california united state	train	0
else felt earthquake	train	0
damn big as earthquake	train	0
hello earthquake twitter	train	0
thomas paine earthquake snatch cali pacific ocean need one	train	0
earthquake first thing thought let go twitter last time lit	train	0
casual mini earthquake watching evening tv fine	train	0
earthquake bruh thanos comin thru	train	0
confirming earthquake searching twitter earthquake	train	0
anybody else feel earthquake	train	0
earthquake occurred km e kelseyville ca utc	train	0
shoutout one time thought little brother running hallway actually earthquake	train	0
stress orientation obtained earthquake focal mechanism appropriate uncertainty estimate	train	0
cynicgrrl brain torn felt little earthquake listening torus amos	train	0
magnitude earthquake km redlands ca	train	0
thought dad farting turn earthquake	train	0
sorry say twitter first place go think earthquake happening	train	0
distributing food blanket people constantinople earthquake want make donation	train	0
time earthquake twitter	train	0
felt little earthquake east bay	train	0
anyone feel earthquake happened	train	0
think felt small earthquake	train	0
real mad neighbor stomping earthquake	train	0
musta earthquake born shit faze one bit	train	0
lil earthquake mhm mhm mhmmm	train	0
baby earthquake aw cute	train	0
tripping feel earthquake	train	0
city felt swear house hayward fault	train	0
guy feel earthquake	train	0
minor earthquake mag detected near volcano hawaii	train	0
wait friend ask ok lmao one around feel	train	0
felt small earthquake bay area	train	0
maaaan felt earthquake	train	0
mag earthquake mi n visokoi island south georgia south sandwich island detail	train	0
anyone feel earthquake	train	0
big as jolt	train	0
def small oakland	train	0
bart train held earthquake occurred	train	0
felt earthquake san francisco strong heard roar rumbling began	train	0
leave california dc assume moving away natural disaster zone skip earthquake e	train	0
obligatory earthquake tweet	train	0
look earthquake felt lmaoo	train	0
think earthquake happened ready move back balad	train	0
omg tiny earthquake	train	0
magnitude mi borrego spring ca	train	0
lmao shaking earthquake scared tf outta	train	0
definitely earthquake daly city	train	0
yikes crazy earthquake	train	0
bay area long due major richter scale earthquake matter time	train	0
ever hear noise sound like earthquake coming damn truck driving something	train	0
earthquake occurred near marotiri waikato new zealand utc	train	0
come earthquake tweet	train	0
felt another damn earthquake	train	0
watching earthquake bay area spread twitter incredible	train	0
feel earthquake check twitter make sure crazy	train	0
mom said earthquake smoking wtf lmmaoo	train	0
waiting tweet asking anyone felt earthquake	train	0
global disaster alert coordination system alert pm earthquake occurred south geor	train	0
felt earthquake oakland	train	0
yo sorry earthquake real bad gas today	train	0
felt realize saw twitter	train	0
fuck actually lil earthquake america quaking presence bts	train	0
felt oakland pm	train	0
anyone feel earthquake sf	train	0
magnitude earthquake km wnw valdez alaska	train	0
kron news earthquake ssf	train	0
earthquake happen wake sleep	train	0
sf earthquake scared half awake	train	0
oh earthquake good one	train	0
oh hi gentle earthquake berkeley lt	train	0
goldengateblond literally sister like earthquake mom close door really	train	0
huge earthquake oml	train	0
pretty good sized earthquake oakland	train	0
obligatory earthquake tweet felt weak	train	0
whenever earthquake first response go twitter	train	0
little weak as earthquake	train	0
violent fucking earthquake rude	train	0
earthquake scare living shit	train	0
anyone else feel earthquake imagination	train	0
thought earthquake going hit harder scared lol	train	0
know one felt earthquake	train	0
pm earthquake update dutchsinse via youtube	train	0
else felt earthquakebot	train	0
anyone else feel sf	train	0
completely accurate also pissed earthquake app tell random earthquake dubai	train	0
earthquake bad one	train	0
moderate earthquake quake struck near visokoi island south georgia south sandwich island	train	0
big one took gentrifiers bbq cop caller tech company	train	0
woke nap dad slammed front door hard thought earthquake	train	0
either somebody big as shook building earthquake	train	0
ay st ngermusic member earthquake hit	train	0
earthquake min ago bethpagegirl feel	train	0
little earthquake sf	train	0
well say cousin got full california experience giant game mexican food earthquake could ask	train	0
fuck earthquake still getting money	train	0
class really though tb earthquake	train	0
first person tweet earthquake	train	0
even hour home earthquake	train	0
jus felt earthquake	train	0
random earthquake ok	train	0
earthquake san francisco	train	0
holy fuck earthquake wavy	train	0
felt first earthquake since moving california	train	0
getting earthquake reading make want go home even fuck	train	0
downgraded ml czech republic downgraded ml may	train	0
hoemygodddd felt first earthquake wtf	train	0
think got hit earthquake	train	0
earthquake hit thought nothing like since ducking de	train	0
oh sweet earthquake california even though probably best always think time die	train	0
damn bitch earthquake woke game	train	0
jst may earthquake miyagi ken oki	train	0
yes earthquake struck oakland	train	0
yep felt one	train	0
wow weird earthquake	train	0
lmao every time got see trippin earthquake check twitterglad know trippin	train	0
minor earthquake felt east bay stronger elsewhere	train	0
bruhhhhh know felt earthquake	train	0
person omg earthquake spooky	train	0
earthquake dramatic welcome back california	train	0
look like dead end happen last earthquake	train	0
earthquake detector travbtalkinshit	train	0
yo think felt mini earthquake	train	0
magnitude earthquake km nne north pole alaska	train	0
earthquake really rocking damn bed omggg	train	0
magnitude earthquake km e kelseyville ca	train	0
felt earthquake bruh	train	0
well earthquake though	train	0
okay earthquake bad lmfao	train	0
holy crap felt big	train	0
earthquake good home	train	0
kinb earthquake tweet	train	0
definitely felt earthquake minute ago	train	0
earthquake east bay	train	0
yo lil earthquake lol	train	0
mom would talk neighbor helped big earthquake one brought w	train	0
okay goodbye earthquake stardew valley melon better okay	train	0
bro wtf showering amp earthquake happened thought water going fall harder	train	0
gogi felt little earthquake	train	0
fuck bitchass earthquake soup spilled	train	0
either quiet rocket hit building brief earthquake	train	0
know hall felt earthquake	train	0
ooh boy legit	train	0
tiny earthquake got shook	train	0
omg huge as earthquake	train	0
first earthquake summer	train	0
swear lol dog care earthquake sat unbothered	train	0
welp earthquake bay area end near	train	0
well earthquake scared	train	0
damn earthquake shooketh wig	train	0
earthquake sf woo	train	0
well tiny little earthquake	train	0
yea definitely earthquake	train	0
trippin earthquake lol	train	0
halftime earthquake game great	train	0
house shaking think earthquake	train	0
royannaf drjengunter lol month ago headline full oklahoma experience earthquake	train	0
magnitude earthquake shake san francisco bay area centered near oakland sfgate	train	0
little earthquake felt like something hit house	train	0
help tell earthquake going crazy scared wooooo scared	train	0
wow voting home thrilling	train	0
holy crap earthquake	train	0
dad swears earthquake	train	0
solid earthquake second berkeley	train	0
activating earthquake twitter hey everyone feel	train	0
earthquake hawaii may occurred within th	train	0
felt really small jolt	train	0
experienced first earthquake wtf	train	0
hi earthquake twitter	train	0
ah definitely earthquake	train	0
legit earthquake feel california	train	0
yo daughter reaction tremor today earthquake delightful	train	0
basic earthquake tweet	train	0
aspire like mt fuji broad solid foundation strongest earthquake move	train	0
sitting porch felt	train	0
bet size earthquake going say maybe	train	0
earthquake made wonder bad would quake stop watching assuming pow	train	0
ah shit earthquake	train	0
aaah earthquake san francisco tiny still	train	0
expect happen flee big earthquake get hit hurricane	train	0
small earthquake sf	train	0
um hello earthquake	train	0
usgs report norcal area km ene oakland ca utc	train	0
earthquake lol cousin asked like bruh sitting amp park feel shit	train	0
anyone else feel earthquake	train	0
feel earthquake No	train	0
earthquake iwate ken oki magnitude depth km	train	0
tripping small earthquake right	train	0
strike km e min ago effect reported eyewitness	train	0
wait see earthquake tweet	train	0
moderate mag earthquake near east coast honshu japan monday may	train	0
well earthquake felt something floor office	train	0
late night office earthquake	train	0
bruh please tell someone else felt earthquake	train	0
earthquake ohhh shit	train	0
earthquake earthquake yeah earthquake	train	0
th felt czech republic last hour	train	0
stop quaking stop quaking please	train	0
monday january earthquake magnitude shook km n crescent oklahoma depth	train	0
earthquake hello anyone	train	0
first earthquake ever felt dang interesting fridge even vibrated	train	0
thought truck drove house earthquake lmao	train	0
mini earthquake woke halftime nap	train	0
almost crap pant else felt earthquake	train	0
tiny earthquake sf never get used give hurricane day	train	0
know one felt earthquake	train	0
ask bitch monae earthquake gone say mia got fucked	train	0
obligatory earthquake tweet	train	0
really earthquake felt hayward	train	0
cool playoff earthquake	train	0
judging earthquake tweet guessing	train	0
guy feel earthquake	train	0
sunrise sunset sunshine golden beach warmth bit rain lost phone earthquake absolutely	train	0
first time felt earthquake heavy	train	0
yikes earthquake sf	train	0
felt rumble second anyone else	train	0
biggest jolt felt	train	0
sf anyone felt earthquake	train	0
okay either small earthquake roommate going dumb downstairs	train	0
yo another earthquake	train	0
earthquake scared heck	train	0
small shake sf	train	0
oh shit earthquake	train	0
earthquake oakland shook parkmerced pretty good	train	0
holy shit pretty strong earthquake oakland	train	0
bitch earthquake tf	train	0
damn earthquake shook da fuck outta room	train	0
daly city ca pm earthquake sec	train	0
earthquake occurred may utc km ese kofu honshu japan	train	0
magnitude earthquake km ne coldfoot alaska	train	0
another day another earthquake	train	0
clemantine earthquake nepal earthquake haiti tsunami asia humanitarian	train	0
slight earthquake felt	train	0
earthquake happened sf six people posted twitter timeline le talk realtime	train	0
tell torus amos little earthquake sf boyfriend first since living	train	0
maybe could relocate liberal side break float away next earthquake	train	0
anyone feel earthquake	train	0
magnitude earthquake km sw leilani estate hawaii	train	0
omg earthquake ah	train	0
ohhh shit earthquake	train	0
small earthquake sf u	train	0
united state geological survey reported magnitude earthquake followed second magnitude earthqu	train	0
earthquake short strong	train	0
wtf mf earthquake	train	0
quick earthquake hit sf	train	0
lol felt earthquake	train	0
wow earthquake tryna nap	train	0
magnitude earthquake km ese healy alaska	train	0
uhhhhhhh earthquake right	train	0
earthquake occurred km sse volcano hawaii utc	train	0
know trippin n felt earthquake	train	0
little earthquake amp brandons finish nice play end inning	train	0
magnitude occurred mile n crescent oklahoma detail	train	0
earthquake weak smh	train	0
yay gave rumble	train	0
small earthquake happened	train	0
jonasf think radar tenacity caused earthquake san francisco	train	0
mom foreal made turn tv see could hear mf earthquake	train	0
thomas paine earthquake snatch cali pacific ocean need one	train	0
hmmm earthquake first thought hope cut game stream	train	0
feel earthquake lol	train	0
knew felt earthquake	train	0
ok spoke soon earthquake	train	0
ya nigga act like ya ever felt earthquake stfu	train	0
feel earthquake epicenter mile away	train	0
lt insert earthquake related tweet gt	train	0
bay area people yes earthquake	train	0
totally normal type	train	0
quick everyone talk earthquake	train	0
anyone else feel earthquake	train	0
lmafooooooooo everybody library shook earthquake	train	0
magnitude earthquake shake san francisco bay area centered near oakland via sfgate	train	0
usambnepal recalling back earthquake said dictator pm judda samsher finished rebuild devastated nepal	train	0
quite distinct earthquake sec ago sf	train	0
earthquake election anti anti anti low coalition government	train	0
big earthquake whew scared	train	0
big earthquake sf peep felt really strong	train	0
wtf short hard earthquake	train	0
earthquake really bout die week go home	train	0
video pack earthquake emergency kit	train	0
experienced first earthquake lol shit crazy	train	0
san francisco strong rebuild	train	0
earthquake avalanche change afraid cried hurricane	train	0
fear hunger telephone hotline two month earthquake levelled village papua new guin	train	0
wtf small earthquake happened quick second	train	0
ok yeah go twitter make sure everyone else felt earthquake	train	0
uh another earthquake	train	0
woah earthquake sf huge train passing one ever tell	train	0
like first place go see earthquake twitter validation	train	0
crazy earthquake sf	train	0
oh man guy earthquake checking feel	train	0
scary as short earthquake	train	0
anybody else feel earthquake anybody moving back ohio hate shit	train	0
oooof big earthquake	train	0
sitting bed naked eating hummus chip earthquake lol	train	0
either felt earthquake drug strong	train	0
well heart racing	train	0
definitely felt one near temescal	train	0
ready earthquake meme	train	0
felt decent earthquake office anyone else feel	train	0
earthquake suddenly made warm tf	train	0
woah definitely earthquake	train	0
californian contractually obligated notify internet feel earthquake tweet	train	0
life main road california earthquake truck going think small earthquake though	train	0
minor earthquake mag occurred near volcano hawaii	train	0
dear sf another	train	0
thought somebody dropped something roof	train	0
earthquake nepal earthquake haiti tsunami asia humanitarian disaster	train	0
lil earthquake featuring lil tv shaking	train	0
every time think earthquake make sure tripping	train	0
right going start homework earthquake happens yeah	train	0
earthquake kind big come dub shakin amp quakin	train	0
news usgs magnitude earthquake recorded near crescent	train	0
yes felt earthquake fuck see game	train	0
earthquake fine house rattled	train	0
oh hi gently earthquake berkeley lt	train	0
hey san francisco bless	train	0
wow fsint feel earthquake	train	0
nice little earthquake	train	0
thank earthquake waking	train	0
omgeeeeeee biggest earthquake ever felt	train	0
like srsly little earthquake gave little heart attack	train	0
earthquake sister know think wait like min twitter tell u	train	0
bitch class felt fucking earthquake	train	0
earthquake pretty strong bay	train	0
baby earthquake kind thought bread oven exploded	train	0
small san francisco	train	0
earthquake small town educator suffered trauma needed help deal	train	0
um excuse feel earthquake imagining	train	0
tell earthquake smoke year know zooted	train	0
blood pressure high enough halftime earthquake action	train	0
earthquake holy moly	train	0
doubt check twitter see earthquake	train	0
roommate used term california foot massage describe earthquake happened today	train	0
earthquake occurred near sicily italy utc	train	0
know felt earthquake	train	0
humdinger earthquake bay area alive	train	0
mini earthquake sf	train	0
whoa earthquake weird felt like explosion	train	0
believe labyrinthine public toilet wellington god help earthquake one find	train	0
standing kitchen alameda whole room shook five second decent little	train	0
earthquake seized lay dead prostrate home	train	0
first earthquake awake	train	0
eating food watching game big chillin random as earthquake mother nature dgaf bout	train	0
earthquake warrior bout tear house	train	0
omg earthquake dat crazy bed hella moving	train	0
felt earthquake pacific height	train	0
earthquake occurred may utc km se lincoln mt	train	0
oo earthquake yay	train	0
feel whole house shook	train	0
magnitude earthquake shook building oakland california monday night	train	0
whoa solid walnut creek	train	0
anyone else oakland nearby feel	train	0
uh sometimes hand forget hold become two teacup earthquake	train	0
omfgggg guy feel earthquake	train	0
ok felt earthquake though	train	0
get ready bay area twitter earthquake tweet	train	0
holy shit short strong earthquake	train	0
felt earthquake sf else felt	train	0
bruh trippin earthquake	train	0
felt quick one	train	0
key surviving find weak as earthquake work every time	train	0
magnitude earthquake km e entiat washington	train	0
ya feel one	train	0
whoa shit shaker	train	0
latest wenchuan year earthquake revitalizing sichuan brick tea	train	0
earthquake jus scared tf outta	train	0
screw earthquake trying watch warrior	train	0
omg felt earthquake	train	0
magnitude earthquake km wsw cantua creek ca	train	0
fine mini earthquake	train	0
hiredbyashley feel da earthquake	train	0
big earthquake really coming omfg san francisco	train	0
dinner table shake earthquake one bat eye	train	0
train delay due earthquake bay area deep bay area feel shit	train	0
big earthquake end world happen already	train	0
worst part nobody else tweet earthquake mean validation	train	0
earthquake mon may cdt near km n crescent oklahoma	train	0
earthquake happens time go twitter	train	0
earthquake somebody shook twitter building	train	0
thought heard thunder earlier think earthquake	train	0
still school earthquake hit tryna die school	train	0
reuterstv prayer best wish go effected earthquake	train	0
soooo guy felt earthquake right	train	0
tweet fast knew earthquake going happen lol	train	0
earthquake occurred near ghasre shirin kermanshah utc	train	0
earthquake bit sushi best way die	train	0
felt jolt san francisco nd amp townsend second ago	train	0
mini earthquake got shook	train	0
damn earthquake sf	train	0
think felt earthquake	train	0
anyone feel earthquake trippin	train	0
non californian understanding great smarta tweet anything get mocked	train	0
activate earthquake twitter	train	0
rare may earthquake	train	0
first earthquake felt year	train	0
decent earthquake change	train	0
experienced first earthquake like supposed happens	train	0
magnitude mi ca united state	train	0
felt first ever else	train	0
tr mp sending ca thought prayer major earthquake lot	train	0
ok feel earthquake	train	0
earthquake felt sneezing apologize nothing	train	0
little baby earthquake	train	0
opinion move people like fuckin earthquake	train	0
earthquake happened disrespectful	train	0
ok earthquake twitter go	train	0
felt rumble anyone else	train	0
baby first earthquake awake hour	train	0
come earthquake tweet	train	0
wtf house shake	train	0
felt like chair dropped floor texas girl never going get used	train	0
know hear earthquake feel	train	0
