Tweets	partition	Topics
kivw amberalerts gaybeeeeeee alert literally turn phone fucking earthquake fcuking hate	train	0
first earthquake felt luna first	train	0
feel earthquake san francisco	train	0
mom forgot inside earthquake happening deeply troubled	train	0
cue earthquake tweet	train	0
ummm earthquake happened	train	0
shaking disrupting warrior game	train	0
holy crap felt first earthquake	train	0
another freaking give	train	0
jst may earthquake iwate ken oki	train	0
holy shit earthquake scared kid	train	0
tripping earthquake hayward	train	0
go w damn earthquake tweet	train	0
oh hi earthquake	train	0
umm earthquake felt	train	0
bro mini earthquake lol	train	0
relative chinese earthquake victim find hard forget picture	train	0
oh felt like san francisco	train	0
work earthquake dancing healing child moment downc	train	0
daaang whiskey bottle dance first time felt earthquake since moving	train	0
slow gentle earthquake el cerrito	train	0
small as bitch as earthquake	train	0
earthquake plane crashing apartment building lol hope plane	train	0
felt like maybe	train	0
reported user app earthquake network report radius km download app f	train	0
unsure earthquake upstairs neighbor	train	0
earthquake trippen omg spooked	train	0
hello anyone feel earthquake west oakland ezra crazy	train	0
another shaker danville abc	train	0
obligatory earthquake tweet	train	0
watch earthquake twitter time zone away	train	0
damn feel earthquake	train	0
ok sf people big earthquake	train	0
feel earthquake orrrrr	train	0
mom said earthquake came twitter	train	0
earthquake anybody else	train	0
nigga feel earthquake	train	0
aly raiann ok thinking damn earthquake hit	train	0
know earthquake much caffeine today	train	0
heart rate need cardio live country	train	0
hiccuped guinea pig acted like earthquake	train	0
magnitude earthquake km nnw gabbs nevada	train	0
felt earthquake first reaction better big one got watch nd half	train	0
know used twice	train	0
lol earthquake action oakland	train	0
yo earthquake listening test press first wow okay	train	0
jolting earthquake sf	train	0
ayyy time earthquake tweet	train	0
brief earthquake oakland ca	train	0
seriously earthquake thought seizing yaaay	train	0
earthquake neighbor running stair	train	0
breaking ground fracking induced earthquake	train	0
earthquake wtf lmao	train	0
ujuo shey drogo talkactif qween tata friendlysars pity boyfriend table co earthquake jus	train	0
anyone feel earthquake	train	0
dead as earthquake	train	0
bruh know life group full city folk right bible study earthquake	train	0
even magufuli uhuru gave mabatis earthquake know theory reciprocation work	train	0
anyone else feel earthquake	train	0
hi friend earthquake	train	0
nigga feel earthquake holy fk	train	0
act like feel saw dildo swaying shelf	train	0
earthquake occurred km ssw leilani estate hawaii utc	train	0
wow thought earthquake existence mind powerful ugh	train	0
felt earthquake board game shelf wobbled	train	0
missed earthquake thought kid lmao	train	0
ummm anyone else feel earthquake	train	0
anyone else feel earthquake	train	0
wow loud small earthquake	train	0
well guess finally experienced first lab earthquake way start week	train	0
anyone else bay feel earthquake	train	0
felt earthquake berkeley right	train	0
good morning friend	train	0
good shake strong enough knock anything shelf	train	0
even mother earth happy warrior win tonight	train	0
earthquake going heart	train	0
earthquake shook place make miss tornado warning every day half year	train	0
partner community shared first hand experience working ground post earthquake actionai	train	0
lnow felt earthquake house almost fell hill smh shit fallon wall like wtf	train	0
magnitude earthquake rattle east county cbs news san diego ca news station kfmb channel	train	0
uranus degree minute aries shift earth taurus	train	0
earthquake got fucked	train	0
mini san jose monday	train	0
bro trippin earthquake	train	0
earthquake body spazzing	train	0
nice lil earthquake solid size	train	0
baby first earthquake welcome sf kid	train	0
good grief guessing though	train	0
well earthquake cldnt ignore	train	0
anyone feel small earthquake japantown pac height	train	0
oh baby earthquake city	train	0
magnitude earthquake km nnw borrego spring ca	train	0
earthquake talk big as earthquake hit la even hit yet literally live fault	train	0
come earthquake twitter	train	0
earthquake yeah okay	train	0
uh think small earthquake	train	0
going lie felt big earthquake earlier	train	0
finally able join earthquake twitter	train	0
go earthquake tweet lol	train	0
sorry earthquake jbuenrostro fell	train	0
realdonaldtrump idiot suppose recall earthquake site shooting	train	0
earthquake km e entiat washington mon may pt	train	0
think felt earthquake	train	0
earthquake occurred near hawaii region hawaii utc	train	0
alrighty else felt earthquake	train	0
earthquake close kavos greece utc	train	0
kicked caused earthquake	train	0
mini earthquake sf	train	0
supsla yep earthquake twitter activate	train	0
pretty sure experienced first earthquake	train	0
earthquake occurred near island hawaii hawaii utc	train	0
dailycaller need get head seen anti trump would blame earthquake happ	train	0
incoming earthquake tweet	train	0
watching warrior game v san leandro earthquake happened hate earthquake	train	0
windsor earthquake felt	train	0
hello felt first san francisco earthquake waiting since moved omg	train	0
love earthquake twitter	train	0
glad appears okay san francisco make sure base covered sfgiantsfans	train	0
dish talking coronam say whoa earthquake look like	train	0
obligatory earthquake tweet	train	0
earthquake occurred near island hawaii hawaii utc	train	0
little earthquake sf definitely felt castro	train	0
know home feel earthquake	train	0
okay felt earthquake right	train	0
ummm either obese ghost walking house earthquake appreciate ghos	train	0
also tonight missed earthquake ok	train	0
pretty sure building shook bit	train	0
anyone else feel	train	0
minor earthquake strike san francisco giant game v cincinnati red	train	0
magnitude earthquake shake central oklahoma end time headline	train	0
oh hello earthquake	train	0
plugged earphone earthquake happens sign god	train	0
small earthquake san francisco going insane looked window everyone walki	train	0
eek quite rattle	train	0
work earthquake dancing healing child moment downc	train	0
earthquake occurred near iwate ken oki utc	train	0
bay area nice size earthquake	train	0
happy feel earthquake game lol would freaked	train	0
felt earthquake course jumped twitter see else reporting	train	0
earthquake around world may	train	0
earthquake occurred km ene leilani estate hawaii utc	train	0
oh tedious shit hated tidal wave earthquake something ex thick twat	train	0
either berkeley minor earthquake giant bumped whole house	train	0
oop felt earthquake	train	0
holy shit earthquake mainey	train	0
earthquake wind strong tonight	train	0
another earthquake felt san mateo quick intense	train	0
thereformedcrow nah going go earthquake	train	0
one felt earthquake	train	0
sandhyaabc feel earthquake minute ago downtown sf really shook apartment	train	0
cue everyone take twitter	train	0
beavis slob bought trailer home fell asleep waking earthquake	train	0
warrior game earthquake	train	0
venuslux hey lovely friend venus earthquake like	train	0
anyone east bay feel earthquake	train	0
since feel fair get another one tonight	train	0
also great fun thing twitter dot com brag lived bigger fk uuuuu	train	0
tripping earthquake oakland	train	0
another earthquake soon	train	0
oh nice fucking earthquake	train	0
everyone love earthquake twitter	train	0
welp saying due earthquake	train	0
earthquake ok bts twt	train	0
uhhh pretty sure earthquake right heck	train	0
want ong leave fantagio period say earthquake hide room pretend nothing h	train	0
felt earthquake like min	train	0
oh hate earthquake	train	0
usgs report norcal area km ese mammoth lake ca utc	train	0
cat looked looked back shrugged went back sleep	train	0
looking feed guess little sf earthquake	train	0
magnitude earthquake occurred mi ne trabuco canyon ca detail map	train	0
earthquake sf jumping yelling tv warrior game	train	0
either earthquake someone making ruckus next door	train	0
hoo boy slammer	train	0
dad blamed earthquake dog	train	0
fuck right sf final week earthquake time	train	0
lmao look earthquake felt	train	0
felt damn earthquake first time two year thought fr die	train	0
earthquake game little much honest	train	0
yoooo earthquake b	train	0
ricobaby always sitting floor earthquake like	train	0
hey berkeleyside earthquake kid something else	train	0
short sharp earthquake oakland	train	0
newearthquake earthquake km n visokoi island south georgia south sandwich island	train	0
yes sf earthquake	train	0
felt earthquake hope big one somewhere else	train	0
tf punk as earthquake	train	0
ooh long time see	train	0
place rather spend birthday seoc floor	train	0
earthquake occurred near island hawaii hawaii utc	train	0
either quite sharp earthquake someone drove house	train	0
well definitely earthquake	train	0
felt jolt feel	train	0
bruh think earthquake whole apt shook	train	0
hour great earthquake tenth part city fell earthquake sla	train	0
queue earthquake status	train	0
magnitude intensity may jst iwate ken oki n e depth km	train	0
yal felt earthquake	train	0
first earthquake new house live hill tangojuliet	train	0
sister looked like second actual earthquake came like coming lol	train	0
st time feelin earthquake breeze	train	0
damn earthquake woke	train	0
felt earthquake neat california good	train	0
trippin small earthquake happen	train	0
okay earthquake though	train	0
whoa earthquake east bay ca	train	0
chrisrdem omg sure earthquake opened door forcefully glad confirmed	train	0
andy friend one felt socal	train	0
gon lie earthquake thinking went grabbed strap	train	0
earthquake update dutchsinse	train	0
magnitude earthquake km n tonopah nevada	train	0
thought earthquake dog moving bed	train	0
day feeling like going get earthquake behold	train	0
anyone el feel earthquake orrrr	train	0
interesting shaking ground	train	0
bill slob left cow got fight waking earthquake	train	0
everyone wondering yes pm felt small people bu	train	0
earthquake sf like second	train	0
aw hell high af earthquake scared	train	0
nice little rumble	train	0
dude first earthquake ever felt anyways game back bye	train	0
another earthquake bay feel	train	0
lol wtf earthquake	train	0
stay away los angeles alrigh	train	0
whoooa tiny earthquake	train	0
small san carlos california	train	0
trippen mini earthquake	train	0
quintessential bay area experience feeling earthquake hearing roll neighbor compl	train	0
earthquake occurred near island hawaii hawaii utc	train	0
come tweet san francisco earthquake includes yanderejuju gt	train	0
wondering earthquake wheeler driving crib fast	train	0
yoo anyone feel earthquake	train	0
minor concord one good jolt	train	0
headsphones thought someone broken apartment	train	0
twitter confirmed earthquake	train	0
causing ground shake go dub	train	0
earthquake really woke amp nia whole game ft lmaoooo	train	0
either earthquake demon shaking bed scared	train	0
bruh bf jumped bed second earthquake started took u second realize	train	0
exhausted earthquake right	train	0
earthquake really wake	train	0
minor earthquake california think	train	0
twitter turn streaming api find california earthquake	train	0
berkeley earthquake lol	train	0
love earthquake best one ever seen enemy dead	train	0
first help phobia	train	0
ummm earthquake fifth floor big building spooky goddammit bay area	train	0
prepare san francisco earthquake twitter	train	0
prepared week plan getting prepared	train	0
first day school earthquake back berkeley guess	train	0
earthquake felt someone hit wall garage car	train	0
earthquake bruh lol	train	0
mom told experience haiti earthquake tear	train	0
small sf earthquake scared bit p	train	0
kid proud lost crackheads let think long enough make earthquake swallow	train	0
little earthquake sf	train	0
everyone soul tweet earthquake	train	0
either earthquake house possessed	train	0
lol minor earthquake anyone else feel	train	0
earthquake shit lit	train	0
wow nice earthquake love	train	0
earthquake oakland yeah	train	0
believe major earthquake something jesus return amp foot touch mount oliv	train	0
sf little jolt little roll	train	0
cali follower talking game talking earthquake lmaooo	train	0
jonahnro earthquake sure felt worse high rise	train	0
survived third earthquake california	train	0
omg think earthquake	train	0
mi wnw az mi w westmorland ca	train	0
holy crap earthquake rd one warehouse big	train	0
believe small earthquake happened	train	0
wow neighbor window broken tonight earthquake	train	0
whoa else felt	train	0
could swore bed moved sure tiny earthquake demon	train	0
sure lot going u right	train	0
earthquake shaky bandung area	train	0
lmfao shit prepared earthquake kmaackinn	train	0
hope earthquake otherwise wtf happened	train	0
oh yea earthquake trippin	train	0
yuuup earthquake lmao last time twitter cracckin	train	0
felt little earthquake	train	0
seeing sf earthquake tweet	train	0
good hawaii earthquake animation time intensity depth short video	train	0
earthquake construction outside dumb	train	0
fucken earthquake right	train	0
let u play game called earthquake plane flying closer usual since live right block airport	train	0
experienced first earthquake	train	0
wow big one bay area	train	0
swear people know act earthquake happens everyone hop twitter tweet bout	train	0
fucking earthquake tweaking	train	0
felt like small one	train	0
anyone else feel earthquake	train	0
earthquake woke outta nap quickkkk lol	train	0
swear mini earthquake	train	0
earthquake felt massive holy crap	train	0
thought neighbor dropped something nope earthquake	train	0
gone earthquake like right ground gon shake	train	0
big as earthquake	train	0
magnitude earthquake near vlora damage	train	0
experienced first earthquake life crazy	train	0
earthquake seized lay dead prostrate home	train	0
earthquake scared tf omg	train	0
tenerife volcano alert shock earthquake hit brit holiday favourite canary island	train	0
cali gona big earthquake soon please daytime wayyyy scarier night lmao	train	0
felt earthquake first thought fuck bought earthquake experience	train	0
omg earthquake hate earthquake always scared think oh one	train	0
lawd game amp earthquake nerve	train	0
fuck fucking earthquake	train	0
shout second earthquake experience	train	0
good god would earthquake middle warrior game smh	train	0
guy feel earthquake	train	0
mexico earthquake tsunami confirmed capital hit magnitude quake killing least	train	0
oh shit earthquake	train	0
electricb ue earthquake	train	0
another fucking earthquake	train	0
felt little earthquake	train	0
sooo bout earthquake	train	0
anyone feel earthquake	train	0
anyone else feel	train	0
crazy earthquake nbcbayarea ktvu kron news abc newsbayarea	train	0
earthquake twitter hello	train	0
nice earthquake thanks california	train	0
felt earthquake say yeah	train	0
efff earthquake pretty strong apt	train	0
lol mom got scared earthquake	train	0
magnitude earthquake km nne green acre ca	train	0
earthquake class everyone feel prof	train	0
six year later finally felt earthquake	train	0
anyone else feel earthquake	train	0
minor earthquake make sense turmoil hawaii going lot happening	train	0
dale redneck lost tractor fell asleep waking earthquake	train	0
lil as earthquake	train	0
twitter going spammed earthquake	train	0
either earthquake fart massive	train	0
love laying feeling earthquake lol	train	0
magnitude earthquake km ene cape yakataga alaska	train	0
anyone feel little earthquake	train	0
yo earthquake windy fuck	train	0
heard earthquake hometown jeju call parent check	train	0
earthquake scared crap knocked feces	train	0
ooo wee earthquake felt walnut creek ca	train	0
light earthquake mag occurred near mazamari peru	train	0
must big trippin thinkin earthquake	train	0
earthquake bay someone punched apartment	train	0
wtf jumped felt earthquake right	train	0
earthquake earthquake sat	train	0
green earthquake alert magnitude depth km south georgia south sandwich island	train	0
tripping mini earthquake	train	0
feel earthquake trippin	train	0
omg sorry cali need earthquake separate cali america take liberials	train	0
uhhh earthquake wild	train	0
anyone feel little earthquake	train	0
need stir potato	train	0
yoo wtf earthquake	train	0
woo good little earthquake	train	0
come earthquake tweet	train	0
omg earthquake right dog got scared	train	0
else felt earthquake	train	0
dinnertime earthquake new one	train	0
hullo earthquake tweet	train	0
phone legit vibrates hardcore tired feeling like earthquake hand	train	0
first earthquake ever felt	train	0
small earthquake sf sfchronicle	train	0
keywords earthquake san francisco small	train	0
felt like earthquake	train	0
uhhh anybody feel earthquake	train	0
yo twitter feel	train	0
huh mild earthquake hayward else felt	train	0
mildly shocked really happened many feel really happen	train	0
tiny baby earthquake berkeley	train	0
fatttttt earthquake oakland	train	0
think earthquake love check twitter time think happens	train	0
felt reminded u remind check latest podcast sjearthquakes	train	0
come twitter earthquake feel safe	train	0
polhomeeditor duncanm building first earthquake	train	0
felt earthquake lol	train	0
cousin texted let know earthquake back home amp know damn well japan right amp	train	0
anyone else feel mini earthquake	train	0
tammy fat guy left cow got fight waking earthquake	train	0
whoa earthquake still feeling vibration	train	0
magnitude earthquake km nne leilani estate hawaii	train	0
fasholy earthquake know trippn	train	0
quick lil earthquake	train	0
earthquake warrior fan getting ready second half	train	0
ok hallucinate earthquake think truck hit building	train	0
know earthquake kit set ready big mama arrives	train	0
strong quick jolt oakland	train	0
ether demon therevwas earthquake	train	0
holy shit earthquake	train	0
anyone feel earthquake	train	0
prepared would earthquake occur help little kcal giving away free	train	0
anyone else feel earthquake	train	0
fuqqin earthquake interrupting netflix evil genius binge	train	0
ooh earthquake love california	train	0
earthquake upstairs neighbor running around	train	0
really k tweet earthquake really sum weak as mf	train	0
magnitude earthquake km w volcano hawaii	train	0
felt buttock wiggling earthquake inner sunset	train	0
big earthquake come want let know love	train	0
every time feel earthquake check twitter make sure real lol	train	0
brittain senate pfefferbenji kanyewest mate haitian un helped much earthquake relief coun	train	0
feel earthquake omg	train	0
berkeley hill quick shake nothing major berkeleyside	train	0
little earthquake sf feel jessie uncle got asked felt something	train	0
thinking friend fam sf experiencing earthquake right stay safe love	train	0
earthquake swarm continues th day km away home two magnitude quake	train	0
tryna eat ramen earthquake made spill	train	0
earthquake tighs honey	train	0
facetiming ashley amp freaked co felt earthquake	train	0
give second register usgs	train	0
know heart beating fast felt earthquake	train	0
magnitude earthquake today minute ago may utc location epicenter	train	0
mmmmm sandwich earthquake	train	0
nice little earthquake	train	0
earthquake strong fuck	train	0
earthquake occurred km e entiat washington utc	train	0
damn feel shaking	train	0
boom anyone feel jolt	train	0
hmmm mild bit earthquake though sure others noticed	train	0
ktvu felt earthquake inner richmond district	train	0
oakland pm second long	train	0
ready earthquake tweet lmao	train	0
felt earthquake oakland	train	0
earthquake felt kind good	train	0
omg wa earthquake	train	0
earthquake occurred near hawaii region hawaii utc	train	0
felt tht earthquakei swear thought niece something smfh	train	0
obligatory earthquake tweet	train	0
strong earthquake oakland hill	train	0
first part felt like huge guy jumping hallway outside apartment	train	0
biggest feeling gunna earthquake	train	0
earthquake shook wood lip	train	0
think wee earthquake san francisco	train	0
going count many time see earthquake tl brb	train	0
davidkeithkerr oh awesome first time experience earthquake	train	0
magnitude earthquake shake san francisco bay area centered near oakland via sfgate	train	0
mario badescu facial spray aloe herb rosewater oz	train	0
one felt earthquake	train	0
life flashed eye earthquake right	train	0
seeing folk tweet strong sf bay area	train	0
worried earthquake oil drillin yellowstone volcano go full krakatoa u	train	0
omg omg omg omg omg omg earthquake still know feel one besides go twitter	train	0
honest earthquake twitter best twitter	train	0
verlindavjackso earlofstonewall imagine never forget earthquake affected lot friend amp family	train	0
niigga one feel earthquake	train	0
earthquake mean dub run	train	0
magnitude earthquake km nw anchorage alaska	train	0
holy shit felt earthquake california bay area warrior v rocket game intense	train	0
know earthquake kit set ready big mama arrives	train	0
pretty sure experienced first earthquake san francisco shit weak asl	train	0
thank twitter letting know losing mind fact earthquake	train	0
shaking headache must earthquake right	train	0
either fan getting extra raucous felt	train	0
earthquake earthquake mom start saying hail mary father sit unbothered hahahha	train	0
experiencing first mini earthquake san francisco reminds costa rica	train	0
anyone felt small sf	train	0
exceedinglyglad devinnunes want people pray earthquake really	train	0
got city jumpin boom earthquake	train	0
listening live podcast recording earthquake quickest way news listen live podcasts	train	0
dat earthquake though	train	0
pretty sure small earthquake	train	0
like double tap berkeley	train	0
magnitude earthquake shake san francisco bay area centered near oakland	train	0
anyone else feel earthquake	train	0
think felt earthquake	train	0
magnitude earthquake km n visokoi island south georgia south sandwich island	train	0
scrolling twitter n feel earthquake hit search real quick confirm	train	0
sleeping nice peacefully hear like raging earthquake yelling downstairs hail crazy	train	0
nothing like little earthquake get morning started tulsa	train	0
voice thunder lightning great earthquake since men w	train	0
bad earthquake oakland something wrong old building	train	0
year old actually cried lois lane died earthquake got got	train	0
fucking minor earthquake going ground loudly trembled like time last minute	train	0
freezdrdromance actually heard rumble southeast wall call earthquake crunch would	train	0
ho lee fuk	train	0
oh hey earthquake three dog hanging loved yikes	train	0
felt lil earthquake	train	0
hoo big earthquake	train	0
knew lose mind sleep deprivation used earthquake	train	0
hell earthquake amp shit	train	0
think fairly large sized earthquake felt san bruno	train	0
either house shook reason fucking huge earthquake	train	0
anyone else feel like second	train	0
year designing earthquake proof building geography mr lyng	train	0
earthquake bitch ktvu	train	0
feel earthquake one bit walking outside	train	0
hakusan keeping community earthquake zone safe help big data analytics cloud technology f	train	0
earthquake iwate ken oki magnitude depth km	train	0
feel like person la earthquake emergency bag pre packed going year re	train	0
bit earthquake felt pacifica double thud rumbly roller	train	0
lmao earthquake hope die	train	0
lol earthquake oakland even feel	train	0
first time slept earthquake	train	0
man straight lying earthquake nut	train	0
woooooaaaaah first ever earthquake	train	0
magnitude earthquake km deltana alaska	train	0
ok nice sized earthquake	train	0
sorry see earthquake totally disappointed change everyth	train	0
nigga wtf dat ah earthquake	train	0
damn earthquake bay area	train	0
ooo another earthquake	train	0
sharp earthquake sf maybe ish	train	0
jus feel earthquake	train	0
felt earthquake first time sf real sf resident	train	0
well earthquake lmao	train	0
magnitude earthquake km leilani estate hawaii	train	0
ummm earthquake anyone	train	0
well one firm one second earthquake felt berkeley	train	0
popular game minecraft teaching kiwi child earthquake preparedness tvnz	train	0
bomairinge better hope air balloon earthquake bro	train	0
earthquake downtown berkeley berkeleyside	train	0
kcbskcaldesk mention oakland earthquake	train	0
dead twitter never fails w earthquake confirmation love	train	0
anyone else feel earthquake scared living crap	train	0
bnev realdonaldtrump great job nk nuclear test site collapsed earthquake trump nothing	train	0
hope earthquake volcano	train	0
earthquake twitter activate	train	0
even feel earthquake	train	0
softmush earthquake felt something door shaking	train	0
anyone else feel earthquake lol	train	0
thought felt earthquake last night	train	0
scary as earthquake	train	0
everyone earthquake tweet	train	0
earthquake sf rest sf go	train	0
pretty good earthquake	train	0
san francisco experienced minor earthquake	train	0
pm earthquake update dutchsinse via youtube	train	0
sheshhhh think another earthquake coming	train	0
got damn earthquake	train	0
holyshit earthquake san francisco	train	0
felt earthquake whoag	train	0
felt earthquake oakland	train	0
earthquake thump building shake waiting see	train	0
hell ya excited earthquake tweet	train	0
lawwwwddd almost ran outside breastfeeding	train	0
magnitude earthquake occurred mi e pamandzi mayotte detail map	train	0
definitely wondered upstairs neighbor earthquake	train	0
california earthquake twitter thing hope ok	train	0
jaysin duhhhh earthquake	train	0
lil earthquake never felt safer middle bed child pose since g	train	0
pretty good shake berkeley	train	0
ok felt earthquake sf	train	0
hello earthquake owo	train	0
small earthquake hit convinced san andreas fault going rupture	train	0
earthquake mon may cdt near km n crescent oklahoma	train	0
warrior game causing earthquake	train	0
queue earthquake tweet	train	0
