tweet_id	tweet_text	original_filename
1066360758961881089	@khloekardashian Please help Aaron Rodgers12 raise money for California fires by retweeting retweet4good, Thanks Doll	california_wildfires_2018_dev.tsv
1064740650380288001	Three days until Thanksgiving, and if you want to help victims of the California fires who are not as blessed, please do. Reader discretion is advised for this story:	california_wildfires_2018_dev.tsv
1066426264385454081	Hello #CatsOfTwitter #dogsoftwitter and fans of #Caturday ὣD My cat Love (and I) wants you to help FIND and reunite young Laila with her furbaby Peanut. Many campfire pets are lost from the California fires, and their humyns need you now. Tanksyou, meow	california_wildfires_2018_dev.tsv
1065682138148888576	my friends boyfriend and his family lost everything in the fire in northern california if you can please donate to his gofundme or retweet to help them out Ὁ6	california_wildfires_2018_dev.tsv
1062117408918265856	@kanyewest @adidas my best friend lost everything in the camp fire. He got the triple white yeezys the day they dropped, he weather treated and was waiting for an occasion to wear them. Unfortunately his house burned to the ground so he never got the chance. Can you help out?	california_wildfires_2018_dev.tsv
1067042990772944896	Could you all please do me one small favour? Have a look at my timeline and RT one tweet to help those affected by the fires in California. There’s a whole team who works really hard on this. You can find them using #DisasterAssistTeam. Thank you ὚4	california_wildfires_2018_dev.tsv
1062857655197163520	@lizziejohnsonnn California Residents please donate chapsticks, face wipes, disposable wipes, hand creams, lotions, water bottles, electrolytes (in any form) to your local firehouses. They will need these supplies as they go to fight these fires.	california_wildfires_2018_dev.tsv
1065268740525355009	Dont just like thislisten to the msg and follow the instructions on the retweet to help out California fire victims! #retweet4good	california_wildfires_2018_dev.tsv
1064753548318072832	DNA Samples Needed to Identify Camp Fire Victims	california_wildfires_2018_test.tsv
1061384261570195456	More help for those stuck with animals!! Please pass along! The power of social media can be incredible ❤️❤️ #LAFires #CaliforniaFires #california #Woolseyfire #hillfire #malibu #AgouraHills #Calabasas #losangeles #LAFires	california_wildfires_2018_test.tsv
1062060666301763584	Please help my friend who lost everything in the CA fires. One of the sweetest most caring people I know. Every little bit helps.	california_wildfires_2018_test.tsv
1064779715423158272	Thread. Please donate ὄ7	california_wildfires_2018_test.tsv
1065662254559969280	Read. Then have a good cry. Then find a way to help those in need.	california_wildfires_2018_test.tsv
1065284174754410496	I know some of my followers are in the Bay Area and I know some of your are radio journalists. A radio station in Northern California needs your help.	california_wildfires_2018_test.tsv
1065696823984168961	RT @RealJamesWoods: High need children’s items needed ὄ7#SoCalFiresJamesWoods #CampFireJamesWoods	california_wildfires_2018_test.tsv
1065681411955290112	For those who lost everything, though, its a different story. Here are a list of charities who are helping #campfire victims:  Note that at this point, financial donations are needed more than anything.	california_wildfires_2018_test.tsv
1064370128635056128	ὒ5Ἑ511/18 Lost Coast Hay is teaming up w/ Birch Valley Ranch Equestrian School ➡ #donations of hay *NEEDED* for #horses #livestock impacted by #CampFirePets Birch Valley Ranch FB ὑ7   #CampFireJamesWoods #DisasterAssistTeam	california_wildfires_2018_test.tsv
1066715801263071232	@BBCBreaking I’m a camp fire victim who’s A middle class individual who lost my home, friends, my entire community&amp; today am homeless and have no place to go, I do have a job but over 50,000 people went looking for homes right away creating nothing available.Kids are scared,help	california_wildfires_2018_test.tsv
1064651400783683584	Please go support this cause. Many people are homeless, hungry and need your help.	california_wildfires_2018_test.tsv
1061845132335558656	California seeks disaster aid as wildfire death toll mounts  via @business	california_wildfires_2018_test.tsv
1062105091052847109	RT @ChelseyCrisp: Thank you @nytimes for an honest resource when we’re looking for ways to help. Everyone please give what you can. :	california_wildfires_2018_test.tsv
1064662961308995584	Here is a list of supplies needed for the #Camp Fire Restoration Project (Phase 1): -Wattles -Straw Bales (Prefer Rice Straw but any with no or low seed is good) -Wood Chips (Local tree	california_wildfires_2018_test.tsv
1066727142820651008	@Alyssa_Milano We have our own citizens that need help! Fires in California were devastating! So NO!	california_wildfires_2018_test.tsv
1066957051488845824	When I was visiting California last year, I encountered countless homeless people in Los Angeles and San Francisco. In desperate need of food and shelter. Many of them with obvious mental health needs. It was quite astounding, honestly. Theres a great place to start helping.	california_wildfires_2018_test.tsv
1064315320712736768	RT @_HoboJohnson: people are losing theirs homes and lives. please help if you have the means	california_wildfires_2018_train.tsv
1061458593977901056	Good Friend Geoff Reed who lived in Paradise California was evacuated on Thursday from the fires with his two girls. They have lost everything in the Camp Fire in Paradise. Current assistance is needed for housing, clothing, food for Geoff and the kids	california_wildfires_2018_train.tsv
1065702928424542208	Please help my friend Paris Lincoln .. her house was burned down in LA fires she was only able to get out with a suitcase	california_wildfires_2018_train.tsv
1065533022072647681	@EmluvsSPNMarvel (Read entire thread) Please help. I know I’m not losing my home to the fires in California, but my financial situation is dire, and I have no family around. Christmas just isn’t going to happen. I need all the help I can get ὉC	california_wildfires_2018_train.tsv
1061321072627245056	Baby2Baby is working to get high-need items to children affected by the ongoing Camp Fire, Hill Fire &amp; Woolsey Fire in CA. Help us put diapers, wipes &amp; other essentials into the hands of families who have lost everything by purchasing from our registry:	california_wildfires_2018_train.tsv
1066462789093507072	So where are our sex workers that have been in the wake of the giant camp fire wiping out neighborhoods? Are yall safe? Do you need extra resources or help? DM me please.	california_wildfires_2018_train.tsv
1061250890823356416	Please someone, anyone help us.	california_wildfires_2018_train.tsv
1065705443383697408	@Gintonious Simply bc a people R isolated doesnt constitute happy or peaceful. That reminds me of the green philosophy of leaving a forest unmanaged bc its natural, but it results in forest fires note California, Washington &amp; Oregon in USA. Theyre a fierce ppl who may need help.	california_wildfires_2018_train.tsv
1063085347993780225	@CBSNews Rebuild burnt down California with more water power, cell phone looking towers but they spray water in circles to cover drought dry areas to prevent fires spreading they could mount their solar panels on them also to power pumps and other power needs	california_wildfires_2018_train.tsv
1065339588766396417	RT @jamalagnew: Retweet this y’all to help those affected by wildfires in California!! ὤFἿE	california_wildfires_2018_train.tsv
1061361031639777280	Please help if you can. Family friends of mine lost everything in the #CampFire. I never ask for RTs. For this, I am. Please and thank you. ὉE	california_wildfires_2018_train.tsv
1065506244432023553	if you can help, please do so for all those in California for whom the wildfires have made this a horrid Thanksgiving	california_wildfires_2018_train.tsv
1064542114061656065	Our hearts are w/the entire community of Paradise &amp; surrounding areas affected by the Camp Fire. Please consider a tax-deductible donation to the Camp Fire Relief Fund to assist the many community organizations serving evacuees &amp; first responders. @NVCF	california_wildfires_2018_train.tsv
1065709270451216384	#Retweet4Good. C’mon y’all! Let’s all help the Camp Fire folks. Donations can also be made to the Red Cross.	california_wildfires_2018_train.tsv
1066836137409478657	My very special friend @XTinaTaft has lost her mum in the fires in California. The local government gave her no warning or evacuations. Please help her GoFundme, she is an only child of a single mum who was the closest person to her. There is a cover up.	california_wildfires_2018_train.tsv
1062118541694984192	We need help in #California! Please, anyone with influence please see if you can get POTUS to sign the darn FEMA request. My god, it isnt a holiday when folks have no place to go! #wildfires please retweet @fema @SenFeinstein @RepJimmyPanetta @NancyPelosi @WhiteHouse @maddow	california_wildfires_2018_train.tsv
1061792816555327494	Remember @WCKitchen is there with two active kitchens feeding shelters, first responders etc. Any food water need we are able to respond immediately! @natemook #ChefsForCalifornia	california_wildfires_2018_train.tsv
1066747713310535680	Please #donate #CampFireParadise	california_wildfires_2018_train.tsv
1061314127237443585	@justanoilguy @RealJamesWoods @RadnPlaid The shelters (some of them are on my twitter feed) will be needing these things. A should to cry on for some people will also be needed. List of actual items here:	california_wildfires_2018_train.tsv
1061259573250719745	California fires: This is a basic list of what people who have evacuated will need right now. HOW YOU CAN HELP. RT. #californiafires How to help:	california_wildfires_2018_train.tsv
1064282337444331521	WE NEED YOUR HELP @GirlsvsGhosts Director of Scheduling @Fayeray34 &amp; her family has lost everything. Please find it in your heart to #SHARE # #RT. By #payitforward you would be providing Them the much needed assistance that they need!	california_wildfires_2018_train.tsv
1062851708034793472	Again California is facing wildfires and is in need of help. There is many ways to lend your help and support to your fellow humans, pets &amp; wildlife. Please check the link to see how to help. Hoping all our friends in California are safe. Thank you- Isms	california_wildfires_2018_train.tsv
1062880786091659265	The Camp Fire Animals Need our Help❤❤❤❤	california_wildfires_2018_train.tsv
1062106178027769856	Looking for Fay Hubert Sherman and his wife Anne Thomas Sherman in California fires. Please help if you have seen them or if you have info. ὤFὤFὤFὤFὤFὤFὤFὤFὤFὤFὤF	california_wildfires_2018_train.tsv
1066809823889485824	Please consider helping comics/animation pro (JEM, AMETHYST, much more) and great person @christymarx. She and her husband lost their home due to the recent California fires (among many others) and could use some help.	california_wildfires_2018_train.tsv
1065382748037279744	Also to my California friends, if at all possible, perhaps set a few extra places at the dinner table tomorrow for those affected by the fires. Maybe, just maybe, being in the presence of kind people and good food will help them forget their problems for a few hours.	california_wildfires_2018_train.tsv
1064379156488540160	Therere fire survivors &amp; children tonight thru no fault of their own shivering, w/o comforts, MED care or loved ones (some dead, others missing or separated), homeless with sick in crowded shelters, cars, flimsy tents or cages, vulnerable, little hopeSend help/ release caged!	california_wildfires_2018_train.tsv
1063174489104617472	So I need a good tent/blanket company who wants to donate to #bstrong to aid the California fire victims. Bring it on! #thisisacrisis Also, the most touching thing is the people donating $1. EVERY cent counts in a disaster. Thank you for being included and connected to this aid.	california_wildfires_2018_train.tsv
1065789056951439360	RT @mbuntingrd: I need help finding out whether my house is still standing after Camp Fire. Old Magalia, Sugar Pine dr. 13775? Thanks for a	california_wildfires_2018_train.tsv
1065926330208976902	@Vicky4Trump @jennylucaso @Don_Vito_08 @RealMAGASteve What about the California fires victims? Theyre Americans and they need our help NOW.	california_wildfires_2018_train.tsv
1064282961477025794	The Camp Fire evacuees need our help. Please consider checking out this list with various ways to help your fellow neighbors:	california_wildfires_2018_train.tsv
1062117198057984001	a lot of sad events are happening right now, especially in my state of California. There are multiple ENORMOUS wildfires destroying homes and property that carry familys entire lives. You and I can help those in need here:  Please consider helping out♡	california_wildfires_2018_train.tsv
1061295892647632899	Dear friends, as you may already have heardthe fires in California are no joke! Please help in any way you are able to. We really appreciate your kindness at this time	california_wildfires_2018_train.tsv
1061149365451010048	We need them to deliver food all around! @WCKitchen #ChefsForCalifornia	california_wildfires_2018_train.tsv
1062615361651015681	Please help if you can. Even if a retweet is all you can do. Norcal native here.	california_wildfires_2018_train.tsv
1061864009283129346	Please donate! ὤFἿCὉ9	california_wildfires_2018_train.tsv
1065380829327699968	RT @moviemaven2: Please help the victims of the Camp fire by retweeting the video below using the #retweet4good	california_wildfires_2018_train.tsv
1066013351979958273	RT @_xTombStonex_: Please help us get the word out!! A RT would be enough to help us. Please please please!! @gst_global	california_wildfires_2018_train.tsv
1064399673807400960	RT @janattheocean: LISTEN UP THEY NEED OUR HELP	california_wildfires_2018_train.tsv
1065706871946911745	@Tennessean @JohnPrineMusic Please John (we met at Airport) could you encourage your fellow Musicians to help the people from Paradise ,California who lost their homes in the camp Forest fire! 0	california_wildfires_2018_train.tsv
1066536499775078401	Our CEO @rtaravella spoke to @nj1015 about the need for Mental Health Volunteers for #CAWildFires, saying Were finding more &amp; more w/ disasters such as these where the fatality rate is so high, that their services are needed.  @nj1015	california_wildfires_2018_train.tsv
1064390235793104896	RT @rebelbabe61: PLEASE HELP OUR AMERICAN FIRE VICTIMS IMMEDIATELY @fema @realDonaldTrump @JerryBrownGov	california_wildfires_2018_train.tsv
1061718708761047041	If anyone can please help my brother &amp; his family they lost everything in the Camp Fire in Paradise,Ca	california_wildfires_2018_train.tsv
1062110211698122752	Gov. Jerry Brown said California is requesting aid from the Trump administration. President Donald Trump has blamed poor forest management for the fires.	california_wildfires_2018_train.tsv
1061719761178918912	#CalFire Needs for the temporarily displaced people/fams/babies	california_wildfires_2018_train.tsv
1061497252806414336	Please read below!! Another devastating fire has hit Northern California, people need help, whatever you can give, or anyway you can help, please doὤF!!	california_wildfires_2018_train.tsv
1064620290343350272	I’m thinking someone may need a puff of Medical Marijuana called: Ornamental Pruning Skills ᾓ7‍♀️	california_wildfires_2018_train.tsv
1062847612137680896	My mother started a GoFundMe for my Grandparents who lost everything in the Camp Fire, which I have been posting about over the past week. If you can, please consider contributing, even a dollar can add up to a big help!	california_wildfires_2018_train.tsv
1062607917181005824	RT @KristySwansonXO: @JackPosobiec Please help if you can. If you go to James page instuctions on how it works are there ὤFἿC἟A἟8ὤFἿC἟A἟8ὤFἿC἟A἟8:	california_wildfires_2018_train.tsv
1064057798315585541	@ClaraJeffery Local charities caring for the Camp Fire victims need help. These are the people living in the parking lot at the Walmart in Chico. Donations stay local!	california_wildfires_2018_train.tsv
1063138006368968704	A friend of mine is an Episcopal priest in Chico. He tells me that whats going on there is overwhelming -- more a Katrina-like refugee event rather than a normal CA wildfire crisis. Aid is urgently needed. Heres one on-the-ground group ready to serve:	california_wildfires_2018_train.tsv
1066054638640672768	@DannyIsEnvy PLEASE, PLEASE, PLEASE RETWEET! My friend desperately needs help! I recently found out that her brother and his family lost EVERYTHING in the CAMP FIRE! She will be sharing half of her donations with him. PLEASE, EVERY DOLLAR COUNTS!	california_wildfires_2018_train.tsv
1065999575704584193	#Illegal Immigrants Today a victim of the California fire was on camera distraught and crying pleading for help.She sleeps in the rain with no cover while the ungrateful illegals complain about the living conditions we supply.What’s wrong with this picture?	california_wildfires_2018_train.tsv
1061704527655591936	Wtf hes actually blaming us for the fires. RIDICULOUS SEND HELP SEND HELP SEND HELP.	california_wildfires_2018_train.tsv
1061254320832831488	@realDonaldTrump So there is a lot of kindling basically for the fires. Fires are a horrible horrible thing. California needs water, us in the valley also need to build water storage instead of this train to nowhere. The brush and dead trees need to be cleared everything is overgrown	california_wildfires_2018_train.tsv
729064820704612352	@NBCSports @HillaryScottLA Please, please send that rain to Alberta, we desperately need it to put out our MONSTER wildfire.	canada_wildfires_2016_dev.tsv
730049540426850305	the Premiere w/ direction from the emergency team will ask for more help if they need it #cdnpoli	canada_wildfires_2016_dev.tsv
729734692837023745	All help is needed!! And welcomed.	canada_wildfires_2016_test.tsv
728623409022783488	RT @GeorgeHatcher: #Aviationsafety Co-pilot uninjured;meanwhile, wildfire rages on.They need that water tanker.  htt	canada_wildfires_2016_test.tsv
733008216766828546	@JustinTrudeau @RachelNotley @jkenney we need immediate help in this province this is negligence on fed prov gov	canada_wildfires_2016_test.tsv
729435253660631041	Change in weather gives firefighters a  goes out 2 our friends n neighbors!Please donate 2your nearest Red Cross	canada_wildfires_2016_test.tsv
728680173558620160	Please help if you can. The devastation is unimaginable.The evacuees need your help and support	canada_wildfires_2016_train.tsv
729070869084000260	Help is urgently needed! Donate to the @redcrosscanada Alberta Wildfire relief effort here:	canada_wildfires_2016_train.tsv
734020196311179270	@globalnewsto: Fort McMurray wildfire as big as PEI, crosses Saskatchewan border.  Need help from other countries?	canada_wildfires_2016_train.tsv
730082528435052545	@RentMainstreet Hi, I was wondering if you still have apartments available for Fort Mac wildfire victims with a family of five? Thank you!	canada_wildfires_2016_train.tsv
730052359049580544	I need Head Shaker emoticon again as we turn down international aircraft help for fires:  #notpolitics #lotsoffires	canada_wildfires_2016_train.tsv
728644089319690240	RT @AVGivesBack: #AVtweeps Wildfire is threatening Fort McMurray communities in Alberta Canada Please help.#FortMacFire #AVGivesBack :	canada_wildfires_2016_train.tsv
728995546229153793	The firefighters need water, weve got to keep it going, says technician who stayed in Fort McMurr  via @cbcnews	canada_wildfires_2016_train.tsv
732991451093557250	Check story from Edmonton Journal  #stupidtrudeau and #prayforsophie, no we do not need help; just help for sophie	canada_wildfires_2016_train.tsv
729706052866842624	RT @atgiggleswick: @MerlinYYC @JustinTrudeau Exactly, help the people in the wildfire area AND stop fanning the flames of the cold war with	canada_wildfires_2016_train.tsv
730051986465263617	We dont need the help with the fireswe need the help now with food shelter and other necessities for these people	canada_wildfires_2016_train.tsv
728574937770934272	RT @GlobalEdmonton: Labatt Breweries providing drinking water to wildfire evacuees in Saskatchewan, Alberta &amp; B.C.  h	canada_wildfires_2016_train.tsv
729772213184827392	That is terrible. We need help to contain and stop the fire from spreading.	canada_wildfires_2016_train.tsv
728831267353956352	@FDNY Please help with with the Fort McMurray wildfire #FortMacFire #FortMcMurray #ymm #ymmfire #AlbertaStrong	canada_wildfires_2016_train.tsv
729875009565396992	Dear Russia, mexico and USA .. Please invade and help us anyway. We DO need the extra assistance in #ymmfire	canada_wildfires_2016_train.tsv
1108284148354113536	We are appealing to all ZIGians to lend a helping hand to all the cyclone idai victims. For more information contact @NyeketeTaku @ZimGeoIns #CycloneIdaiZW #cycloneidai #cycloneidairelief #ZIG #ZIGYN	cyclone_idai_2019_dev.tsv
1113439564486647809	#CycloneIdai Survivors: Mrs Gapara stays with her daughter-in law in Gutu and continue using collapsed houses because she doesnt have anywhere to go. #LivesCanBeSaved Please help us save lives and give what you can:	cyclone_idai_2019_dev.tsv
1108362501886898176	RT @martinplaut: Mozambique Malawi and Zimbabwe: people need help NOW. If you can don’t hesitate. Just give	cyclone_idai_2019_dev.tsv
1106885719505682432	These are the most pressing items needed for the humanitarian disaster in Manicaland, Chimanimani in particular. 1) Food 2) Bottled Water 3) Blankets #CycloneIdai #Zimbabwe	cyclone_idai_2019_dev.tsv
1106917586955104256	The Roman Catholic Authorities responsible Charles Luwanga School seek food for the pupils whilst they wait for transportation for the pupils from the school #CycloneIdai	cyclone_idai_2019_dev.tsv
1109406465931046914	Mozambique needs urgent action, Cyclone Idai has caused huge destruction and loss of life	cyclone_idai_2019_dev.tsv
1110257616331132930	Help make a difference Donate underwear and pads (cash is also accepted) for our sisters and mothers affected by #CycloneIdai @ruewamak @RootedLoveTrust @Ross @ShadayaKnight	cyclone_idai_2019_dev.tsv
1108280361581187072	So they would rather starve people to wait for a man in scarf. Seriously makes no sense. WAKE UP WHO EVER IS AT THE TOP OF THIS FOOD DISTRIBUTION PLEASE	cyclone_idai_2019_dev.tsv
1110419294184189953	#CycloneIdai A list is made of the families in the area so the boats can return to assist anyone who still needs aid. CE	cyclone_idai_2019_dev.tsv
1108262776189931522	PLEASE HELP!! THEY NEED US!!	cyclone_idai_2019_dev.tsv
1111313299394740224	@CaseyNeistat Hey Casey! Could you raise some awareness for the sufferers of the Idai Cyclone that hit Mozambique, Zimbabwe, and Malawi on the 14th of March! Please get the word out and get people to donate as well just by googling donations for the victims! Thank you!	cyclone_idai_2019_dev.tsv
1109813322977894401	#CycloneIdai has devastated families in Malawi, Mozambique and Zimbabwe. More than 1.6m people are in urgent need of aid. We’re on the ground providing life-saving support to families and children affected. Support our work:	cyclone_idai_2019_dev.tsv
1112766243562573826	RT @TALLasFook: To help the people who are suffering from this tragedy head to  to donate.	cyclone_idai_2019_dev.tsv
1113094319001518080	At #UNECOSOC meeting on #CycloneIdai today, I told Member States that while we mobilized a substantial immediate response, more funding is needed to respond to the millions of people affected, rebuild lives and prevent additional loss of life in Malawi, Mozambique and Zimbabwe	cyclone_idai_2019_dev.tsv
1109651179963863040	Families urgently need your help! #CycloneIdai has left a trail of destruction and devastation in its wake in ἟2἟F ἟2἟C ἟F἟C Donate to @UNCERF to help providing life-saving necessities as ᾕ8 ⛑ ⛺️ &amp; much more!  #InvestInHumanity	cyclone_idai_2019_dev.tsv
1110232031135449093	The CHURCH needs to be present in #CYCLONEIDAI affected areas. People are traumatized - both survivors &amp; rescuers- and they need counselling &amp; prayer @EFZZIMBABWE @ShingiMunyeza @tomdeuschle @zccinzim @rashidmahiya1 @LovemoreNyatsin	cyclone_idai_2019_test.tsv
1106895212780158976	Please spread the word that Chimanimani hotel is a safe haven for those who are stranded. We dont have a lot but we can offer shelter to those who need it. Call or sms Mandla Mataure on 0775541329 #chimanimanicyclone #CycloneIdai #CycloneIdaiUPDATE	cyclone_idai_2019_test.tsv
1110172069151588354	Urgent appeal for relief and donations for people affected by Cyclone Idai in #Malawi, #Mozambique and #Zimbabwe. @FDC_Moz @NMCF_SA Read Statement here	cyclone_idai_2019_test.tsv
1109545967970336774	Your brothers and sisters in #Mozambique, #Malawi &amp; #Zimbabwe urgently need your help. #CycloneIdai caused devastation, impacting hundreds of thousands of people. Many people are displaced and need food and water. You can help: . #Idai	cyclone_idai_2019_test.tsv
1109838773725155329	Are they on twitter guys? The police and soldiers should be touring these areas and helping our citizens	cyclone_idai_2019_test.tsv
1112694124040339456	The hundreds of thousands of people affected by cyclone Idai need your help! @HumanaHPP national partners @adppmozambique @dappmalawi &amp; @dapp_zimbabwe are in affected areas providing emergency assistance. &lt;;	cyclone_idai_2019_test.tsv
