tweet_id	tweet_text	original_filename
1042062606746492934	@TWCAlexWallace @weatherchannel My niece &amp; nephew-in-law lost everything from Florence. They live in Jacksonville, NC. If anyone can spare a few bucks to help that would be great. They are newly weds. Their car was parked outside of their apartment too. Sucks.	hurricane_florence_2018_train.tsv
1040381290212732929	Of course all you need to bag a fat bitch is food.	hurricane_florence_2018_train.tsv
1039505451946258432	In preparation for #HurricaneFlorence we are asking our supporters to help us ensure the safety of our clients by donating rain ponchos. The ponchos and other items our clients are in need of are listed on our #AmazonWishList	hurricane_florence_2018_train.tsv
1039467565343559680	SOS SOS SOS PLEASE PLEASE PLEASE donate so that Bruno Foundation can help to get the shelter animals out of harms way. Immediate action (and money) was needed because today (Sept 11) at noon the traffic lanes into the	hurricane_florence_2018_train.tsv
1042058989045993473	A Friend in need is a friend indeed. Please help my friend Cyndi Papia from New Bern, NC to get a roof over her head. Almost all was lost by Hurricane Florence: Go help	hurricane_florence_2018_train.tsv
1041428593388216320	#vegan food prepping for the week! #marinatedtempeh #tofuscramble #chiaseedbread @ New York, New York	hurricane_florence_2018_train.tsv
1041597949879345152	#HurricaneFlorence Help Needed. Ponies in neck deep water Greenevers #NC  @reddogsusie @Gdad1 @chortletown @leighjalland @Indigo_Pho13 @RuthDBourdet @ruthmen @WinglessBird_ @BadBoyEM @msmorgan1968 @Janetlynne211 @samjarvis49 @Freedom4Horses @jr3597	hurricane_florence_2018_train.tsv
1039507004677611520	Hurricane Florence is gunning down where we live. Where would be a good place to evacuate my family need help for 2 nights @HelpforHeroes @fema @RedCross @ABC @TheDCUniverse @MarvelStudios	hurricane_florence_2018_train.tsv
1041306548784582656	#backstage fun at Trenton #bluesfest yesterday ☮️ What a great #festival raising money for Children With Special Needs ❤️ @ Trenton Elks 105	hurricane_florence_2018_train.tsv
1040545565334007808	We currently need any and all available large vehicles by the New Bern NC PD. Water has receeded enough for vehicle rescues. Lots of help needed!!! #rescue #newbern #nc #northcarolina #HurricaneFlorence	hurricane_florence_2018_train.tsv
1041570406078009345	Please help one of my close friends she lost everything, as well as her family due to hurricane Florence. Personal belongings, vehicle, and home. Also please share, anything could help. Ὁ3	hurricane_florence_2018_train.tsv
1039540313390505984	Breakdown on what to expect from #HurricaneFlorence . Can people also shout out groups to contribute to for immediate on the ground relief?	hurricane_florence_2018_train.tsv
902632958401675264	🐾 PLEASE RETWEET AND HELP SAVE ANIMALS IN NEED 🐾 List of animal shelters &amp; rescues in the path of #HurricaneHarvy	hurricane_harvey_2017_dev.tsv
903745490692517889	Mattress Mac opens his mattress showroom to TX Army National Guard for much needed rest between #Harvey rescue missions. #TexasStrong	hurricane_harvey_2017_dev.tsv
902700318714159105	Please give if you can to help my parents who were flooded out in #HurricaneHarvey	hurricane_harvey_2017_dev.tsv
903381575995445249	Anyone near Ford Park in Beaumont TX, they need food, water, blankets and animal crates! 5115 Interstate 10 South 77705 #HurricaneHarvey	hurricane_harvey_2017_dev.tsv
902901279730655232	Health and Mental Health Volunteers Needed	hurricane_harvey_2017_dev.tsv
902667410792103936	For Houston area updates on Hurricane Harvey including helpful emergency information please click the link below.	hurricane_harvey_2017_dev.tsv
902802086471065600	Coordination webinar tomorrow @ 1pm EDT. Find out how your company can help in the aftermath of #hurricane #harvey	hurricane_harvey_2017_dev.tsv
902856788780892160	‼️ URGENT ‼️ PORT ARTHUR AND BEAUMONT TEXAS #Harvey #Floods #SOS	hurricane_harvey_2017_dev.tsv
903055119444529158	- by sharing this it would mean so much please help me and my family / friends #HarveyFlood #HoustonStrong #PortArthur #HurricaneHarvey	hurricane_harvey_2017_dev.tsv
902898635125518337	Killeen evacuee shelter needs immediate support: @JHolmsted @molratty @marcannem96 @BlazerMc88 @molratty #Harvey	hurricane_harvey_2017_dev.tsv
902598304407715840	REAL TIME HURRICANE HARVEY URGENT We have a very urgent appeal to ask for your help right now. One of our	hurricane_harvey_2017_dev.tsv
903762346857857024	You dont need religious proclamations to inspire people to do good. Americans of all faiths &amp; none are coming together to help #Houston	hurricane_harvey_2017_dev.tsv
902627000636071943	Remember: We need doctors and medical professionals on site. If you can make it safely, please make your way to the @GRBCC #Harvey	hurricane_harvey_2017_dev.tsv
902634808605515776	Those affected by #HurricaneHarvey need our help. Donate to @salvationarmyUS at  or text STORM to 51555 #Harvey2017	hurricane_harvey_2017_dev.tsv
903054118075461632	Just went to #HurricaneHarvey shelter at 4601 Pecan Brook Dr in Austin and they need pillows, blankets, combs, and brushes (brand new only).	hurricane_harvey_2017_dev.tsv
902694155897450496	We have 70 kids w/ us in Houston; looking for others. Pls help us shelter homeless youth in the aftermath of #Harvey	hurricane_harvey_2017_dev.tsv
902653351900450818	The Walt Disney World Company pledges $1 million to the @RedCross to help those affected by #HurricaneHarvey	hurricane_harvey_2017_dev.tsv
903707723602173952	Please help if possible	hurricane_harvey_2017_dev.tsv
903441339441967106	My neighborhood is in desperate need of prayers. Water from Brazos rising fast. #HurricaneHarvey #TexasStrong #feelinghelpless	hurricane_harvey_2017_dev.tsv
902638832469889026	Thoughts? How about money money, food , surviving supplies? Lmao thoughts really ??	hurricane_harvey_2017_dev.tsv
903636783400931328	Need some supplies at home as you recover from #HurricaneHarvey. We are open to help you with some essentials. Come see us.	hurricane_harvey_2017_dev.tsv
903670913106931713	People in one Texas city waited in line that stretched for more than a mile for bottled water #Harvey	hurricane_harvey_2017_dev.tsv
903665558549217281	Do you have needs for $, #socks, dog toys after #hurricaneharvey ? Please send us a message	hurricane_harvey_2017_dev.tsv
902917259198435328	#Harvey refugees need batteries, @Duracell	hurricane_harvey_2017_dev.tsv
903750227181658113	🎸#Annapolis acoustic musicians🎸 Want to help disaster relief efforts for Kent Island/Hurricane Harvey?🎸@ #Fillthetruck Msg us or tag a band	hurricane_harvey_2017_dev.tsv
903615823012663296	The #1 need in #HurricaneHarvey is safe drinking water. Sponsor a Waterbag to help:  #HurricaneHarvey	hurricane_harvey_2017_dev.tsv
903611728348499969	Creative distributed solutions, public private partnership needed for access to In Case of Emergency Health Information learnings #Harvey	hurricane_harvey_2017_dev.tsv
902894328175108096	Is your street impassable? Help everybody out by adding it to the map:  #HoustonFloods	hurricane_harvey_2017_dev.tsv
902598507604742145	Please, get to houston to help if you have the resources. #Houston #Harvey	hurricane_harvey_2017_dev.tsv
903764473005170688	Now that Hurricane Harvey is winding down in the Houston area, we need to help the education system survive and rebuild. Authors stand ready	hurricane_harvey_2017_dev.tsv
903367948395585537	To continue rescues, distribute food &amp; clothing, and keep people moving, s.e. Texas needs gasoline.	hurricane_harvey_2017_dev.tsv
902850408724525056	Lots of help needed in Port Arthur.	hurricane_harvey_2017_dev.tsv
903558490890711041	Someone please help my family Shannon Sams and her 1 month old baby #Harvey2017 #HarveyRelief #PORTARTHURTX	hurricane_harvey_2017_dev.tsv
903761833747734528	Help! Ive been impacted by a hurricane AND I need to kill my baby!	hurricane_harvey_2017_dev.tsv
903450788906848256	What to look for in kids affected by Harvey that might indicate a need for mental health support, from TAG Center at @TexasChildrens	hurricane_harvey_2017_test.tsv
902688332290785282	Doing customs for Hurricane Harvey.. My family is taking my boat to Houston to help, supplies are needed. idreamofshyla@yahoo.com	hurricane_harvey_2017_test.tsv
902598449270575104	Items needed: toiletries, diapers, baby formula, non-perishbl food, clothing, blankets #HelpforHouston @CityOfBoston	hurricane_harvey_2017_test.tsv
903470864510836736	Please help us help the animal victims of Hurricane Harvey. Were collecting donations of food and supplies for	hurricane_harvey_2017_test.tsv
903759969585127425	Needed for Hurricane Harvey Cleaning Supplies, Gloves, Buckets, bleach if sanitation cleaners, rags, mops, brooms, first aid kits please RT	hurricane_harvey_2017_test.tsv
903501458242289665	#Harvey hit poor neighborhoods in northeast #Houston the Hardest. Now theyre struggling to get food, water, &amp; info.	hurricane_harvey_2017_test.tsv
902660979468754944	GRHS needs diapers, food and pet food. I cant get down there but if someone is making a run I will send $$$	hurricane_harvey_2017_test.tsv
902857901403983872	Were doing what we can to help victims of Hurricane Harvey. Please donate to our 9CARES TEXAS Telethon today. #9WX #cowx	hurricane_harvey_2017_test.tsv
901818409016545280	@ALT_uscis Can you share? #Harvey victims should call FEMA 800-621-3362. And to find free legal help in TX call 800-504-7030 in LA call 800-310-7029	hurricane_harvey_2017_test.tsv
903664732015603712	Have 5 minutes? Call @GovAbbott &amp; ask him to help #Harvey victiims by delaying implementation of the Blue Tarp bill:	hurricane_harvey_2017_test.tsv
902803324289863680	To each and Everyone Viewing This Post please help Retweet and spread this post. #HurricaneHarvey #HelpforHouston	hurricane_harvey_2017_test.tsv
901718133433483265	‼️⚠️RETWEET TO HELP SAVE A LIFE ⚠️‼️ #houston #hurricaneharvey #MayweatherMacGregor #MayweatherMcGreggor #HurricanHarvey2017	hurricane_harvey_2017_test.tsv
902898659653816320	@BurgerKing can you state your intention for assisting the #HurricaneHarvey victims? Helicopter in some food. People are hungry!	hurricane_harvey_2017_test.tsv
902744747386777600	Help Needed After Hurricane Harvey: The Quitzau Family  via @youcaring #keeptheballrolling	hurricane_harvey_2017_test.tsv
903748795846066176	Guys, help buy these shirts to support those affected by Hurricane Harvey.	hurricane_harvey_2017_test.tsv
903499364458348546	@JHarden13  Please help a brother in need. I lost everything during this catastrophic hurricane Harvey, every penny will help me	hurricane_harvey_2017_test.tsv
901750297545949188	RT @ArtAcevedo: Proud of our @houstonpolice out and about in North-East Division keeping our community safe. #hurricaneharvey /	hurricane_harvey_2017_test.tsv
902686067979157505	We have plenty of food, says Herbert Mitchell, of Alameda Plaza. Im looking for some wine.	hurricane_harvey_2017_test.tsv
902849835782557697	Im most impressed by how Texans are helping each other. Neighbors helping neighbors. Makes FEMA, ARC, etc efforts more successful. #Harvey	hurricane_harvey_2017_test.tsv
902724408078426116	@DSEA1 stands with @txstateteachers and Pres. @NoelCandelaria as they deal with the impacts of #Harvey. Please let us know how we can help.	hurricane_harvey_2017_test.tsv
903410300736679936	#PhotosFromTheField: #Texas #StateGuard helping deliver water to #Texans in need. #Harvey #TMDHarvey #HarveyFlood	hurricane_harvey_2017_test.tsv
902893489582735360	Please were in lumberton and I have a newborn we have to wait until 6 am for anyone to come help us 😰	hurricane_harvey_2017_test.tsv
903628886260408320	**Help for Hurricane Harvey evacuees** Help is needed for a family that is living here in Las Cruces now. They	hurricane_harvey_2017_test.tsv
902679828524130306	My brothers and sisters in coaching, lots of people need our help, inclusive of our coaching family. Help if you can!	hurricane_harvey_2017_test.tsv
902841945231421440	#CajunNavy #portarthur #HurricaneHarvey My friend and her family need help! @Tip @TRAEABN @Kingkeraun	hurricane_harvey_2017_test.tsv
902839138956836864	If anyone has a boat in SETX, my family needs to be rescued from 4318 Kylewood, 77642! 911 isnt picking up. #hurricaneharvey	hurricane_harvey_2017_test.tsv
903464347984314369	@MMFlint People still w/o food &amp; water from #Harvey, but Trumps gonna give up the equivalent of spray tanning his armpit for a day as his donation.	hurricane_harvey_2017_test.tsv
903361103660367872	A group of locals has come together to provide food to one of the cities hit hard by Hurricane Harvey, Ingleside.	hurricane_harvey_2017_test.tsv
902903254698401793	Please send help to Port Arthur!!!! 🙏 Everybody needs help in Texas. #Harvey	hurricane_harvey_2017_test.tsv
902634145423265797	Houston’s mayor says immigrants should not be afraid to seek help during #HurricaneHarvey.	hurricane_harvey_2017_test.tsv
902685144238174208	🗣SEND WATER TO FLINT, MICHIGAN TOO	hurricane_harvey_2017_test.tsv
902892681898192899	PLEASE HELP - @abilenepd and @AbileneFire need supplies to aid their #HurricaneHarvey response.  #NexstarHarvey	hurricane_harvey_2017_test.tsv
902643959465480192	We are in need of NEW packaged socks, undergarments &amp; T-shirts, to be provided for victims of Hurricane Harvey.	hurricane_harvey_2017_test.tsv
902872074238222336	[REPOST] Texas Medication Program can help if you lost your HIV medication during #Harvey	hurricane_harvey_2017_test.tsv
902632939455950850	Help #HerbalifeFamilyFoundation bring warm meals, clean water &amp; hygiene kits to those impacted by #HurricaneHarvey	hurricane_harvey_2017_test.tsv
903655375395807233	Help UTA students affected by #Harvey by giving to Emergency Assistance Fund - . All proceeds go to students in need.	hurricane_harvey_2017_test.tsv
902851259153121280	Hey, @tide - any way we can get your laundry trailer here to support the @BakerRipley @NRGParkFan shelter for #Harvey?	hurricane_harvey_2017_test.tsv
902651048518717443	Need food? Heres a running list of Houston restaurants that are open and ready to serve you:	hurricane_harvey_2017_test.tsv
903393966812475392	Please Help! Food, water, etc needed desperately! #HarveySOS	hurricane_harvey_2017_test.tsv
903055508516556801	Hi guys! asking everyone to please help those animals dealing with hurricane Harvey by donating anything on the list that you can, God bless	hurricane_harvey_2017_test.tsv
903386260223385600	@KidViperFGC @TheArm05 @Kizzie_Kay310 @faultydefense Please help w?  Taking it down tonight.	hurricane_harvey_2017_test.tsv
902849127263948800	.@CornellCASs Art DeGaetano, says #climatechange has impacted meteorological elements &amp; therefore the strength/impacts of #HurricaneHarvey.	hurricane_harvey_2017_test.tsv
902857878628945920	Can anyone help? People need boat rescue in attic. Info from @butterflyjoy2 @PortNechesPD @TexasGuard #KHOU11 #Texas #Harvey	hurricane_harvey_2017_test.tsv
903759500955467776	Huge need for medical supplies &amp; medical personal, beaumont airport drop point? @RedCross @fema #HarveyRescue #HarveyRelief	hurricane_harvey_2017_test.tsv
902852645630726144	Please help, this lady needs to be rescue Marilyn guidry ,6210 Charles ave, Port Arthur , tx 713 5427751, 80 year old Water waist #harvey	hurricane_harvey_2017_test.tsv
901746471996981248	Urgent Help Needed For Animals Rescued In #HurricaneHarvey ὤFὉ9ὤC @AustinPetsAlive! Is On The Ground Rescuing Animals ὄ9	hurricane_harvey_2017_test.tsv
902850712735973376	@CNN need help 8001 Honeywood Trail #92 Crystal Creek Apt Port Arthur, TX 77640. Who else can she call? #HurricaneHarvey	hurricane_harvey_2017_test.tsv
902646127173959680	@jakepaul Hurricane Harvey wont stop these kids. Please give them a RT or shout out. Thanks for ur help.	hurricane_harvey_2017_test.tsv
902850483974483968	Epic, historic, &amp; record setting crowds came to congratulate ME at my #HurricaneHarvey rally!! What a crowd! What a turnout! #HelpforHouston	hurricane_harvey_2017_test.tsv
903053634937769988	URGENT: BOATS NEEDED in #portarthur | Staging Area | Walmart | 8585 Memorial Blvd, Port Arthur TX 77640 | BRING EXTRA GAS #HurricaneHarvey	hurricane_harvey_2017_test.tsv
902650902837911552	Important Assistance Guidance for Families of Fallen #Military in Need After #HurricaneHarvey #HoustonFloods Read &gt;	hurricane_harvey_2017_test.tsv
902635196524240896	TAMU vet school has sent an emergency response team to help rescue animals in Houston, meanwhile you doofuses are clowning for attention.	hurricane_harvey_2017_test.tsv
902633932319068160	*UPDATE* Also needed: - Diapers - Hygiene items - Contractor sized trash bags - Gallon Ziplock Bags Accepted at ANY FC DFW location.	hurricane_harvey_2017_test.tsv
903060674800214016	Theres great need in flooded Texas. BG chaplains are comforting hurting people. Help send them to disaster zones.	hurricane_harvey_2017_test.tsv
903412449407324160	CHECK MY PINNED TWEET. We did not want to do this but we had to. We are in a very bad point and need help Retweet	hurricane_harvey_2017_test.tsv
903645650088275969	Happy Friday!! Its football time again in America but dont forget those that are still suffering. Please help #Harvey text 90999	hurricane_harvey_2017_test.tsv
903725838142775296	.@USDANutrition moving fast so people affected by #Harvey have food. @POTUS order: help people 1st, paperwork later.	hurricane_harvey_2017_test.tsv
903048427164065792	If you need emergency MAINTENANCE meds, visit CVS at NRG Convention Center - #houston #HurricaneHarvey #harveySOS #houstonflood	hurricane_harvey_2017_test.tsv
901158970966118401	En Route to the Emergency Operations Center for a live press conference re: updates on Hurricane Harvey. Tune in to our FB page live at 3 pm	hurricane_harvey_2017_test.tsv
903480401045237760	‼️URGENT: Resources are desperately needed in Port Arthur, TX. Shelters dont have beds, blankets, food, water or clothes #HurricaneHarvey	hurricane_harvey_2017_test.tsv
902639391415320577	We are showing up for families affected by #HurricaneHarvey &amp; we need your help. Our team is on its way to #Houston:	hurricane_harvey_2017_test.tsv
902668717737353216	We will be here as long as we are needed, providing aid, food, and shelter to those impacted in the wake of this disaster.	hurricane_harvey_2017_test.tsv
903380653189677056	This Harvey fund focuses on immediate needs; food, clean water, shelter and more.	hurricane_harvey_2017_test.tsv
903756078990540801	#HOUSTON: Freddy is a high need service dog who went missing during #HurricaneHarvey. Please call 713-314-6748 if you have information.	hurricane_harvey_2017_test.tsv
902641114678743040	Night shift #volunteers needed.only if you can get there safely. #Harvey @GRBCC	hurricane_harvey_2017_test.tsv
902908321589551104	#Harvey victims will need help immediately.  Lets help orgs. mobilize #TW	hurricane_harvey_2017_test.tsv
903428689794387968	@espn @OhioStateFB Talk about Dobbins hometown LaGrange TX also being deeply effected by #Harvey They need help down here.	hurricane_harvey_2017_train.tsv
902679513686880256	NO arrests for so-called looting! There must be emergency relief—be provided with water, food, medicine FREE OF CHARGE. #HurricaneHarvey	hurricane_harvey_2017_train.tsv
901717312859975681	I got this 4m my friend someone. Plz help #hurricaneharvey #houstonflooding #harvey #Harvey2017 #HarveyStorm #houstonflood #texashurricane	hurricane_harvey_2017_train.tsv
902847921414168576	the images are devastating please help @savethechildren reach children and families affected by #hurricaneharvey 💔	hurricane_harvey_2017_train.tsv
902854085728247808	For those at home or abroad looking to help #Harvey disaster survivors in #Texas, @fema has a helpful guide:	hurricane_harvey_2017_train.tsv
901764377904381952	RT @LaurenWFTS: Emergency supplies heading to Texas this morning from #TampaBay #Harvey	hurricane_harvey_2017_train.tsv
902893530846199808	Please SEND FUNDS, not stuff. #Harvey	hurricane_harvey_2017_train.tsv
902843123461738497	#Harvey Help needed! Spread please!	hurricane_harvey_2017_train.tsv
903750136941109248	Also @LAFC will be collecting food &amp; supplies on Thursday Sept 7 in LA (Expo Park) for Hurricane Harvey relief	hurricane_harvey_2017_train.tsv
902899283929784320	🚨🚨🚨 RT TO HELP FAMILIES WHO HAVE LOST THINGS DUE TO HURRICANE HARVEY 🚨🚨🚨🚨	hurricane_harvey_2017_train.tsv
903761890769342465	What America is all about: helping others. To all who have been there for the #HurricaneHarvey victims: thank you.	hurricane_harvey_2017_train.tsv
902893512802406401	@Anon2earth @YourAnonNews @YourAnonCentral Pls share- Clean water fund #HurricaneHarvey	hurricane_harvey_2017_train.tsv
903763107914371077	Pets need help during an emergency. Learn more here! #HurricaneHarvey	hurricane_harvey_2017_train.tsv
901709131555405824	RT @ParadymMusicGrp: Sharing and hoping someone can help ὤFἿD #HurricaneHarvey	hurricane_harvey_2017_train.tsv
902838147276525568	Please help the victims of Hurricane Harvey in whatever way you can, even a dollar will help collectively. Ive	hurricane_harvey_2017_train.tsv
902714490579550208	This is my uncle please help any thing helps. #HoustonStrong #HarveyFlood #HurricaneHarvey	hurricane_harvey_2017_train.tsv
902660921969053696	Need help! Go to my facebook page @idlifeLoganStout for detailed updates! #Harvey	hurricane_harvey_2017_train.tsv
902899383984893952	City of Port Arthur, Texas, calling for public assistance: Individuals with boats are needed in Port Arthur for rescues. #Harvey	hurricane_harvey_2017_train.tsv
903463881724624896	Oh dear no. People, this is ALL ABOUT THE WATER. We will never get more water than what we have right this minute. Its ours to ruin. 😩👇	hurricane_harvey_2017_train.tsv
903708551612440576	@PalmettoHigh is collecting canned food at the football game tonight for those affected by hurricane Harvey. Lets do all we can to help!	hurricane_harvey_2017_train.tsv
903447424370343937	🆘ALL SOS REQUESTS NEED NAMES - ADDRESS - PHONE - HOW MANY PEOPLE? CONDITION #Houston #SOS #Harvey #REQUESTS PLEASE PROVIDE OR REQUEST‼️🆘	hurricane_harvey_2017_train.tsv
902598165429354501	Hey, Spring Cypress! Were now open and serving with a limited menu! Come get some hot food! 🌯#HurricaneHarvey	hurricane_harvey_2017_train.tsv
902915259119362048	#Orange #Orangetx #Texas #HurricaneHarvey #Harvey #HarveyFlood So many need help	hurricane_harvey_2017_train.tsv
902664076668620800	Share thread in case anyone in affected areas can make use of this important and useful information about safe drinking water. #harvey2017	hurricane_harvey_2017_train.tsv
901758426816110592	RT @grammy620: #HurricaneHarvey A lot of animals and pets need your help! Keep an eye out, give them a hand, dont let them die! #Houston	hurricane_harvey_2017_train.tsv
902680046896328705	Theres a need for everything post-#HurricaneHarvey -- diapers, rooms, blood. Heres how to help:	hurricane_harvey_2017_train.tsv
902654232775585792	@CrzyCreoleMommy @mollyschreiber PLS RT! #HurricaneHarvey medical supplies &amp; volunteers for chronically ill. #ostomy #IBD #diabetes #HarveyPatients	hurricane_harvey_2017_train.tsv
902674616036057089	Please Help in any way U can they need it	hurricane_harvey_2017_train.tsv
902638739423457281	Please help @iswmp in #Houston. #HurricaneHarvey #dog #dogs #petrescue -	hurricane_harvey_2017_train.tsv
903380050833178625	Help us help Houston families recover from #HurricaneHarvey ::  @jrwlay #creditunions	hurricane_harvey_2017_train.tsv
902697370458234882	CInco, please help communicate this message to your followers: Seven Lakes HS is NOT a shelter, repeat NOT a shelter. Thanks.	hurricane_harvey_2017_train.tsv
902848660492304384	LaB is raising money to help people effected by Hurricane Harvey if you can help please do:	hurricane_harvey_2017_train.tsv
903372340083523585	Please help one of our sister properties own at the Houston Press. #HurricaneHarvey	hurricane_harvey_2017_train.tsv
902678906360221697	Dumbest thing Ive ever read. Its the house of THE LORD and people NEED HELP. ANY Christian man would help. Hes a coward.	hurricane_harvey_2017_train.tsv
903646875437461506	We learned from #ColoradoFlood #Harvey survivors with limited resources will need extra help from @NationalVOAD organizations. You can help	hurricane_harvey_2017_train.tsv
902728761048780800	@FloydMayweather we need some help man. #houstonflood #HoustonStrong #Harvey #Houston #McGregorVsMayweather	hurricane_harvey_2017_train.tsv
901754650029850624	URGENT BABY rescue needed @houstonpolice @HoustonOEM @ArtAcevedo @KHOU @abc13houston @Fox26Houston	hurricane_harvey_2017_train.tsv
902653476962013184	In awe of preloader Abe Minor for helping stranded flood victims. You go, Abe! #WeAreUPS #HoustonStrong #UPSHero	hurricane_harvey_2017_train.tsv
902905952223064067	PLEASE HELP MY FRIEND, HER SISTER AND 1 YEAR OLD NEPHEW! THEY ARE IN PORT ARTHUR! THE HOUSE IS FLOODING! #HurricaneHarvey #PortArthur	hurricane_harvey_2017_train.tsv
902646420855033856	Please help us raise money to benefit students and families affected by Hurricane Harvey. #LyleLove	hurricane_harvey_2017_train.tsv
903762829345517568	Help us help those in need:  #Texas #TexasFlood #Houston #HoustonStrong #harvey	hurricane_harvey_2017_train.tsv
903747794535686144	#gofundme #sabrinawilson #HurricaneHarvey please help me and my family please anything would do	hurricane_harvey_2017_train.tsv
902639322964398080	Can we be sent the link to help build back the body of Christ in the state of #Texas for those affected by #HurricaneHarvey	hurricane_harvey_2017_train.tsv
903611396486684675	Please dont turn a blind eye to all those who need your help. Join the @News3LV team and help out tonight! #Sinclaircares #Harvey2017	hurricane_harvey_2017_train.tsv
