tweet_id	tweet_text	original_filename
1030802768389459970	Not @BTS_twt related but ARMY PLEASE HELP USὤFἿB Im from Kerala. People are dying here but we are not getting enough help. Ik our fandom can trend hashtags in seconds. Its a matter of 50,000+ peoples lives #BTSArmy @OneInAnARMY	kerala_floods_2018_test.tsv
1032726261074980865	Dear @narendramodi @PMOIndia @CMOKerala, I urge you to send a unit of @moefcc to this affected places, as wild beings might increase the death toll which would again be disheartening. @alphonstourism #KerelaFloodRelief #KerelaFloods	kerala_floods_2018_test.tsv
1031476760037081088	#KeralaSOS Urgent Requirement Need more volunteers at Aluva . Please call Mobin Sageer 9995188063 #Keralafloods #KeralaFloodRelief #KeralaFloodRescue Cc. @deepsealioness @SanjeevaniPage @swamv39 @manoramaonline @kavita_krishnan @dhanyarajendran @WeAreBangalore @aapkaprithvi	kerala_floods_2018_test.tsv
1031713697658331136	#Ernakulam South Rly station: 2000 migrant workers need food, someone please help. Contact : 8130270180 @SaginaWalyat @Parul_RajeevM @JinCVarghese @NSOOD6 @vmoorthynow @shilpajn @vinayaravind @damyantig#Food #KeralaFloodRelief #KeralaFloods	kerala_floods_2018_test.tsv
1030719218788909057	RT @antoantonyinc: Those who need immediate assistance in Pathanamthitta can contact me on 9447010000,7561072202,9947385287,9446666971,9539	kerala_floods_2018_test.tsv
1031130142549061634	Clean Drinking water, food, medicines is urgently required at over 2000 relief camps #KeralaFloodRelief #keralafloods	kerala_floods_2018_test.tsv
1030717932135886848	RT @acky1973: Hello @PepsiIndia can you help ppl of #KeralaFloods with bottled water asap @CMOKerala @minicnair	kerala_floods_2018_test.tsv
1030767356157423616	#GodsOwnCountry needs helping hands. #DoForKerala #KeralaFloods #StandWithKerala Please spread the message @washingtonpost @IndianRedCross @UNinIndia @WHO	kerala_floods_2018_test.tsv
1035593613881819136	Schools have opened after vacation, but attendance % is less, many children are still in relief camps &amp; they dont have clothes to go to school. Majority of these children even lost their books &amp; school items. Help in form of school kits will truly be appreciated #KeralaFloods	kerala_floods_2018_test.tsv
1030734611096252417	@CMOKerala #KeralaSOS Two kids and mother(Beena Kumari, Rohini) stuck near Chakkulam, Thalavadi Panchayat, Thudangiyil veedu Landmark: LP School Date:18/08, 1.50PM Need urgent support to provide them water and food, and evacuated immediately #Keralafloods	kerala_floods_2018_test.tsv
1030736084685283329	Kerala flood need help. Help Needed: Name:Preetha Jayaprakash Address: Vinayak Muthavazhy Near Subramanya Temple Pandanad Chenganoor Phone-9447810402 Almost 15 people stuck in the top floor,ground floor is 75% in water,Please help! No rescue numbers are responding	kerala_floods_2018_test.tsv
1030762263966150656	A letter I’ve been asked to send on from my good friends at Choice School in Kochi. #StayStrong #StaySafe #KeralaFloods Dear Friends, In view of the emergency situation that we are	kerala_floods_2018_test.tsv
1030714141604896768	#Verified Help required.40 people stranded in the second floor. Food and water shortage. Child requires medical attention. #KeralaSOS #KeralaFloods #KeralaFloodRelief Shereefa 9400511769 Kunjithai Rd Kunjithai Rd, Vadakkekara, North Paravur, Kerala 683522	kerala_floods_2018_test.tsv
1032105787152187392	Just like the flood ravaged #Kerala districts , #Kudagu is in perils too. Lets help them generously at this time. #EveryPennyMatters #KudaguFloodRelief	kerala_floods_2018_test.tsv
1031834697423147008	#Pathanamthitta #Verified #RebuildKerala #KeralaFloodrelief #URGENT food requirement Pls help RT/ connect to leads. Could you help @SaginaWalyat @Shudraism @Aalappuzhakaran @aksvi @ResourceKerala @joele__ @vmoorthynow @PrachetaB @revathikrishnak @ChetaKadaChaaya	kerala_floods_2018_test.tsv
1030779418594160640	A family including a 4 year old kid is stuck on terrace of their home. Near thiruvanvandoor, chengannur. Dont have their number. A relative of theirs informed us this. Her number is +919654014893 #alappuzha #KeralaFloods #Chengannur #Pathanamthitta	kerala_floods_2018_test.tsv
1032531434559496192	As part of #KeralaFloodRelief effort, we are calling for donation-in-kind for essentials &amp; medicines to be sent over to 31 camps at Kottapuram, Thrissur district in Kerala. Pls contribute &amp; share with your network in #Bangalore. DETAILS:	kerala_floods_2018_test.tsv
1030385661386272770	RT @salilravindran: Please help in whatever way you can #KeralaFloods #SOSKerala	kerala_floods_2018_test.tsv
1031490047491620864	#Alappuzha #KeralaFloodRelief #Resources #KeralaFloodrequest Verified. Please help/ call/ RT. Tagging @ResourcesKerala @edakkamannil @_leppi @JohnBhrn @iKooky @goonj @SaginaWalyat @Shudraism @ResourcesKerala @massheroyaru @SolidFumes @Aravindh_Sethu @vivekpoduval	kerala_floods_2018_test.tsv
1032304195011923969	New Vlog coming tomorrow!!! PLEASE, WE NEED YOUR HELP. #KeralaFloods #KeralaFlood #KeralaFloodRelief	kerala_floods_2018_test.tsv
1031490186440368128	Kerala has been struggling with floods for past 10 days, people are out of food, clothing, and shelter. Come forward in large numbers and support by donating money or products. #KeralaFloods2018 #KeralaReliefFund #KodaguFloods Full Video:	kerala_floods_2018_test.tsv
1031262822775156736	Register you Requirements here Demand or Supply !!  Everything will be consolidated and Distributed. Associated by Prathidhwani, Technopark.. #KeralaFloods #KeralaFloodRelief #KeralaSOS @Forumkeralam1 @cinemasworld @cinemasworld @iamfarii	kerala_floods_2018_test.tsv
1031500685420965888	#Ernakulam Cleaning supplies needed before tomorrow. KeralaFloodRelief #Resources #KeralaFloodrequest Verified. Pl help/ call/ RT Tagging @ResourcesKerala @edakkamannil @_leppi @JohnBhrn @goonj @SaginaWalyat @Shudraism @thebhavyeah @massheroyaru @SolidFumes @Aravindh_Sethu	kerala_floods_2018_test.tsv
1030767349836656640	please do not spread hate if you dont have the mind to help us or least comfort us..#keralafloods..it is the disaster of the century..a whole state is about to be washed off..please dont say hateful things in times like this.WE ARE HUMANS TOO..	kerala_floods_2018_test.tsv
1030394595727892480	RT @SonuSood: It’s time to do our bit.. please come forward and help ὤFἿDὤFἿDὤFἿDὤFἿD #KeralaFloods2018 #KeralaFloodRelief	kerala_floods_2018_test.tsv
1031343712708775936	If you have contact details of anyone providing food, shelter, water and other resources; please tweet using the hashtags #KeralaSOS and #Resources.	kerala_floods_2018_test.tsv
1030787701987934208	@narendramodi Chengannur needs immediate help #KeralaFloods	kerala_floods_2018_test.tsv
1030740471277121536	Urgent Help NeededὤF#KeralaFloods 2 Elderly couples need urgent evacuation in Aaratupuzha of district Pathanamthitta as water level is rising dangerously @adgpi @indiannavy @IAF_MCC @NDRFHQ Google Location n address is given in below Pics !	kerala_floods_2018_test.tsv
1030843763185405953	My brothers, aunt and Grand-Parents are stuck in Moozhikkakadavu_pariyaram, Chalakkudy. Location - 10.308208,76.351140. Phone - +918075659446. Please RT so some1 can help them. Grandparents health getting worse. Havent had proper food in 2 days. #KeralaFloods #KeralaSOS	kerala_floods_2018_test.tsv
1032509183503941633	This is a remote, underserved area in #THrissur district and the need is urgent. This is Verified. Can someone please help? #KeralaSOS #KeralaFloodRelief	kerala_floods_2018_test.tsv
1030412452352208897	If you work for a company that makes perishables such as atta, milk (tetrapak kind), milk powder, instant noodles etc+ hygiene things such as soaps, sanitary napkins, could you get in touch with me if you can get us this stuff at discounted rates? DM open. #KeralaFloodRelief	kerala_floods_2018_test.tsv
1030740543666413570	@jimmykimmel Hi jimmy, this is a request from a fan of your show from kerala,India as we are devastated by flood and hundreds of lifes have been lost. Kindly do what you always do. We need all the help to rise from this misery #KeralaFloods #DoitforKerala	kerala_floods_2018_test.tsv
1030768479371067393	@DettolIndia Can you support kerala flood relief camps with some of antiseptic ites such as dettols bandaid etc	kerala_floods_2018_test.tsv
1030412021366435840	Immediate requirement of medicines at CUSAT camp. medicines for diabetes - Metaformin 500mg Dolo 250 Cough syrup Tablets for vomiting and gas trouble Those who can help, please contact Haroon - +919847211127 #KeralaFloods #cusat #KeralaFloodsHelpNeeded	kerala_floods_2018_test.tsv
1030383566742405120	@elonmusk Kerala is experiencing heavy floods and landslides. &gt;150 deaths have been reported. Thousands are trapped and death toll increasing by the hour. WE REQUEST IMMEDIATE HELP. ANY RESCUE APPRECIATED #KeralaFloods2018 #KeralaFloods #KeralaSOS #KeralaFloodsHelpNeeded	kerala_floods_2018_test.tsv
1033367016491704320	#HelpKerala #KeralaFloodRelief #KeralaFloods #RebuildingKerala #NGOs #Corporates please help @sunita_krishnan @talktosanjai @k_satyarthi @vasudevan_k @NSMlive @vijayanpinarayi @vijayshekhar @anandmahindra @ndcnn @arunpally @GautamGhosh	kerala_floods_2018_test.tsv
1030861074520727553	RT @TrollCinemaOff: 200 people have not received food at SN Puram , Pipeline Road ,Aluva . Contact: 9061453387 #Help #Keralafloods	kerala_floods_2018_test.tsv
1031105664003624961	#URGENT 13,000 people require food at areas like panayikulam and surrounded areas where the only mode of carrying food is by loading on their head so please call this number Please call +91 9846222461 immediately if you have food Time 11.30 AM - August 19th.. #KeralaSOS	kerala_floods_2018_test.tsv
1032301787540217856	As flood waters recede, there is an URGENT need for treatment of water-borne diseases, infection and injuries. #Medication is the need of the hour. Please contribute whatever you can. DETAILS:  #keralafloods #StandForKerala	kerala_floods_2018_test.tsv
1031870304690130946	@narendramodi After rescuing shall they starve or live the rest of life in roads..It is not our request it is our right. #KeralaFloods #KeralaFloodRelief No custom duty More monetary help More food	kerala_floods_2018_test.tsv
1030384221603287040	RT @nambessan_ramya: Chennai friends, Need Help #KeralaFloods #rescue	kerala_floods_2018_test.tsv
1032267888810446848	Check the awesome efforts by #Patanjali #KeralaFloodRelief for medical help Thanks @yogrishiramdev @Ach_Balkrishna #KerlaFlood .	kerala_floods_2018_test.tsv
1030416237703000065	#KeralaSOS #KeralaFloods #Thiruvalla Medical Mission hospital is opening for all the flood victims. Food, water, medicines and treatments will be made available there for all. All necessary helps will be provided. Kindly pass this information. Contatct: 0469 262 6000	kerala_floods_2018_test.tsv
1030386035652358147	Ready to eat foot items required for airdrop in the flooded areas. Matchboxes, candles, poha, jaggery, and packed food. The items to be given at SMV school, thampanoor, #Trivandrum Information form Trivandrum collector. #KeralaFloods @VSJ1 @Democratrodrigu	kerala_floods_2018_test.tsv
1031251130309795840	Guys theres leftover food at Koonamavu and Vytilla. Please reach out to 9995218995 if you know of any shelter/group of people still looking for food. Id called up this person, offer is legit #KeralaFloods #KeralaFloodRelief	kerala_floods_2018_test.tsv
1031091729577988097	Kerala needs your help, we are sending medicines for people affected by flood. If you want to help, please send them to our office:  You can send: OTC medicines, sanitary pads and dry food items. Let’s do our bit ὤFἿD #KeralaFloods #KeralaFloodRelief	kerala_floods_2018_test.tsv
1030399514249777153	@bbcworld, we kerala fight against #KeralaFloods, we need more help and attention of world medias	kerala_floods_2018_test.tsv
1030918394231627777	Need some help in Thiruvalla #KeralaSOS #KeralaFloodRelief @CMOKerala Address : Thuruthikonath House , Othera West PO , Thiruvalla Kerala 689551 Phone is unreachable but here is the number: +91 9539797191 They speak Malayalam, English and little bit of Hindi	kerala_floods_2018_test.tsv
1034988169673039872	Need food gains for Aranmula asap. Let me know who will give. Rice. Dals. Oils. Teas. Sugar. Salt. Rawa. We need soaps. Shampoos. Toiletries. Nail cutters. Sizzors etc. #KeralaFloods #kerala #KeralaReliefFund #KeralaDonationChallenge #RT pass to other and DM me	kerala_floods_2018_test.tsv
1030847037741453312	Guys please donate. ὤF Whatever you can. I have done that. Our fellow countrymen in Kerala/Karnataka need food, sanitary provisions to ride this out. Every little bit helps. Dont pay attention to the trolling by commie-libtards.ὡ2 Theyre not the one surrounded by the deluge.	kerala_floods_2018_test.tsv
1031056325776535552	Too all members in @IBM plz help #KeralaFloodRelief and #KodaguFloodRelief plz donate atleast your one day salery guys plz it will be more helpful	kerala_floods_2018_test.tsv
1030400752794005504	Rescue camps require torches, mat, blankets, clothes and dry food. Please contribute to #AnpoduKochi, Regional Sports Centre, Kadavantra, Ernakulam #KeralaSOS #KeralaFloodRelief #DoForKerala @CarDroidusMax @mknid @NSMlive @veenavenugopal @dhanyarajendran @tinucherian	kerala_floods_2018_test.tsv
1032289914279288832	To fold the hands in prayer is well, to open them in charity is better. Hi All, I request you to help Kerala flood victims, you can help them through various foundations like #Goonj #Milaap #HabitatforHumanity etc. or through Chief Minister’s Distress Relief Fund. #KeralaFloods	kerala_floods_2018_test.tsv
1032102888707903488	Relief material for #KeralaFloods affected persons include food packets, milk powder, blankets, bedsheets, clothes, soaps and sanitary napkins as requested by the Kerala Government officials. #KeralaFloods	kerala_floods_2018_test.tsv
1030394733741441024	Please reach out to help victims of #KeralaFloods IYC State units of Karnataka, Telangana, Andhra Pradesh, Tamil Nadu have been sending relief materials to the state while Youth Congress workers of Kerala have been on ground 24/7, helping people. Your help too is needed!	kerala_floods_2018_test.tsv
1030755398125465600	@nsitharaman @ksureshmp @CMOKerala @PIBTvpm Please give more than what is asked. That would be your best response. On the ground, a lot of hardship. Water &amp; Food is limited, need more rescue teams and medicines. #KeralaFloods	kerala_floods_2018_test.tsv
1030861951117578240	RT @ARMYFromHell: Please help us trend these hashtags, 1 RT can save a life #KeralaFloodRelief #StandWithKerala #PrayForKerala #ARMYsfor	kerala_floods_2018_test.tsv
1030785867437109248	RT @sivaprasadsai: +919446127636 contact Alwin.. please help #keralafloods #DoForKerala verified through friend	kerala_floods_2018_test.tsv
1030815304752873472	Plzz need help @UkkenTintu @rescue_kerala @SarcasticShiv #Keralafloods #KeralaSOS  , its personally verified. Please guys ὤFὤFὤF #KeralaFloodRelief #KeralaFloods #KeralaSOS	kerala_floods_2018_test.tsv
1031491055798112257	Please share maximumὄD Need Supplies Before 21st Nightὡ4 Maximum RetweetὤF #SHAREPLEASE #KeralaFloodRescue #KeralaFloods #KeralaFloodRelief #KeralaReliefFund #KeralaSOS #kerala #withkerala #StandWithKerala #Donate4Kerala #DonateForKerala #KeralaFloods2018	kerala_floods_2018_test.tsv
1030751677618384896	RT @prassanahari: Need urgent help. Not able to contact one Kiddo whos struck in Pamba #KeralaFloods	kerala_floods_2018_test.tsv
1031264540787269632	#KeralaFloods2018 #OPRAHAT @IndiaCoastGuard Medical Officer &amp; much needed supply of relief materials including medicines, sanitary napkins &amp; baby diapers being rushed to the disaster relief camps of flood hit districts of #Kerala @DefenceMinIndia @CMOKerala @MoHFW_INDIA @DG_PIB	kerala_floods_2018_test.tsv
1030816195891458049	A list of medicines and other materials urgently needed at camps in #Kakanad area of #Ernakulam. One of the camps is at Govt LP school, Kakanad. Im told these items are out of stock around the area. #keralafloodrelief #keralafloods #KeralaSOS	kerala_floods_2018_test.tsv
1032171427535806464	Got a mesaage saying relief camps in Alapuzha and Chengannur are not in great shape. Less food and one guy who went there says there are no people to help like in ernakulam See if you can help @dhanyarajendran @vinayaravind @TheRestlessQuil @saysarun #KeralaFloods #KeralaSOS	kerala_floods_2018_test.tsv
1032617478646509569	Dear @ BillGates  KERALA , (an Indian state) need help to recover itself from the worst affected flood in her history. kindly , if possible, make a small contribution to THE RELIEF FUND OF KERALA CHIEF MINISTER ☺️  #keralaflood #standwithkerala	kerala_floods_2018_test.tsv
1031104158382862337	Requirement of things in DD Global Village, #Aluva - 1. Drinking Water - For 100 Occupants 2. Sanitary Napkins - 20Women 3. Baby Diapers 4. Rice 5. Cereals 6. Grains 7. Sugar 8. Tea Powder 9. Skimmed Milk Powder 10. Atta #KeralaFloodRelief #WeAreKerala #SupportKerala	kerala_floods_2018_test.tsv
1030876716980363264	@justinbieber As u all know,our kerala is facing a huge tragedy!kindly help us.#help#kerala#am here with a request!rise#for#kerala#14#districts#plz.people are suffering for food.kindly take this as a concideration.	kerala_floods_2018_test.tsv
1031105884993343488	#Kochi friends pls note. Medicines and baby food needed at GCDA complex Panampally Nagar. . please treat this urgent. #keralafloods #kerala	kerala_floods_2018_test.tsv
1030848189866291205	Guys need food n other commodities@#Alappuzha- these places TD SCHOOL @ medical college juction ,SDV school @ high court junction , tiruvampady. #KeralaSOS #KeralaFloods	kerala_floods_2018_test.tsv
1030405410920878082	7. @RailMinIndia has provided 1,20,000 water bottles. Another 1,20,000 bottles are ready to be despatched. It is also running a special train carrying 2.9 lakh litres of drinking water that will reach Kayakulam tomorrow. #KeralaFloods	kerala_floods_2018_test.tsv
1030802853802037249	@TomCruise #KeralaFloodRelief #KeralaFloods SIR PLEASE HELP US.DEATH TOLL RISE TO 200. @CMOKerala	kerala_floods_2018_test.tsv
1030810567835938816	@narendramodi Sir , Chenganoor area is in very dangerous condition..We need more army assistance there..Please Please help.@PMOIndia #KeralaFloodRelief	kerala_floods_2018_train.tsv
1031045983747096576	Govt Highschool Polleathai. Alappuzha; 14km north side of Alappuzha through beach road. We need food for 300 people, bed sheets and undergarments. Please do something as soon as possible. +91 98468 40228 - Bijoy #Verified 9PM, 18/08 #KeralaFloods #KeralaFloodRelief	kerala_floods_2018_train.tsv
1030861014525403136	#KeralaFlood Need national attention and National Help, as I hail from #Assam, where Flood is a annual ritual, I know the plight people had to face when such devastation happens. Please donate for #KeralaFloodReliefFund	kerala_floods_2018_train.tsv
1031043828197646336	Updated on 19/8/18 9Am We are still getting some call ask baby food, dress ,water , medicines,if anyone has extra items pls call me name.johny:9496660084 #KeralaSOS	kerala_floods_2018_train.tsv
1031116554094694401	Please help #Kerala My small contribution for #KeralaReliefFund #KeralaFloodRelief	kerala_floods_2018_train.tsv
1031358010474389504	As rain stops in flood-ravaged #Kerala, focus now shifts to supply of food, water, and medicine; Flights to resume from #Kochi Naval air base from today #KeralaFloods #KeralaFloodRelief	kerala_floods_2018_train.tsv
1031747521591169024	Friends outside India - we desperately need your help for the #KeralaFloods which have already left thousands homeless, and has a current death toll of 324 people. Please contribute at  from wherever you are in the world. #KeralaFloodRelief	kerala_floods_2018_train.tsv
1032186731163004928	Urgent need for chlorine tablets in Kozhikode district! Hardly available locally. Please send to DTPC office, Mananchira, Calicut. Verified request from Health Officer. #KeralaFloodRelief #DoForKerala	kerala_floods_2018_train.tsv
1031762913911025666	How can (WithYou Foundation an NGO)we contribute to victims with food and other requirements from mumbai ..Any leads pls share #KeralaFloods #KeralaFloodsHelpNeeded #StandWithKerala #KeralaFloodRelief #KeralaSOS #KeralaFloods	kerala_floods_2018_train.tsv
1031117537499467776	RT @damyantig: Verified, please RT, call, share, as necessary: Drinking water available : 9656694699 #Kottayam #KeralaSOS #Resource	kerala_floods_2018_train.tsv
1030396067374755841	#Keralafloods #Emergency Need urgent help. Genuine, verified. Location: Sri. Ayyappa College Hostel. Near Thiruvanchoor temple. #Chengannur 31 girls - Students stranded. Mob: +91 70254 38808	kerala_floods_2018_train.tsv
1030780204011024385	*Urgent help needed !!!* Aunt and family stranded in first floor of house along with 50 other people. One kid passed away one hour ago. Situation is getting worse as water level rises to first floor. #KeralaFloods #KeralaFloodRelief #KeralaSOS @Democratrodrigu @cinemasworld	kerala_floods_2018_train.tsv
1030802247322460160	North Wayanad is most hit and isolated. We need kits with these URGENTLY. if you can help, let me know. Ill send you my address which is a collection centre. #KeralaFloodRelief 5kg rice 1kg sugar 250gm tea powder 1/2 kg salt Whole moong (cherupayar) 1 ltr cooking oil.	kerala_floods_2018_train.tsv
1030412432232075264	17.08.18 4.15 pm Required in #UCCollege #Aluva Gas cylinder with burners and connectors Meals for 4000/- persons Diaper - baby and adult First aid medicine Bedsheet pillows Clothes Water #DoForKerala #KeralaFloods	kerala_floods_2018_train.tsv
1031030921267298305	@pratheesh @Plingmyaan 300000 FOOD PCKTS, 600000 MT MILK , 1400000 LTRS OF WATER, 150 PORTABLE WATER PURIFIERS CAPACITY OF 100000 LTR WATERS. WE ALL ARE HAPPY TO SAY UAE IS HELPING OMAN HELPING, BUT NOT READY TO ACCEPT THE FACTS ON GROUND. #KeralaFloodRelief	kerala_floods_2018_train.tsv
1030780609038233600	@CMOKerala Hello sir - NEED URGENT ATTENTION- Near malakara temple aranmula pathanamthitta around 300 people starving including kids without food or water .. PLS HELP ON URGENT BASIS ..#KeralaFloods #KeralaFloodRelief	kerala_floods_2018_train.tsv
1031851583775166464	#Urgent: Corporate sponsor needed to buy stranded viral medication meant for #KeralaFloodRelief. Please help if you know someone who can take this on.	kerala_floods_2018_train.tsv
1034734103013154816	#NandamuriHariKrishna Wrote His Last Letter About his Birthday and Requested Fans to Donate Funds to #Kerala victims. Video: #NandamuriHariKrishna #99TVTelugu #RIPHariKrishna #BreakingNews #KeralaFloods	kerala_floods_2018_train.tsv
1030755554300313600	My friends family stuck on terrace since 2 days grandma is 98 years old and there are 2 kids 2 years and 8 years old.. along with 9 adults. They need help desperately as the water levels are raising. #KeralaFloods #helpneeded #savekerla	kerala_floods_2018_train.tsv
1030779600761053184	RT @puchifying: #KeralaFloodRelief #KeralaFloods #KeralaSOS #resources #food Need urgent!!!	kerala_floods_2018_train.tsv
1030396228805189632	Need packed food @ kuchapuram St. mathews LP school, kattakada #Trivandrum #KeralaFloodRelief #KeralaFloods	kerala_floods_2018_train.tsv
1030405439920304129	@VishalKOfficial @Suriya_offl @SevenSri @anguvinoth @shiva_jammy @McZilGratoOffl @AryaTrends @A_Happie_Soul @EcrRavi @Aryananthakumar @Ramyakshan @vinodhamurali1 @VishnuMankara Please share max need help #KeralaFloods #Emergency @Karthi_Offl @arya_offl @VijaySethuOffl @niddu9 @Hema_Jammy @anjana @MercyMerlin2 @Caro03Ami @vimalsuccess @A_Happie_Soul @SuriyaNetwork @SuriyaFansClub	kerala_floods_2018_train.tsv
1032290355889074177	@juniorbachchan @AmarTvMedia @shwetavyas007 @JaipurPanthers Jaipur Abhishek Bachchan fans #ABCREW is doing help awareness campaign for #KeralaFloods. We request to everyone please come forward and help Kerala.	kerala_floods_2018_train.tsv
1034129763592372224	All india peoples stay to all Over country. The Kerala peoples need help pls help all and each and every one here we are kindly request to you. @CMOKerala @SushmaSwaraj @PMOIndia @PiyushGoyal #KeralaDonationChallenge #KeralaFloodRelief #keralarelieffunds #KeralaReliefRowTwist	kerala_floods_2018_train.tsv
1030719784961208320	RT KaapiRight: 30 പേർ ഈ ലൊക്കേഷനിൽ ഉണ്ട്. Urgent Help needed! Dropped Pin near Niranam, Kerala, India  30 people stranded on top of a home.. including old people..they don’t have food. Please share widely! VERIFIED. #KeralaFloods #KeralaFloodRescue #Ker	kerala_floods_2018_train.tsv
1033190427787251717	Happy Onam! Please help Kerala and Coorg peopleὤFἿB #onam #onamsaree #kerala #keralafloods #coorg #help #selfie #doodle #doodleart #digital #sketch #sketchbook #illustration #drawing #India #browngirl #artistoninstagram #artwork #dailypic #ArtistOnTwitter	kerala_floods_2018_train.tsv
1032932332544479232	RT @WLKeerthyS: @KeerthyOfficial fans who live nearby sansruti college Trivandrum please help #KeralaFloodRelief #Keralafloods	kerala_floods_2018_train.tsv
1031825277524103168	Please spread the message among your friends and family and help Kerala! All contributions to the CMDRF are 100% tax exempt. #KeralaFloodRelief	kerala_floods_2018_train.tsv
1030772658542194689	Urgent Requirement for #KeralaFloods Sanitary Pads required in Bulk for women of Kerala 90 relief centres in Trivandrum have asked for it urgently Please donate immediately &amp; liberally Call: 8884431226/ 7204508839 Material needs to be despatched in the evening #Donate4Kerala	kerala_floods_2018_train.tsv
