tweet_id	tweet_text	original_filename
913046147501092864	RT @WCraigFugate: #PuertoRico needs both immediate assistance from the impacts of Hurricane #Maria &amp; long term solutions. Build back strong	hurricane_maria_2017_train.tsv
914363897519513601	Help @realDonaldTrump the Puerto Rican GOvt is withholding from its citizens the food and water that we have sent as aid.	hurricane_maria_2017_train.tsv
913174197819641857	Let the world know! #SOSPuertoRico. Medicine, water, food, cash needed. 1 wk #HurricaneMaria @washingtonpost @CNN	hurricane_maria_2017_train.tsv
911634470964428800	@uscg @USCGAux @FEMA_Brock We need a plan for post plastic water bottles too, Haiti was overwhelmed after the earthquake w plastic trash	hurricane_maria_2017_train.tsv
914211993439096832	please help even a few dollars makes a difference	hurricane_maria_2017_train.tsv
911790635614707712	RT @JRNiles: Going to keep tweeting this HELLO #FEMA Puerto Rico has no water and they are running out of food. These are our people #Hurri	hurricane_maria_2017_train.tsv
910547969035845633	Our friends in Puerto Rico need all of our help. The video coming in from there is incredible. Big $ needs to be raised. #PuertoRicoStrong	hurricane_maria_2017_train.tsv
914228397236203522	Please help families in Utudao find their families on the mainland. #todoporpuertorico #hurricanemaria #share	hurricane_maria_2017_train.tsv
912174378510675968	Gov. of Puerto Rico says  help. The Mayor says if you can hear us.help. Cries for help from a U.S. territory. #HurricaneMaria	hurricane_maria_2017_train.tsv
913790483587059712	Puerto Rico, short on fuel, cannot deliver food and medicine to the victims of Hurricane Maria	hurricane_maria_2017_train.tsv
914522843068731393	People in #PuertoRico need water, food, generators &amp; so much more as an affect of being slammed by #HurricaneMaria -	hurricane_maria_2017_train.tsv
912999293786644480	@ChrisMurphyCT Senator Murphy hundreds of Puerto Rican families with children will be coming to CT seeking refuge post Hurricane Maria and we need to help them. Whats being put in place to help them?	hurricane_maria_2017_train.tsv
911607942004084736	Please help Puerto Rico. I havent been able to contact my family since Hurricane Maria hit and I dont know if theyre safe. Im so worried	hurricane_maria_2017_train.tsv
913059624441536512	Please show some compassion and generosity to the hurricane victims. They need our help! ❤️	hurricane_maria_2017_train.tsv
913942046783746048	Donate to Relief Effort in Puerto Rico | We are dying here, Mayor Cruz said in a press conference.	hurricane_maria_2017_train.tsv
914545211556155398	PLIGHT OF PETS IN PUERTO RICO, help is needed #puertoricopets #petsinpuertorico #hurricanemaria	hurricane_maria_2017_train.tsv
912042290436243456	For PR More than food and other items Battery operated fans, AA and D batteries area needed! #HurricaneMaria Please help!	hurricane_maria_2017_train.tsv
913370262724399105	Friends. My wife @lillians grandpa was directly impacted by #HurricaneMaria in #PuertoRico. Please help!	hurricane_maria_2017_train.tsv
912231735114338304	RT @tessmartinez6: @realDonaldTrump @ussenate @USHouseofReps Please send requested aid to Puerto Rico. #MariaPR #Maria	hurricane_maria_2017_train.tsv
913449334829658112	Medicaid funding needed in Hurricane Maria relief package #prsectorprivado #nwg	hurricane_maria_2017_train.tsv
912459737848979456	@SenSanders Please please help our fellow Americans	hurricane_maria_2017_train.tsv
911920031923097600	RT @WFTV: Hurricane Maria: Multiple groups seek supplies for Puerto Rico	hurricane_maria_2017_train.tsv
914094317097992192	@JohnMoralesNBC6 Tweet sent Thursday, September 21 by @PuertoRicoPUR: PUERTO RICO NEEDS HELP NOW! PLEASE DONT FORGET US. #HurricaneMaria Photos @TheAtlantic  #PuertoRico἟5἟7἟A἟8#PuertoRicoSeLevanta #PuertoRicoReliefNOW	hurricane_maria_2017_train.tsv
910708794396758016	RT @AlynneStark: The poor people are hungry, she said. Workers need direct help. #puertorico #HurricaneMaria	hurricane_maria_2017_train.tsv
911814879740178432	@elonmusk Puerto Ricans might be left without power for months due to hurricane Maria. They need your batteries and solar power! Please help	hurricane_maria_2017_train.tsv
911691667295604736	@sarahkendzior @KatrinaHagen2 It’s horrendous I have friends and family there. No electric no clean drinking water no flight out until next week.	hurricane_maria_2017_train.tsv
914584014014550016	and will be distributed by the community leaders of Vieques means piled up somewhere, NOT delivered to people in need.	hurricane_maria_2017_train.tsv
911973755026591745	We wrote this piece before devastating #HurricaneMaria. Debt relief and federal aid for #PuertoRico is now even more necessary and urgent	hurricane_maria_2017_train.tsv
911713667867140096	RT @CofCnews: A Church of Christ in the Caribbean, devastated by Hurricane Irma, asks for aid:	hurricane_maria_2017_train.tsv
914181720714416128	Hurricane Maria left massive devastation. Were on the ground for #PuertoRicos children. Help us provide aid today:	hurricane_maria_2017_train.tsv
911618712393961474	@realDonaldTrump get puerto rico help, power, food, and resources !!!!!	hurricane_maria_2017_train.tsv
910681390072631297	THIS IS RIDICULOUS. U.S. IS RESPONSIBLE FOR PUERTO RICO SINCE WE REFUSED TO STOP BEING THEIR COLONIZERS. US GOVT NEEDS TO HELP NOW.	hurricane_maria_2017_train.tsv
913322603703603200	Please help our Caribbean brothers &amp; sisters.	hurricane_maria_2017_train.tsv
911670390312755201	My bro Ric, is in need of some financial assistance after the devastation in Puerto Rico by hurricane Maria. THX!	hurricane_maria_2017_train.tsv
913395762553393153	Bergen County-Victims of Hurricane Maria in Puerto Rico need your help!	hurricane_maria_2017_train.tsv
912164015014588416	@kobebryant you were going to help for a good cause in Puerto Rico w/ The Autism Training Center, but we need help now with Hurricane Maria.	hurricane_maria_2017_train.tsv
914740661827534848	RT @sinbadbad: US Virgin Islands also need our help. @realDonaldTrump if you are not going to presidential then let the grown folks	hurricane_maria_2017_train.tsv
911895746408075264	RT @DA_RELIEF: Hi guys we need a van or drivers that can help us today!!!!!! Many thanks from the team xx #Dominica #hurricaneMaria	hurricane_maria_2017_train.tsv
913384916250918914	The island of Dominica ἞9἟2 was devastated by Hurricane Maria. There is very little press coverage. Please help them:	hurricane_maria_2017_train.tsv
910577272473743360	As Puerto Rico must deal with Hurricane Maria please keep in mind Buffalos large Puerto Rican population and help as you can.	hurricane_maria_2017_train.tsv
912076082387484673	Lets not forget them or the US Virgin Island, while Trumpet tweets nonsense these folks need help.	hurricane_maria_2017_train.tsv
911675331173605377	Once a Hurricane passes, the problems it leaves behind stay around a lot longer. #PuertoRico needs help right now	hurricane_maria_2017_train.tsv
914580314416123904	Even here in the US - disaster response needs to improve fast. In #PuertoRico 3.4M People in desperate need for help	hurricane_maria_2017_train.tsv
913979265955352576	RT @AdamSchefter: Help friends find Irma+Tony Soto from Utuado Puerto Rico. Family hasn’t heard from them since Hurricane Maria. Pls call o	hurricane_maria_2017_train.tsv
914242224958951424	And just so you know @realDonaldTrump the folks living in #USVirginIslands are ἟A἟8too &amp; they need help. #DoYourJob	hurricane_maria_2017_train.tsv
912273741975040002	They need more than prayers. They need HELP from US Government. #fema #nationalguard #navy	hurricane_maria_2017_train.tsv
911809053579530242	RT @BamaStephen: Amen, the #USA must assist the #VirginIslands immediately. These are our fellow citizens. #HurricaneMaria	hurricane_maria_2017_train.tsv
913098876583735296	RT @foodskop: Please help our #puertorican #scientists	hurricane_maria_2017_train.tsv
913656340538580993	#trainer Survivors of Hurricane Maria desperately need aid: Puerto Rico is desperate.  #fit #fitness	hurricane_maria_2017_train.tsv
912464364720082945	RT @PuertoRicoPUR: PUERTO RICO NEEDS HELP NOW! PLEASE DONT FORGET US. #HurricaneMaria	hurricane_maria_2017_train.tsv
912293862164566016	We need help! Please watch	hurricane_maria_2017_train.tsv
911716934986629120	@ekcj1234 @marcorubio @ricardorossello @WhiteHouse @POTUS I have friends and family on first flight here that’s next Saturday. They have no clean drinking water. ὤFἿB	hurricane_maria_2017_train.tsv
913494682902175744	If you read this please help my sister with a RT❗️She lost her roof because of #HurricaneMaria	hurricane_maria_2017_train.tsv
912375753685204998	Do you know what the Jones Act is and why it is preventing Puerto Ricans from obtaining the aid they need? Sign the petition to help!	hurricane_maria_2017_train.tsv
914554175136165888	@funforlouis hello! could you help spread the word Puerto Rico needs help. After Hurricane Maria its been chaos and people are dying. PLEASE	hurricane_maria_2017_train.tsv
913619808024973312	@YoshikiOfficial the effects of hurricane Maria in Puerto Rico are devastating.I miss &amp; need ur music now more than ever.We need help. ἟5἟7Ὁ4ὢ2	hurricane_maria_2017_train.tsv
913791854306631680	@Ryanair I need help with a refund. I am affected by Hurricane Maria and cannot reach Europe for my flight.	hurricane_maria_2017_train.tsv
912420740980494337	Vladimir Putin can you tell @realDonaldTrump to help the people in Puerto Rico? Hell listen to you. #PuertoRico #HurricaneMaria	hurricane_maria_2017_train.tsv
911568584433737728	RT @DENISEVASQUEZ: Food, water, military, planes, gas, boats, supplies! Like two days ago!!! #puertorico #hurricanemaria	hurricane_maria_2017_train.tsv
912297179489939456	This @DavidBegnaud report on #PR is chilling. Theses are Americans w/o power,low on water &amp; supplies 6d after storm	hurricane_maria_2017_train.tsv
912352902768885761	Puerto Rico is a Territory of the U.S. and they need the help of #globalcitizens everywhere.	hurricane_maria_2017_train.tsv
913132525626822656	Were collecting NEW toiletries, baby diapers &amp; feminine hygiene products for #PuertoRicoRelief from #HurricaneMaria! #ROC	hurricane_maria_2017_train.tsv
911654071379079168	RT @JDEstradawriter: #PuertoRico Needs help. I know there are lots of things happening, but the Island isnt a blip. Help change that after	hurricane_maria_2017_train.tsv
913479151453184005	Hurricane Maria made landfall last week, and people in Puerto Rico and the U.S. Virgin Islands are in need of help:	hurricane_maria_2017_train.tsv
914128176149942272	ὄ1️ὄ1️἟5἟7἟B἞Eare἟A἟8 in desperate need of HELP	hurricane_maria_2017_train.tsv
913099284928536576	Will someone in the Administration please show these pictures to @realDonaldTrump? Maybe he has an ounce of humanity and will send real help	hurricane_maria_2017_train.tsv
912050068135534592	PUERTO RICO ἟5἟7 hospitals at capacity and Drs say many people will die w o care. Please help any way you can Our Bros &amp; Sis have nothing!	hurricane_maria_2017_train.tsv
911788953900126208	@FDNY @NYCMayor @MMViverito P.R. hospitals are filled to capacity, P.R mayors have asked for supplies including water, gas, ice	hurricane_maria_2017_train.tsv
913146148671672322	@CNN @ShepNewsTeam @NewsHour Why? What can be done to circumvent this? These r preventable deaths!	hurricane_maria_2017_train.tsv
914575867870924802	Back in San Juan where the phone service is dodgy, ELEVEN DAYS after #HurricaneMaria. Places still w/o water. Help if you can.	hurricane_maria_2017_train.tsv
913197363639885824	@AntonioSabatoJr  The ARRL is also very much involved in providing needed communication for victims of Hurricanes 3/	hurricane_maria_2017_train.tsv
913167198541119488	#Latinos in the US need to be up in arms about what is going on in #PuertoRico. We need your voices, we need Help! #HurricaneMaria	hurricane_maria_2017_train.tsv
912418805720240129	RT @Al_Letson: Thread. Puerto Rico needs help, now.	hurricane_maria_2017_train.tsv
913153045839716352	#HurricaneMaria: Delivery of critical aid is intensifying in #Dominica- water, food &amp; shelter are most urgent needs	hurricane_maria_2017_train.tsv
913687319852466176	The distribution of food and water in Puerto Rico is painfully slow eight days after Hurricane Maria, Pres. Trump	hurricane_maria_2017_train.tsv
914117909961637888	The mayor of Puerto Ricos capital San Juan has issued an impassioned plea for help as the US territory struggles after #HurricaneMaria	hurricane_maria_2017_train.tsv
912396236543729665	#DSTRRescueNeeded Children are in desperate need of help aft	hurricane_maria_2017_train.tsv
913222691729100801	#HelpPuertoRico #HurricaneMaria water, food, security	hurricane_maria_2017_train.tsv
912049488704946176	RT @HPRESQ: If you have lost a pet or are a pet owner in need for any assistance due to hurricane Irma, Harvey or Maria	hurricane_maria_2017_train.tsv
912466410554589184	. @FEMA still hasnt stepped foot into some of the more rural areas hit hard by hurricane Maria per reporter on the ground. @realDonaldTrump	hurricane_maria_2017_train.tsv
914674839612530689	Help my country plz! Most ppl dont even know where its located. But hurricane Maria did. Plz retweet! FOOD, MEDICINE &amp; WATER NEEDED ASAP	hurricane_maria_2017_train.tsv
912361668616884224	#DSTRFoodShortage No food: devastating impact of Maria in Pu	hurricane_maria_2017_train.tsv
913129065317466112	RT @SenatorLeahy: A must read. The people of Puerto Rico &amp; US Virgin Islands need our help, &amp; we need to act quickly #PuertoRicoRelief http	hurricane_maria_2017_train.tsv
912388670207881216	HELP! @NestleWatersNA @NestleUSA and @CocaCola and @PepsiCo and @ArrowheadWater and @Costco @Walmart ὂCὊ6 please.	hurricane_maria_2017_train.tsv
913608566887649280	Help mi hermano help others! #UnidosPorPuertoRico &gt;We need #ChoppersForPuertoRico	hurricane_maria_2017_train.tsv
912249904243904512	RT @NUJScotland2: The Government of Dominica desperately needs your support. Help the people affected by Hurricane Maria.	hurricane_maria_2017_train.tsv
911987728929005569	Hey Trump, you simpering fckface, maybe tweet something about these AMERICANS in dire need of help rather than racist rants about #TakeAKnee	hurricane_maria_2017_train.tsv
912377519738949632	Some video of Puerto Rico. No power, no gas, no food and no water! #PuertoRico #PuertoRicoRelief #HurricaneMaria	hurricane_maria_2017_train.tsv
910682762616688641	please share, so many animals in need of rescue and shelter as well Ὁ4ὡ4	hurricane_maria_2017_train.tsv
911596231528415232	No electricity, water, internet, gas, ice, phone service since Tuesday. #HurricaneMaria	hurricane_maria_2017_train.tsv
911701247912181761	@brad_nesslerCBS Hurricane Maria also hit St Croix! Please remember STX too!!! These need a lot of help	hurricane_maria_2017_train.tsv
912405447793086464	HELP THEM PLEASE!! This is truly heartbreaking!! #HelpPuertoRico	hurricane_maria_2017_train.tsv
913030405451866113	Arguably the Americans who most desperately need help.	hurricane_maria_2017_train.tsv
914222230573342720	RT @MAlexandra_06: Puerto Rico is in need of supplies and donations due to hurricane Maria. Last day for drop off: October 12.	hurricane_maria_2017_train.tsv
914174026003738624	Ricky Martin On Ellen: As a Puerto Rican, As An American, I Ask for Your Help #AllIn4PR #Maria #HelpPuertoRico	hurricane_maria_2017_train.tsv
911667199252758528	RT @Mariie_4: Ὢ8RT Ὢ8Puerto Rico Need Us, Please Help Us With Any Donation ὤFἿC♥️἟5἟7 #LosNuestros #PuertoRico #hurricaneMaria	hurricane_maria_2017_train.tsv
913401912451489792	People still need your help after Hurricane Maria. DHS explains the best ways to help the survivors here:	hurricane_maria_2017_train.tsv
911942515019874304	mis abuelos and extended fam living in PR are without water and electricity. help if u can	hurricane_maria_2017_train.tsv
911649190362714112	My island, #PuertoRico, is in total devastation! Please consider helping our 3.5m fellow Americans! #HurricaneMaria	hurricane_maria_2017_train.tsv
913253786138882049	Get your sh*t together @realDonaldTrump . #PuertoRico needs help NOW. #HurricaneMaria	hurricane_maria_2017_train.tsv
911587118958424064	RT @KevinMarin27: If anyone has any information on the situation in Añasco, Puerto Rico please pass it on ὤFἿB #hurricanemaria #puertorico #a	hurricane_maria_2017_train.tsv
911924451238907904	RT @SimplySunEvents: @NYGovCuomo @NYCMayor please send help to #vieques #puertorico too. Theyre in dire need of emergency supplies &amp; funds	hurricane_maria_2017_train.tsv
912970354108305409	PUERTO RICO WAS DESIMATED BY HURRICANE MARIA AND IS STILL IN THE DARK. FLINT STILL DOES NOT HAVE WATER. MEXICO IS IN DIRE NEED OF AID.	hurricane_maria_2017_train.tsv
912448409566629888	@YousefErakat Please please!!!! My Island Puerto Rico needs help. Hurricane Maria devastated our Island. My people is in need of water&amp;food.	hurricane_maria_2017_train.tsv
912256539985088515	Media dont look at Puerto Rico anymore, nor does Donald T, who rather discusses how to salute the flag. But Puertoricans need help. Now.	hurricane_maria_2017_train.tsv
913855426390745089	@potus American citizens in Puerto Rico are Dying due to lack of meds, food, water &amp; fuel! U ALONE R RESPONSIBLE !	hurricane_maria_2017_train.tsv
913942694396940288	If you can, plz respond to this call for help by giving what your can to @popdemocs Puerto Rico relief fund: ➡️➡️➡️	hurricane_maria_2017_train.tsv
914195010572242945	RT @LenaCiminillo: Help the Kalinago Community Rebuild from Hurricane Maria  via @youcaring	hurricane_maria_2017_train.tsv
912978624445284354	@POTUS Pls send help to #PuertoRico 3M+ #Americans are suffering. #HurricaneMaria is a tragic humanitarian crisis.	hurricane_maria_2017_train.tsv
913083834790547456	They need help, but point is theyve wasted and stole money weve been sending them since 1898. But you knew that	hurricane_maria_2017_train.tsv
914841261353455616	RT @Ogalina: #help is desperately needed for #hurricaneirma #hurricaneharvey #hurricanemaria #hurricanerelief	hurricane_maria_2017_train.tsv
914025682388299777	As Trump spends 2nd weekend golfing since Hurricane Maria devastated Puerto Rico, San Juans Mayor begs for help.	hurricane_maria_2017_train.tsv
912393815281061889	@NPR Please help everyone get Puerto Rico back to the top of their list of concerns. Conditions described as apocalyptic #HurricaneMaria	hurricane_maria_2017_train.tsv
913000754402725888	Puerto Rico is part of our nation, too. Please help by going to  #PuertoRicoRelief	hurricane_maria_2017_train.tsv
914100971604766720	We need to do everything humanly possible to help the people of PR. Our president might be a monster but as US citizens we are not!	hurricane_maria_2017_train.tsv
914621725505212419	.@TheView Please donate 2 Puerto Rica relief$$ needed 4 water-food-medicine-2 rebuild.	hurricane_maria_2017_train.tsv
914036582503604224	Puerto Rican mayor begs for aid after Hurricane Maria  What does this do for image of US globally? bad enuf already	hurricane_maria_2017_train.tsv
912464322307153921	Please help my friends and their families in Puerto Rico after the devastation of Hurricane Maria ὡE἟5἟7  RT this!!!!!	hurricane_maria_2017_train.tsv
914099470417227776	RT @TelegraphNews: Mayor of Puerto Rico’s capital city wears T-shirt saying help us, we are dying” following Hurricane Maria	hurricane_maria_2017_train.tsv
912351377380331521	@realDonaldTrump @POTUS Please send help to our fellow US citizens suffering in Puerto Rico. You have the power to help! Youll be a hero!	hurricane_maria_2017_train.tsv
912412491946262530	#HurricaneMaria is Trumps Katrina, but then everything is. Nevertheless they need help! Retweet #PuertoRicoRelief	hurricane_maria_2017_train.tsv
911794244142157825	This is reality and this is what they are living through Im taking everything I can please they need batteries and flashlights	hurricane_maria_2017_train.tsv
913177319602343938	[Clean underwear needed] How to Help Puerto Rico and Other Islands After Hurricane Maria -	hurricane_maria_2017_train.tsv
914272963351982080	If you’re on your way to contribute to this drive, please take moving/storage boxes with you if you can. They’re in need of some! Thank you!	hurricane_maria_2017_train.tsv
913037020758454273	@realDonaldTrump what are you waiting for? HELP THEM! Puerto Rico is part of the US, give them aid damnit!	hurricane_maria_2017_train.tsv
912964538257100800	Dear @Pirates the homeland of the Great One, Roberto Clemente, was devastated by #HurricaneMaria and we need all help we can get. #Thanks	hurricane_maria_2017_train.tsv
914183534939586565	Please help #proudpuertorican #weareamericans	hurricane_maria_2017_train.tsv
913153597856272385	#PuertoRico need all the help they can get! I have friends who still cant get ahold of their families. #HeartBreaking #HurricaneMaria	hurricane_maria_2017_train.tsv
913877502405292033	RT @DVRockland: #PuertoRico is in need of basic supplies such as water, diapers, wipes, and more following #HurricaneMaria.	hurricane_maria_2017_train.tsv
911709528101675010	I wish I could help. Its awful to think whats happened in the Caribbean after #HurricaneIrma and #HurricaneMaria They need our help!	hurricane_maria_2017_train.tsv
913364940534067200	Play the hero rather than the dick, @realDonaldTrump Food, water, fuel needed on Vieques, USA. #PuertoRicoRelief	hurricane_maria_2017_train.tsv
911751525650849792	RT @JDEstradawriter: Please, any #booktuber #blogger #writer #musician #artist that can help keep #puertoRico in the news after #hurricaneM	hurricane_maria_2017_train.tsv
914206707068399616	Glad to hear this. Now since all aid for US Virgin Islands MUST go through PR, will they be helped also?	hurricane_maria_2017_train.tsv
913299314549645312	Absolutely despicable and sick! Our brothers and sisters in Puerto Rico NEED help! They have no power, water, food or their homes!	hurricane_maria_2017_train.tsv
912355897334169600	Fast. The conditions are so bad. We need medical attention &amp; hospital supplies, where are the cruise ships like arrived in Miami?	hurricane_maria_2017_train.tsv
912979875589492738	Puerto Rico is a US territory and the Puerto Rican people are US citizens. They need Emergency Aid now !	hurricane_maria_2017_train.tsv
913758868588584961	White House Urged to Step Up Relief Effort via @NYTimes @realDonaldTrump -Urged? MOVE!!!!! #PuertoRico	hurricane_maria_2017_train.tsv
911916829773352960	My family are still without food/water. Rural communities have been cut off from aid/communication. #Dominica NEEDS HELP #HurricaneMaria	hurricane_maria_2017_train.tsv
914176330048163840	#Impeach #ImpeachTrump #Resist ὄ9 ὄ9  #PuertoRico desperately needs water, food, and medicine after #HurricaneMaria	hurricane_maria_2017_train.tsv
912373682277945349	RT @newsone: They need our help: @carmeloanthony pens emotional essay in #HurricaneMaria aftermath	hurricane_maria_2017_train.tsv
913369096900825088	Exactly. All these islands need help, its just that Puerto Rico is much larger and IS the responsibility of the US to assist.	hurricane_maria_2017_train.tsv
913123034680184833	Please do something to help Puerto Ricans! #PuertoRicoRelief	hurricane_maria_2017_train.tsv
914448153788772352	Adopt dont buy. They need our help as well. Lot of cats, dogs, horses, birds. Many of them have been shipped to USA	hurricane_maria_2017_train.tsv
913410722511642625	Truly horrific. Our fellow Americans are desperate and need our help right now. Heres one option:	hurricane_maria_2017_train.tsv
913968959753404417	Our Brothers &amp; Sisters need our help Jamaica in past, other islands, all expedited oh, those were previous presidents who cared 4 its citizens! Getr Done! @fema @PuertoRicoPUR @RepAdamSchiff @SpeakerRyan @maddow @nytimes @alfranken @KamalaHarris @CNN @HRC @Oprah @funder	hurricane_maria_2017_train.tsv
913875081469636608	Rabbi in Puerto Rico pleads for help as congregation suffers on  #Science #PresidentTrump #HurricaneMaria #Rabbi	hurricane_maria_2017_train.tsv
911775688621019136	RT @JRNiles: @FEMA Puerto Rico has NO water and running out of food. WTF get on it. smh these are our citizens. #HurricaneMaria #PuertoRico	hurricane_maria_2017_train.tsv
911788782336212992	RT @alexxdlr: Please RT ‼️RT‼️ I got in contact with my mom and she lost everything due to flooding. Please help us and share	hurricane_maria_2017_train.tsv
914810832344756224	RT @theneillowe: URGENT CALL - Puerto Rico need your help - EVERYTHING WILL HELP - Please Contact Federal Hurricane Response Relief	hurricane_maria_2017_train.tsv
911770283815702528	Hurricane Maria Intensifies to Category 4  Urgent need send aid immediately care of the	hurricane_maria_2017_train.tsv
914341394650673153	We do need food and water, so if you’re reading this, please #helpPuertoRico #hurricanemaria #mariapr #huracanmaria	hurricane_maria_2017_train.tsv
913376230216540160	So awful! We need to help #PuertoRico now. Islanders cut off from world: Weve lost everything	hurricane_maria_2017_train.tsv
914219057674637313	To my wonderful friends, if you have any supplies that you can spare.the 2nd- MD Suburbs Hurricane Maria	hurricane_maria_2017_train.tsv
912384575078146048	Even major charities are struggling just to get needed supplies to Puerto Rico. Washington must help in several crucial ways.	hurricane_maria_2017_train.tsv
913994313385771008	Anyone home @WhiteHouse? .Start dropping Rations, Fuel &amp; Bottled Water over remote areas in #PuertoRico DAILY! American citizens are dying! Cc: @realDonaldTrump @potus @fema @USNavy @USArmy @usairforce @USNationalGuard @USCG @GOP @Scavino45	hurricane_maria_2017_train.tsv
913883158856323072	Puerto Rico in dire need of food, water after Hurricane Maria  #breaking #usa #world #news #video #today #watch #fo	hurricane_maria_2017_train.tsv
