_unit_id	_golden	_unit_state	_trusted_judgments	_last_judgment_at	please_choose_a_category:confidence	created_at	id_str	rownames	please_choose_a_category	text
1847305403	FALSE	finalized	4	08/05/2018 1:42	0.505	Thu Jun 21 19:13:35 +0000 2018	",1009877007654670336,"	6933	noneyewitness	"If flood waters have covered a garden, most produce will be unsafe to eat. Several factors determine the safety of  https://t.co/3tqowLFSMm"
1847304568	FALSE	finalized	3	08/05/2018 0:41	1	Thu Jul 05 04:03:20 +0000 2018	",1014721363481948160,"	22611	noneyewitness	"Houston streets flood after heavy rains, sparking memories of Harvey https://t.co/pTiqos6l16 #News"
1847304992	FALSE	finalized	3	08/06/2018 12:10	1	Fri Jul 06 20:43:45 +0000 2018	",1015335516089339907,"	110095	noneyewitness	The severe storm in Wake county is also dumping heavy rain. There's a flash flood warning in effect until 6:15pm. T  https://t.co/FArSXK2xUh
1847306096	FALSE	finalized	3	08/06/2018 11:11	0.6765	Mon Jul 04 04:56:29 +0000 2016	",749829210357714945,"	2239	noneyewitness	"Helped nearby drivers by reporting a flood on I-635 W, Dallas on  waze - Drive Social. https://t.co/XLNG3GVNXQ"
1847304446	FALSE	finalized	4	08/05/2018 1:22	0.7615	Thu Jul 05 15:58:52 +0000 2018	",1014901432326213632,"	67430	noneyewitness	A flood warning is in effect for Manatee River with more rain in the forecast. ||  saranealeigh https://t.co/RBnhGNWBKg
1847304933	FALSE	finalized	5	08/05/2018 23:16	1	Fri Jul 06 00:18:15 +0000 2018	",1015027106101776384,"	8638	noneyewitness	Heavy rain could cause flooding starting early Friday morning. https://t.co/GSt6WAE1zf
1847304618	FALSE	finalized	3	08/05/2018 20:31	1	Thu Jul 05 18:58:52 +0000 2018	",1014946732420075522,"	84183	noneyewitness	"FLASH FLOOD WARNING: Franklin County, MA until 5pm  #thunderstorms #wx #mawx #rain #flashflooding"
1847305680	FALSE	finalized	3	08/06/2018 12:14	0.3521	Thu Jun 21 20:30:55 +0000 2018	",1009896467744677889,"	14370	noneyewitness	"Even as the heavy rain has moved out, watch for areas of flooding in western Rockbridge County, near Rockbridge Bat  https://t.co/lkM0lkumuV"
1847304792	FALSE	finalized	3	08/04/2018 23:06	1	Fri Jul 06 06:34:18 +0000 2018	",1015121744598888448,"	35503	noneyewitness	Memorable moments from Houston's July 4th flood https://t.co/jXYVTrKtZH
1847304101	FALSE	finalized	4	08/05/2018 2:30	1	Wed Jul 04 22:55:27 +0000 2018	",1014643880996802561,"	830	noneyewitness	 RVAStreetMedia  JuliLD And California still doesn t have proper flood control....both your states are at fault not the Federal Goverment
1847305625	FALSE	finalized	3	08/05/2018 0:39	1	Thu Jun 21 23:04:54 +0000 2018	",1009935219439341568,"	29733	noneyewitness	Everybody is saying pray for the RGV cause of the flood but what y all really need to pray for are all the pets (do  https://t.co/gXPIT24cL5
1847304599	FALSE	finalized	3	08/06/2018 3:40	0.3473	Thu Jul 05 14:11:33 +0000 2018	",1014874427270615042,"	57841	noneyewitness	"I  considered moving to Houston. Glad I didn't, that city floods too often. https://t.co/zfEJ98AMXl"
1847305109	FALSE	finalized	4	08/05/2018 21:14	1	Thu Jul 19 15:57:51 +0000 2018	",1019974607367884801,"	14303	noneyewitness	Heavy rain floods areas north of #Flagstaff #12News #azwx #monsoon2018   https://t.co/BFedMRD9v3
1847305767	FALSE	finalized	4	08/05/2018 2:06	1	Mon Jul 30 05:44:11 +0000 2018	",1023806441193439233,"	34579	noneyewitness	Severe flood situation alert for public issued by Central Water Commission.  #weatheralert #floodalert #NewDelhi https://t.co/7yy65JwpVX
1847304394	FALSE	finalized	3	08/05/2018 4:04	1	Thu Jul 05 13:02:47 +0000 2018	",1014857121328959488,"	52285	noneyewitness	Planning for delivering flood resilience at scale  Zurich phase 2 with partners  floodalliance  Concern  PlanGlobal  https://t.co/CBsQWDzGQq
1847304339	FALSE	finalized	3	08/05/2018 21:14	0.3404	Thu Jul 05 04:44:05 +0000 2018	",1014731619880464385,"	24916	noneyewitness	"Tropical storm warning cancelled, GovGuam back to normal operations. Flash flood watch still in effect. Go to https://t.co/O2P6fvLBzL"
1847305597	FALSE	finalized	3	08/06/2018 5:09	1	Fri Jun 22 00:57:27 +0000 2018	",1009963543188463616,"	41288	noneyewitness	Widespread flooding in Texas following days of heavy rain - Nearly 13 inches in 48 hours https://t.co/f9wyTtFg5i #grandsolar
1847304445	FALSE	finalized	3	08/05/2018 2:04	1	Thu Jul 05 15:58:49 +0000 2018	",1014901422415122433,"	67429	noneyewitness	"Flash flood warning for parts of Monroe, Marshall and Wetzel counties until 2:45 PM. https://t.co/3vSPhCsXNv"
1847304178	FALSE	finalized	5	08/06/2018 1:32	0.6046	Wed Jul 04 23:54:14 +0000 2018	",1014658677196951553,"	4947	noneyewitness	What? Flash flood warning in Western PA? THAT NEVER HAPPENS.
1847305656	FALSE	finalized	3	08/06/2018 10:39	0.6525	Thu Jun 21 20:10:22 +0000 2018	",1009891294901080065,"	12460	noneyewitness	"Intense thunderstorms across BC Interior flood roads, cut power, spark fires - https://t.co/VkVyqto6AL https://t.co/zSMHv5Om9z"
1847304815	FALSE	finalized	5	08/05/2018 1:02	0.5941	Fri Jul 06 12:26:26 +0000 2018	",1015210359802736640,"	57862	noneyewitness	"New flash flood warning in effect until 1230pm; up to 2.5"" inches of rain has already fallen and more continues to  https://t.co/y7RQR3x275"
1847305140	FALSE	finalized	3	08/06/2018 8:47	0.6375	Thu Jul 19 16:29:00 +0000 2018	",1019982447772135429,"	19672	noneyewitness	Flood warning for Mendenhall River due to a glacier-damned lake outburst.  River was near flood stage at 7:36 AM Th  https://t.co/Z3H2OZAAqf
1847304932	FALSE	finalized	3	08/06/2018 2:19	0.6906	Fri Jul 06 00:18:04 +0000 2018	",1015027060002021376,"	8610	noneyewitness	Flash flood warnings in New Mexico.. I hope the monsoons poor  Bring it goddess of rain we need water
1847305929	FALSE	finalized	3	08/04/2018 23:27	0.6919	Mon Jul 04 06:45:20 +0000 2016	",749856604145586176,"	6390	noneyewitness	Flash flood nears West Frankfort homes https://t.co/ItwfAVDFSS
1847304644	FALSE	finalized	3	08/06/2018 2:41	0.354	Wed Jul 04 23:48:55 +0000 2018	",1014657338551218176,"	4535	noneyewitness	 DarleneDeJohnet That s a normality if Florida.  It rains a lot in the summer.  Streets everywhere can flood.
1847304477	FALSE	finalized	3	08/05/2018 2:44	1	Thu Jul 05 18:36:42 +0000 2018	",1014941153920155648,"	82076	noneyewitness	"One main area seeing significant increasing trends in flood frequency since 1985 is the Midwest, a region that is a  https://t.co/0YTyYk80kG"
1847305856	FALSE	finalized	4	08/05/2018 2:32	1	Sun Jul 29 23:46:17 +0000 2018	",1023716374189891589,"	15482	noneyewitness	Family rescued after van gets stuck in flood off Apopka Vineland.#Fox35  Fox35News https://t.co/7xfppMOssg
1847304494	FALSE	finalized	4	08/06/2018 0:34	1	Thu Jul 05 19:18:22 +0000 2018	",1014951639365500928,"	86211	noneyewitness	Bike rider and passenger swept away by flood in the twinkling of an eye in Enugu as onlookers watched in horror  https://t.co/xksutnB0oi
1847305529	FALSE	finalized	3	08/05/2018 3:08	0.6685	Thu Jun 21 23:25:11 +0000 2018	",1009940323424964609,"	31428	noneyewitness	Brooooo all these tweets about the flood are killing me
1847305772	FALSE	finalized	3	08/05/2018 3:56	0.6709	Mon Jul 30 18:46:48 +0000 2018	",1024003390840295425,"	90238	noneyewitness	Tamilnadu can choose any water level safe for Mullapperiyar dam. But its needed to make sure flood in Kerala is not  https://t.co/bWWhuOTQTN
1847305225	FALSE	finalized	4	08/05/2018 2:13	0.7572	Thu Jul 19 19:14:34 +0000 2018	",1020024112905883648,"	52403	noneyewitness	"As sea levels continue to rise, more and more homeowners will need to consider purchasing flood insurance-- which i  https://t.co/lCtSbYCglV"
1847304521	FALSE	finalized	4	08/06/2018 2:00	1	Thu Jul 05 14:34:38 +0000 2018	",1014880236205420544,"	59855	noneyewitness	After flood waters broke down her garage door and flooded entire basement woman on the news says 'god is good'. Wow  https://t.co/e7bN166vQV
1847305048	FALSE	finalized	3	08/06/2018 2:35	0.6871	Thu Jul 19 14:58:42 +0000 2018	",1019959724073193474,"	5216	noneyewitness	"Binance is on fire collecting $ 410,000 for flood  victims https://t.co/RdzWcWm2j5 https://t.co/3cIPjguZ8D"
1847305937	FALSE	finalized	3	08/06/2018 10:12	1	Mon Jul 04 14:30:09 +0000 2016	",749973575977754624,"	22010	noneyewitness	"Body found in wash in southwest valley, could be third flood victim - https://t.co/9kbqbA2Lez #GoogleAlerts #givingeveryday"
1847304707	FALSE	finalized	4	08/05/2018 22:15	0.4946	Fri Jul 06 12:36:34 +0000 2018	",1015212910069440513,"	58724	noneyewitness	"those staying in Hiroshima city now, watch out emergency announcement from the city...flood, landslides, dangerous  https://t.co/7E8Fy4366W"
1847304469	FALSE	finalized	3	08/06/2018 9:18	0.6564	Thu Jul 05 18:04:06 +0000 2018	",1014932951602286592,"	78959	noneyewitness	Rain has been coming down often and heavy over the middle parts of Vermilion County creating areas of flooding.  Up  https://t.co/Q4elOsDrok
1847304254	FALSE	finalized	4	08/05/2018 22:02	1	Thu Jul 05 01:11:50 +0000 2018	",1014678203883851781,"	11049	noneyewitness	Nepal flood 2017: wake up call for effective preparedness and response - ReliefWeb https://t.co/0mGmSpTR6t
1847304418	FALSE	finalized	3	08/06/2018 3:04	1	Thu Jul 05 13:54:46 +0000 2018	",1014870205116362753,"	56408	noneyewitness	Jhelum crosses flood mark in Srinagar - The Tribune https://t.co/RqW2IQhMIl #Srinagar #News
1847306026	FALSE	finalized	3	08/05/2018 11:15	1	Mon Jul 04 13:51:09 +0000 2016	",749963764892446721,"	20427	noneyewitness	Heavy rain in NW and central portions of the county is causing localized flooding. Use caution when traveling. #tadd #dfwwx
1847304153	FALSE	finalized	3	08/05/2018 21:30	0.363	Wed Jul 04 23:39:46 +0000 2018	",1014655036125863943,"	3925	noneyewitness	Lmao. I hope y all don t flood over again https://t.co/ziKxtryAjx
1847304348	FALSE	finalized	3	08/05/2018 1:45	0.6462	Thu Jul 05 05:56:52 +0000 2018	",1014749935756038144,"	28834	noneyewitness	I heard Houston starting to flood again ima have reconsider moving there fr !
1847305556	FALSE	finalized	3	08/05/2018 22:40	0.3644	Thu Jun 21 18:16:33 +0000 2018	",1009862653794140160,"	1246	noneyewitness	"Under a flood watch for the next 11 hours. It's not raining, sooooooo"
1847304461	FALSE	finalized	4	08/06/2018 2:08	1	Thu Jul 05 17:49:02 +0000 2018	",1014929159221415936,"	77443	noneyewitness	Dash cam footage shows cars wading through flooded road in Tu https://t.co/d69p77rNuW via  W3LiveNews #Kent #RoyalTunbridgeWells #Flood
1847305861	FALSE	finalized	3	08/06/2018 9:10	1	Mon Jul 30 11:28:28 +0000 2018	",1023893084319506434,"	52111	noneyewitness	Investing in bamboo to curb floods in Kenya - Mail &amp; Guardian: Mail &amp; Guardian Investing in bamboo to curb floods i  https://t.co/ZCm1NZbfB4
1847304674	FALSE	finalized	3	08/05/2018 20:07	1	Fri Jul 06 16:59:03 +0000 2018	",1015278966788251650,"	87625	noneyewitness	It may be sunny outside but #engineers are working hard to protect the UK from #flooding this winter. Learn more in  https://t.co/d4nRpnPAkz
1847305122	FALSE	finalized	3	08/05/2018 20:48	1	Thu Jul 19 16:01:07 +0000 2018	",1019975429929742338,"	14840	noneyewitness	"Nearly a year after Hurricane Harvey s floods, 6 Houston libraries remain closed   ” some indefinitely https://t.co/CwlbmTpotE By  alysonward"
1847305746	FALSE	finalized	3	08/05/2018 4:24	0.6624	Thu Jun 21 20:33:49 +0000 2018	",1009897197503221762,"	14669	noneyewitness	When heavy rain come after a severe drought many areas can be prone to flooding such as Texas is currently experien  https://t.co/aRpm7x2EAL
1847305228	FALSE	finalized	3	08/05/2018 1:02	0.6721	Thu Jul 19 19:15:50 +0000 2018	",1020024430834135047,"	52648	noneyewitness	13.Fayemi receives certificate of return - https://t.co/X5ZGQ1fBCn  14.Osinbajo visits Katsina flood victims -  https://t.co/Q8DPHhm51c
1847305626	FALSE	finalized	3	08/06/2018 10:39	0.6525	Fri Jun 22 00:26:24 +0000 2018	",1009955726868058112,"	37412	noneyewitness	Photos: High water rescues take place as heaviest rainfall since Hurricane Harvey floods Texas https://t.co/5eSo64Ds2o
1847304824	FALSE	finalized	4	08/05/2018 4:03	1	Fri Jul 06 12:28:09 +0000 2018	",1015210795012108289,"	58013	noneyewitness	Another morning. Another flooding rain event in Jersey. https://t.co/BEzEwYba7c
1847305679	FALSE	finalized	3	08/05/2018 22:09	0.6825	Thu Jun 21 20:30:40 +0000 2018	",1009896405010395137,"	14357	noneyewitness	#WEATHER Flash flood warning in effect through midnight for most of region as storms bring potentially heavy downpo  https://t.co/koDNKp2oNb
1847304692	FALSE	finalized	3	08/06/2018 9:21	0.6741	Fri Jul 06 02:57:25 +0000 2018	",1015067164448120832,"	22360	noneyewitness	In pictures: Heavy downpour causes streets to flood in Lahore  https://t.co/y82hsnYtMC
1847304656	FALSE	finalized	3	08/05/2018 20:28	0.3493	Thu Jul 05 11:09:36 +0000 2018	",1014828639496671232,"	44075	noneyewitness	At any given time hardly anyone at all cares about flood risk https://t.co/HDeWISCeno
1847304097	FALSE	finalized	3	08/06/2018 8:46	1	Wed Jul 04 22:54:05 +0000 2018	",1014643539236380672,"	739	noneyewitness	Heavy rains flood Houston streets https://t.co/YsEkpJxeMh https://t.co/pWtj0tW7fP
1847304541	FALSE	finalized	3	08/06/2018 9:14	0.6866	Thu Jul 05 21:10:07 +0000 2018	",1014979761075118080,"	96448	noneyewitness	$117 million announced for Cedar Rapids flood protection https://t.co/V4BZmZjanl
1847305997	FALSE	finalized	3	08/05/2018 14:32	1	Mon Jul 04 16:28:21 +0000 2016	",750003325815447554,"	26383	noneyewitness	Some Greenspoint-area flood victims face a crippling choice https://t.co/RlH61fZwND #water
1847304120	FALSE	finalized	3	08/06/2018 11:08	1	Wed Jul 04 23:09:05 +0000 2018	",1014647312742797312,"	1732	noneyewitness	"Areal flood warnings remain in effect for parts of Frederick (VA), Warren, and Shenandoah Counties until 8:30 p.m.  https://t.co/H4AfkvNhTo"
1847305327	FALSE	finalized	5	08/04/2018 23:46	1	Thu Jul 19 21:45:29 +0000 2018	",1020062092303351808,"	77578	noneyewitness	"Wide area flood left 223 dead, 4700 evacuees, and mud, debris, short to mid term economic depression in this area.  https://t.co/s7DTtYxrmA"
1847305620	FALSE	finalized	3	08/05/2018 19:13	1	Fri Jun 22 01:24:54 +0000 2018	",1009970452377358337,"	44534	noneyewitness	љ пёЏ Route 119 (Charleston Road) is closed in the 6000 block due to flooding. This is just north of Walton. Never att  https://t.co/8ww7UmqyuI
1847305844	FALSE	finalized	4	08/05/2018 22:21	1	Mon Jul 30 14:39:29 +0000 2018	",1023941151517278208,"	67840	noneyewitness	"Flood Hits Several Areas in Ile-Ife In Osun State, Property worth millions of Naira were destroyed by the flood tha  https://t.co/Ykd9lOmSg4"
1847304499	FALSE	finalized	3	08/05/2018 21:54	0.6562	Thu Jul 05 20:16:13 +0000 2018	",1014966197220249601,"	91483	noneyewitness	Stormtracker update.....412pm. Need to be Very Careful.....flooding is occurring in and around Albany.  Another are  https://t.co/S5JW5De0nV
1847304549	FALSE	finalized	3	08/06/2018 9:29	1	Thu Jul 05 21:16:57 +0000 2018	",1014981482992099328,"	97041	noneyewitness	"#ThursdayThoughts : Parts of #Pittsburgh reeling with flash floods, landslides and power outages due to severe stor  https://t.co/G0hX7Z2106"
1847304563	FALSE	finalized	6	08/05/2018 0:45	1	Thu Jul 05 16:53:36 +0000 2018	",1014915206873518082,"	72308	noneyewitness	"Floodwaters in Houston primary flood-way, Buffalo Bayou, have fallen to near normal levels, but have left behind mu  https://t.co/dVpdCVSyIY"
1847305615	FALSE	finalized	5	08/05/2018 0:57	1	Fri Jun 22 01:00:10 +0000 2018	",1009964225220005888,"	41632	noneyewitness	Heavy rains trigger flash flood emergencies in south Texas https://t.co/BrsHYcI9Oo
1847305920	FALSE	finalized	3	08/05/2018 2:06	1	Mon Jul 04 04:34:24 +0000 2016	",749823651416014850,"	1521	noneyewitness	43 killed in Pakistan flash flood https://t.co/si45dtaaRF https://t.co/mlAHjQ18j2 Buy #cheapgames
1847304789	FALSE	finalized	3	08/06/2018 9:15	0.6719	Fri Jul 06 03:10:26 +0000 2018	",1015070440912375808,"	23268	noneyewitness	There are risks of disasters due to heavy rain. Please pay attention to river flooding and landslides in particular  https://t.co/HcUh6hVqJY
1847304112	FALSE	finalized	4	08/05/2018 4:41	0.7432	Wed Jul 04 23:04:30 +0000 2018	",1014646161267929088,"	1428	noneyewitness	New York water flood will reach the very top of all trump building... Nothing will remain of his name forever
1847305227	FALSE	finalized	3	08/06/2018 13:08	0.6561	Thu Jul 19 19:15:35 +0000 2018	",1020024370008330242,"	52600	noneyewitness	When need more action on drug companies. We need the white house to stop the flood that kill Missouri emergency fun  https://t.co/R1glj1ybNs
1847305582	FALSE	finalized	4	08/06/2018 1:05	1	Thu Jun 21 19:50:00 +0000 2018	",1009886172569432064,"	10410	noneyewitness	Calgary flood: 5 years later   “ Tracking the money: Global News https://t.co/aSCJdKmg2e
1847304222	FALSE	finalized	3	08/04/2018 23:53	0.6749	Thu Jul 05 00:36:06 +0000 2018	",1014669212940320768,"	8341	noneyewitness	Spot along I-680 flooded by heavy rain https://t.co/ClGvbTl1bc https://t.co/ZakS6Onkft
1847304443	FALSE	finalized	3	08/05/2018 19:12	0.6767	Thu Jul 05 15:58:22 +0000 2018	",1014901308757889027,"	67386	noneyewitness	People cussing others for showing their support to army for flood relief operations on account of iTs tHeirr jOb go  https://t.co/Drqi15RPKl
1847305765	FALSE	finalized	3	08/06/2018 2:15	0.3651	Thu Jun 21 23:53:35 +0000 2018	",1009947468971175936,"	33662	noneyewitness	HeartlandOnCBC Doesn't surprise me that the flood brought the community closer together. I'm also not surprised th  https://t.co/MqMVHhy9Yr
1847305804	FALSE	finalized	4	08/05/2018 7:33	0.7577	Sun Jul 29 22:36:00 +0000 2018	",1023698684637151232,"	10823	noneyewitness	NEA: Heavy rain expected over many areas of SG from 07:00 hours to 08:15 hours. Issued 06:30 hours. #sgflood
1847305676	FALSE	finalized	3	08/05/2018 19:13	1	Thu Jun 21 20:30:21 +0000 2018	",1009896325947756544,"	14320	noneyewitness	U.S. Army Corps of Engineers said some Breckenridge homeowners will need flood insurance due to internal drainage i  https://t.co/85gjjftf6G
1847305736	FALSE	finalized	3	08/06/2018 9:17	0.6356	Thu Jun 21 21:07:35 +0000 2018	",1009905696882782208,"	18090	noneyewitness	The Missouri River in Williston is expected to rise through the week and reach major flood stage of 26 feet late Sa  https://t.co/XJeHP9DxdC
1847305095	FALSE	finalized	3	08/05/2018 20:41	0.6984	Thu Jul 19 15:45:02 +0000 2018	",1019971384276144128,"	12391	noneyewitness	The  NWSCharlestonSC warns of flooding of low-lying or poor drainage areas today into this evening for coastal area  https://t.co/6yP2x5QmGC
1847304537	FALSE	finalized	3	08/05/2018 20:33	0.6875	Thu Jul 05 21:00:52 +0000 2018	",1014977435740360710,"	95601	noneyewitness	Bodies of the Okada man and passenger swept away by flood today recovered in Enugu (graphic  photos)  https://t.co/GJ3h0Fn8PI
1847304829	FALSE	finalized	4	08/05/2018 11:05	0.755	Fri Jul 06 12:29:19 +0000 2018	",1015211086906363910,"	58125	noneyewitness	Where the Flash Flood Watch was not issued in Ocean County there is a flash flood warning lol.
1847305988	FALSE	finalized	3	08/05/2018 13:57	1	Mon Jul 04 06:37:38 +0000 2016	",749854666985472000,"	6085	noneyewitness	Pak army continous rescue opr in Chitral after flood hit #ChitralReliefEfforts https://t.co/ZAjItPCWwd
1847305696	FALSE	finalized	3	08/05/2018 20:47	1	Thu Jun 21 21:09:22 +0000 2018	",1009906145383743488,"	18268	noneyewitness	"chelseahandler  FLOTUS And, she DIDN'T GO TO A DETENTION CENTER, the White House canceled due to a flash flood.  S  https://t.co/BVLKoLz5IL"
1847304889	FALSE	finalized	4	08/05/2018 1:15	0.7406	Fri Jul 06 18:12:23 +0000 2018	",1015297421067407360,"	95417	noneyewitness	PhD student  geogrisk in Bolivia presenting findings on glacier change &amp; glacial outburst flood risk. Time for a be  https://t.co/p6Ok4hRBp7
1847305309	FALSE	finalized	4	08/05/2018 16:17	1	Thu Jul 19 21:41:11 +0000 2018	",1020061010437263360,"	76954	noneyewitness	"Breaking: another major flash flood event in the Flagstaff, AZ area with over 4"" of rain estimated over large area  https://t.co/1zCrH9X1V0"
1847304606	FALSE	finalized	4	08/05/2018 1:42	0.7398	Thu Jul 05 16:49:29 +0000 2018	",1014914171450904577,"	71953	noneyewitness	Houston upping the flood game. Pittsburgh has floating dumpsters. https://t.co/bjzYxe0E4w
1847305931	FALSE	finalized	3	08/06/2018 10:50	1	Mon Jul 04 06:45:39 +0000 2016	",749856681253740544,"	6402	noneyewitness	"CNN: Flood washes mosque away: Dozens are feared dead after floods struck northern Pakistan, washing away a m... https://t.co/K8yN4u6yaq"
1847304672	FALSE	finalized	3	08/06/2018 12:09	1	Thu Jul 05 18:54:13 +0000 2018	",1014945564163756033,"	83694	noneyewitness	Flash flood watch in effect till midnight for Carroll County https://t.co/nH2NhqzQUp
1847305193	FALSE	finalized	4	08/05/2018 3:43	0.4857	Thu Jul 19 17:36:54 +0000 2018	",1019999533810544640,"	32072	noneyewitness	"It is never safe to drive or walk into flood waters! Areal Flood advisory in effect for Baker, Nassau, and Duval co  https://t.co/44aktzlAhV"
1847304194	FALSE	finalized	4	08/05/2018 17:38	0.7521	Thu Jul 05 00:05:07 +0000 2018	",1014661416765313026,"	5776	noneyewitness	"Houston streets flood after heavy rains, sparking memories of Harvey https://t.co/9cZQd7e805"
1847304251	FALSE	finalized	3	08/05/2018 20:24	1	Thu Jul 05 01:10:57 +0000 2018	",1014677981233598465,"	10993	noneyewitness	drawfouralan  FMGhost09  Artwall44  icrbthomas The flood covered an area roughly larger than the state of Californ  https://t.co/44RldM6Idq
1847304455	FALSE	finalized	3	08/05/2018 20:48	0.6611	Thu Jul 05 17:20:50 +0000 2018	",1014922061217763329,"	74769	noneyewitness	In Houghton today meeting with residents to hear and see first-hand the flood devastation. A beautiful city  with r  https://t.co/J2k5dM8U9A
1847305445	FALSE	finalized	4	08/06/2018 1:52	1	Thu Jun 21 21:01:36 +0000 2018	",1009904187570884609,"	17464	noneyewitness	North-east floods: Sikh volunteers lend a helping hand in flood-hit Assam https://t.co/2rb1kMu9IT via  IndianExpress
1847304400	FALSE	finalized	3	08/06/2018 9:15	1	Thu Jul 05 13:20:18 +0000 2018	",1014861531375284224,"	53673	noneyewitness	ImGoanCrazy Travel to hills is risky in rainy season. Himachal had many landslides and flood incidents during prev  https://t.co/UT1y7ZrGqs
1847304803	FALSE	finalized	3	08/06/2018 3:01	1	Fri Jul 06 10:42:11 +0000 2018	",1015184127509835776,"	49054	noneyewitness	Warnings issued in #Kansai and nearby areas as heavy rains trigger #landslides and #flooding. #Japan #SevereWx  https://t.co/eRcjhTjdNn
1847305096	FALSE	finalized	3	08/05/2018 19:12	0.6767	Thu Jul 19 15:45:03 +0000 2018	",1019971386335514626,"	12394	noneyewitness	SCDOT reminds motorists to never drive around the barriers blocking a flooded road. Just 6 inches of fast-moving fl  https://t.co/SSorGdidgI
1847304347	FALSE	finalized	4	08/05/2018 1:21	0.7487	Thu Jul 05 05:43:15 +0000 2018	",1014746507004657665,"	28165	noneyewitness	 APRcoffee Was there coffee where it flooded? It must be the best tasting flood water EVER!!! #FloodWaterRoast
1847305135	FALSE	finalized	3	08/06/2018 2:03	1	Thu Jul 19 16:25:45 +0000 2018	",1019981628125433858,"	19075	noneyewitness	One Lake flood control supporters face uphill battle downstream https://t.co/UjkaYkkyx9
1847304827	FALSE	finalized	3	08/05/2018 20:41	1	Fri Jul 06 12:28:55 +0000 2018	",1015210986138144769,"	58081	noneyewitness	Flash flood watch as heat wave ends. Will weekend be beautiful? https://t.co/PmhxiN412r https://t.co/tA71lnpDaB
1847305287	FALSE	finalized	3	08/05/2018 21:24	0.6462	Thu Jul 19 21:33:39 +0000 2018	",1020059115404460032,"	75864	noneyewitness	 MMDA where can we see the flood reports in Makati area?
1847305325	FALSE	finalized	3	08/05/2018 23:35	1	Thu Jul 19 21:44:33 +0000 2018	",1020061859490119680,"	77450	noneyewitness	 MMDA #is there flood in magallanes?
1847305132	FALSE	finalized	3	08/06/2018 9:12	1	Thu Jul 19 16:03:26 +0000 2018	",1019976012963172353,"	15213	noneyewitness	House bill would reform and extend flood insurance program https://t.co/I6Idp8juPC #Business
1847305933	FALSE	finalized	4	08/05/2018 14:22	0.7452	Mon Jul 04 14:29:23 +0000 2016	",749973383157252097,"	21982	noneyewitness	"Residents wade through flood water after heavy #rains in Godhara, Gujarat. https://t.co/f3YvfIhXAZ"
1847304228	FALSE	finalized	3	08/06/2018 11:25	1	Thu Jul 05 00:38:23 +0000 2018	",1014669785769095168,"	8539	noneyewitness	A flash flood warning has been issued for Allegheny County.  For more go to https://t.co/HUYZgLy1no. #upwithKDKA https://t.co/cnOx4ojqVD
1847305491	FALSE	finalized	3	08/05/2018 3:12	1	Fri Jun 22 02:00:00 +0000 2018	",1009979284927197187,"	49751	noneyewitness	Forest Service warns of using flood impacted roads https://t.co/b0nqXDyap8
1847305697	FALSE	finalized	3	08/05/2018 3:39	0.6489	Thu Jun 21 21:09:30 +0000 2018	",1009906178653073409,"	18283	noneyewitness	Albemarle and Charlottesville are under a flood warning until 8:30 p.m. https://t.co/3Pk6MYg9lB
1847305758	FALSE	finalized	3	08/06/2018 5:09	1	Thu Jun 21 23:19:58 +0000 2018	",1009939011861803008,"	30987	noneyewitness	 MMDA How bout flood in makati?
1847304787	FALSE	finalized	5	08/05/2018 21:56	1	Fri Jul 06 02:30:07 +0000 2018	",1015060292441534465,"	19961	noneyewitness	"* Heavy rain and flash floods hit Pittsburgh, leaving residents on alert    https://t.co/PjODcVw3nN Full coverage  https://t.co/4dzHIk0tVR"
1847305805	FALSE	finalized	4	08/05/2018 23:42	0.5091	Sun Jul 29 22:37:27 +0000 2018	",1023699050338500608,"	10917	noneyewitness	"gagood  Fillinusername  EWErickson Fun fact, nearly every ancient culture on earth has a grand scale flood story,  https://t.co/FlSnnEqjX5"
