_unit_id	_golden	_unit_state	_trusted_judgments	_last_judgment_at	please_choose_a_category:confidence	created_at	id_str	rownames	please_choose_a_category	text
1847304217	FALSE	finalized	4	08/05/2018 4:39	0.7319	Thu Jul 05 00:19:55 +0000 2018	",1014665140405522432,"	7003	dont_know	"Me as a youth in  HoustonTX #flood waters. Didn't think of snakes, frogs, #diseased #water, etc. The #love AND  https://t.co/IBQ4kMiNbj"
1847305889	FALSE	finalized	4	08/05/2018 23:29	0.7493	Mon Jul 30 15:14:00 +0000 2018	",1023949838461923328,"	70908	dont_know	Slow water leaks can be equally as damaging as any major leak or flood. Major leaks or floods are usually pretty di  https://t.co/7n7gfBqJBv
1847305829	FALSE	finalized	4	08/06/2018 0:58	0.7675	Mon Jul 30 10:28:12 +0000 2018	",1023877916898287617,"	48262	dont_know	Flood Re maps path to future affordable household #flood #insurance https://t.co/64ycx9qccU
1847305557	FALSE	finalized	3	08/06/2018 3:29	1	Thu Jun 21 18:16:35 +0000 2018	",1009862661687861248,"	1251	dont_know	"FoxBusiness  SpeakerRyan Unless you flood the market with low wage earners, this is the time to get people off pub  https://t.co/FhKidms7hJ"
1847305552	FALSE	finalized	3	08/06/2018 2:48	1	Fri Jun 22 01:03:26 +0000 2018	",1009965046913556481,"	41983	dont_know	"How fucked up is the American healthcare system that, as these bills flood in, I'm kicking myself for going to the  https://t.co/oY8DB3jvch"
1847305449	FALSE	finalized	3	08/06/2018 3:52	1	Thu Jun 21 21:01:50 +0000 2018	",1009904247671017472,"	17495	dont_know	What's your plan..open the flood gates?  Tell us exactly what you want..what's the answer? https://t.co/di2HU18aLl
1847305968	FALSE	finalized	4	08/06/2018 4:11	1	Tue Jul 05 00:37:41 +0000 2016	",750126468575797248,"	42466	dont_know	Ride the Wave of Traffic! Join Now!rnhttp://flood-of-traffic.com/?rid=1526
1847306104	FALSE	finalized	4	08/05/2018 4:06	0.5087	Mon Jul 04 10:41:58 +0000 2016	",749916152122355712,"	13940	dont_know	Please don't flood please don't flood please don't flood please don't flood please don't flood please don't flood please don't flood please.
1847305428	FALSE	finalized	3	08/05/2018 19:46	0.642	Thu Jun 21 20:50:41 +0000 2018	",1009901441132134400,"	16282	dont_know	 vibracy Then that day the notifications flood in 
1847305934	FALSE	finalized	3	08/05/2018 3:08	1	Mon Jul 04 14:29:30 +0000 2016	",749973415151284228,"	21991	dont_know	 ArkEncounter What happens in the Bat Cave . . . stays in the Bat Cave!  Love is more powerful than a flood. #lovenotflood #arkencounter
1847304472	FALSE	finalized	5	08/05/2018 10:33	1	Thu Jul 05 18:07:17 +0000 2018	",1014933753158946822,"	79287	dont_know	Memorial Of Sovereignty   https://t.co/S1D08cFCy1  #JesusTweeters #GodPosts #TeamJesus #rainbow #bow #Noah #flood  https://t.co/Ror0B8VUfZ
1847304880	FALSE	finalized	5	08/05/2018 1:21	1	Fri Jul 06 16:11:14 +0000 2018	",1015266933053067264,"	82928	dont_know	"stuarthalloway Sorry to flood you, but here is what I am talking about: https://t.co/qn0rMmXOZA"
1847305373	FALSE	finalized	3	08/05/2018 1:17	0.6806	Thu Jun 21 18:24:53 +0000 2018	",1009864752145862656,"	2103	dont_know	 DylanByers Hope the flood gates now open and career goes womp womp
1847304421	FALSE	finalized	4	08/06/2018 0:46	0.526	Thu Jul 05 14:03:14 +0000 2018	",1014872335713742848,"	57118	dont_know	so is this the year we flood out and go extinct or will it stop raining
1847305270	FALSE	finalized	4	08/05/2018 22:07	1	Thu Jul 19 21:12:17 +0000 2018	",1020053736792645632,"	72517	dont_know	High-precision automated reconstruction of neurons with flood-filling networks. https://t.co/uCBHAKnqYz
1847305775	FALSE	finalized	3	08/05/2018 11:13	0.6611	Mon Jul 30 18:48:47 +0000 2018	",1024003890830823426,"	90401	dont_know	that murky ass flood water 
1847305823	FALSE	finalized	4	08/05/2018 17:12	0.7386	Sun Jul 29 22:45:20 +0000 2018	",1023701031497224192,"	11385	dont_know	"I love my phones quality, also love that the flood wall is a 5 minute walk from my apartment #blessed   Richmond Fl  https://t.co/3dFB8ipcPn"
1847304431	FALSE	finalized	3	08/05/2018 20:05	1	Thu Jul 05 14:49:44 +0000 2018	",1014884035632476160,"	61207	dont_know	If  RealCJ10 Ken Griffey and Jeff bagwell walked into a club there would be what u call a flash flood warning
1847304201	FALSE	finalized	3	08/06/2018 10:13	1	Thu Jul 05 00:07:38 +0000 2018	",1014662047307632646,"	5942	dont_know	 elliottskycase  tough_and_rich Is there is a phone number to flood so nobody can make reports to an actual ICE line?
1847305392	FALSE	finalized	4	08/05/2018 0:15	0.5014	Thu Jun 21 18:47:19 +0000 2018	",1009870397347651585,"	4246	dont_know	man I m so lucky there s no flood here in my neighborhood
1847305079	FALSE	finalized	3	08/06/2018 11:00	1	Thu Jul 19 15:26:36 +0000 2018	",1019966743303688195,"	9589	dont_know	Father you are king over the flood.
1847304306	FALSE	finalized	3	08/05/2018 4:41	1	Thu Jul 05 02:47:29 +0000 2018	",1014702277884604417,"	17777	dont_know	queendomheartss  kh_ux_na Apparently there was some 1star flood at PlayStore (because of the global event reward).
1847304360	FALSE	finalized	4	08/06/2018 9:05	1	Thu Jul 05 09:11:08 +0000 2018	",1014798824831967232,"	37894	dont_know	paullewismoney Soon China will flood market with inferior quality steel as we sold out on British Steel Knowing pr  https://t.co/e0JuHnADkL
1847304973	FALSE	finalized	5	08/05/2018 22:55	1	Fri Jul 06 19:28:01 +0000 2018	",1015316455896895489,"	102796	dont_know	"did overtime... I got home, charged my phone... and got a flood of texts about a family member who got into a bad c  https://t.co/4PX8bJ3mnr"
1847305998	FALSE	finalized	3	08/05/2018 1:05	1	Mon Jul 04 16:29:17 +0000 2016	",750003560625111044,"	26440	dont_know	Labour mutineer reduced to appearance in The Sun in bid to flood Labour with right-wing entryists https://t.co/0BurWEffFo via  MidWalesMike
1847304301	FALSE	finalized	5	08/05/2018 0:21	1	Thu Jul 05 02:44:09 +0000 2018	",1014701436725354497,"	17537	dont_know	" THR The Dems in Washington don t, they want to flood this country with illegals and GIVE them benefits!"
1847304313	FALSE	finalized	4	08/05/2018 4:41	1	Thu Jul 05 03:00:51 +0000 2018	",1014705641133355008,"	18657	dont_know	Preparing my Twitter for all the scumslaves that are about to flood my DMs. Think you're worth it? Prove it.  https://t.co/O0X6017ahY
1847304308	FALSE	finalized	3	08/05/2018 0:41	1	Thu Jul 05 02:49:07 +0000 2018	",1014702688657813504,"	17880	dont_know	MColeen75  TheTweetOfGod May I flood your pillow??
1847305750	FALSE	finalized	5	08/05/2018 1:02	1	Thu Jun 21 21:44:08 +0000 2018	",1009914893372481536,"	21796	dont_know	Lmao Bubiashie is not a flood prone area https://t.co/y8wqVBq6ZM
1847305322	FALSE	finalized	3	08/05/2018 20:00	0.6413	Thu Jul 19 21:43:47 +0000 2018	",1020061665113538560,"	77337	dont_know	"Wow! I definitely thought he was building that to protect his house from flood water, but this was even better "
1847305068	FALSE	finalized	4	08/05/2018 7:16	1	Thu Jul 19 15:11:55 +0000 2018	",1019963046905729026,"	7232	dont_know	Was not prepared for the flood of emotions that came when hubby found a folder with some of Penny s old drawings. I  https://t.co/YjPR4cfSoo
1847305913	FALSE	finalized	3	08/05/2018 13:30	0.3587	Mon Jul 30 15:57:10 +0000 2018	",1023960704771129344,"	74951	dont_know	FLash floods scare me
1847304885	FALSE	finalized	3	08/06/2018 11:05	1	Fri Jul 06 18:10:32 +0000 2018	",1015296957873393664,"	95236	dont_know	Gonna flood yer twitter feed with sum LOOKS 
1847305851	FALSE	finalized	3	08/06/2018 12:11	0.6817	Sun Jul 29 23:44:31 +0000 2018	",1023715929559949313,"	15378	dont_know	ShockZ314 I am seeing more of them in the weekly new releases but not a flood as yet. #RWChat
1847304202	FALSE	finalized	4	08/04/2018 23:38	1	Thu Jul 05 00:07:38 +0000 2018	",1014662050159710209,"	5943	dont_know	" aceluvbot He's coming back baby, don't worry! When that day comes we'll flood him with our endless love "
1847305518	FALSE	finalized	4	08/06/2018 0:26	1	Thu Jun 21 18:11:04 +0000 2018	",1009861273276870657,"	701	dont_know	As highpass as a flood-plain
1847304296	FALSE	finalized	3	08/06/2018 9:19	1	Thu Jul 05 02:41:42 +0000 2018	",1014700819130863622,"	17352	dont_know	"yinglee85 LOL well all my DBH will definitely go here, I just made this account so I didn't flood my main TL with  https://t.co/mYnplEv1dJ"
1847304424	FALSE	finalized	3	08/05/2018 4:05	1	Thu Jul 05 14:04:12 +0000 2018	",1014872576609390595,"	57200	dont_know	naks flood
1847305243	FALSE	finalized	3	08/05/2018 4:43	1	Thu Jul 19 19:37:02 +0000 2018	",1020029765816922112,"	56446	dont_know	Just looked at the membership I made a while back and had lots of memories flood in from our year of DECA. Ahhhhh.  https://t.co/FoDa9aQsQO
1847305011	FALSE	finalized	5	08/05/2018 4:10	0.8065	Fri Jul 06 05:59:21 +0000 2018	",1015112946844880896,"	33806	dont_know	"jiblotech Forget the flood part, what exactly was happening on the bed?! https://t.co/D2TLg0NuZK"
1847304182	FALSE	finalized	5	08/04/2018 20:34	1	Thu Jul 05 00:00:44 +0000 2018	",1014660310802812928,"	5447	dont_know	"""If the sun don't shine on me today And if the subways flood and bridges break Will you lay yourself down and dig y  https://t.co/8Kavn9oyn4"
1847305891	FALSE	finalized	5	08/05/2018 22:17	1	Mon Jul 30 15:14:09 +0000 2018	",1023949877527629825,"	70918	dont_know	"Watch out, we are going to see a flood of Am Dram from people competing to be the most oppressed by the left.  Eddi  https://t.co/QRwa9zxZMW"
1847305031	FALSE	finalized	3	08/06/2018 11:50	1	Fri Jul 06 11:36:57 +0000 2018	",1015197908440899584,"	53533	dont_know	"...during the flood of Noah, God saved Noah and His family with d animals dat wee brought into d Ark: Sodom &amp;Gomorr  https://t.co/9BO64QljUn"
1847304997	FALSE	finalized	3	08/05/2018 20:27	1	Fri Jul 06 01:40:43 +0000 2018	",1015047859769507840,"	15784	dont_know	Pets scared by Fourth of July fireworks flood animal shelters https://t.co/3M2RVWDrKx via  azcentral. Y tf dont peo  https://t.co/ymy4TnJjQF
1847304753	FALSE	finalized	3	08/05/2018 23:49	1	Fri Jul 06 19:04:02 +0000 2018	",1015310421249708032,"	100355	dont_know	"Use the flood of #GDPR emails as an opportunity to rethink your #email marketing, advises  jphautomation. https://t.co/qk1nCKtgkh"
1847304449	FALSE	finalized	3	08/06/2018 2:05	1	Thu Jul 05 16:56:54 +0000 2018	",1014916036964048897,"	72613	dont_know	 LRMYSoccerOtter My options are either fire or flood. God bless the USA
1847304337	FALSE	finalized	3	08/05/2018 20:51	1	Thu Jul 05 04:42:42 +0000 2018	",1014731272084688896,"	24865	dont_know	 bradmondonyc we dont mind it. As long as you are doing what you love and real with us (which you are) then flood our TL's boo XD
1847305722	FALSE	finalized	4	08/05/2018 2:03	1	Thu Jun 21 19:15:30 +0000 2018	",1009877489928294400,"	7123	dont_know	Who knew that there was a national selfie day! I shall go back to Circa 2016 and post all my favorit selfies! Expect a flood.
1847304142	FALSE	finalized	3	08/06/2018 0:49	1	Wed Jul 04 23:34:43 +0000 2018	",1014653765805322240,"	3554	dont_know	"""Because man [before the flood] could not be won by God's leniency &amp; patience by which  –єHe tried to win him —„, He wo  https://t.co/qQUDVV5ONk"
1847305318	FALSE	finalized	3	08/05/2018 4:12	1	Thu Jul 19 21:42:35 +0000 2018	",1020061363668844544,"	77142	dont_know	bts are thoughtful kings.  not only do you see it in the way they carry themselves always but their LYRICS flood wi  https://t.co/f9drB3fXIy
1847304580	FALSE	finalized	3	08/05/2018 21:14	0.6642	Thu Jul 05 18:02:44 +0000 2018	",1014932605379235841,"	78817	dont_know	 AmgMedikal We go flood ur gmail
1847305855	FALSE	finalized	3	08/05/2018 23:43	0.6613	Sun Jul 29 23:45:51 +0000 2018	",1023716261316968449,"	15458	dont_know	 TeriAmour The description says it needs tlc and is in flood zone. I don t need that stress. I like it though.
1847305144	FALSE	finalized	4	08/05/2018 1:21	1	Thu Jul 19 16:31:14 +0000 2018	",1019983007799758848,"	20066	dont_know	"As long as the  USGS and the media keep sticking to this   њX-year flood  ќ terminology, it will remain consistently mi  https://t.co/ddVXvPWyEe"
1847304953	FALSE	finalized	3	08/06/2018 3:41	0.6644	Fri Jul 06 12:48:37 +0000 2018	",1015215944896000001,"	59887	dont_know	$ETC people trying to stop the flood gates at $18... https://t.co/OGSlEUUAMi
1847304710	FALSE	finalized	3	08/06/2018 2:00	0.6724	Fri Jul 06 12:31:40 +0000 2018	",1015211678546452480,"	58314	dont_know	The emergency alert for a flood watch went off just as I was walking into work. I think it s a sign to leave.
1847305335	FALSE	finalized	3	08/05/2018 20:41	1	Thu Jul 19 21:48:53 +0000 2018	",1020062947475767297,"	78060	dont_know	"""The LORD sitteth upon the flood; yea, the LORD sitteth King for ever."" ~Psalms 29:10 #Jesus #God #Bible"
1847305793	FALSE	finalized	4	08/05/2018 10:23	0.5171	Sun Jul 29 20:04:13 +0000 2018	",1023660488620761093,"	230	dont_know	so we re moving out of our apartment and now the AC decides to break and flood the place
1847304255	FALSE	finalized	3	08/05/2018 0:35	1	Thu Jul 05 01:27:20 +0000 2018	",1014682105085755392,"	12070	dont_know	Abhisar Sharma has graduated.  Now he is sending tweets to Pakistan contacts to flood sinister sentiments in India  https://t.co/QLPkHgOgjz
1847305172	FALSE	finalized	3	08/04/2018 23:14	1	Thu Jul 19 17:11:47 +0000 2018	",1019993212214226946,"	27245	dont_know	We will flood the streets!!! We stand with  McFaul #TreasonSummit
1847305382	FALSE	finalized	3	08/05/2018 2:05	1	Thu Jun 21 18:26:24 +0000 2018	",1009865133932281856,"	2248	dont_know	i will. reunite with my dog on saturday . temporarily but . ! actually gonna flood the place with my tears
1847304536	FALSE	finalized	3	08/06/2018 4:12	0.6345	Thu Jul 05 21:00:28 +0000 2018	",1014977334775033857,"	95572	dont_know	Flood Games: Manipulation of flood insurance leads to repeat disasters - Houston Chronicle https://t.co/r8OhhRa13o
1847304765	FALSE	finalized	3	08/06/2018 2:38	1	Thu Jul 05 23:05:00 +0000 2018	",1015008674539073542,"	1562	dont_know	When the enemy shall come in like a flood The SPIRIT of The LORD will lift up a Standard of The BLOOD of JESUS CHRIST against them.
1847305013	FALSE	finalized	4	08/05/2018 2:03	1	Fri Jul 06 05:59:41 +0000 2018	",1015113030865178624,"	33819	dont_know	So much iconic legendary throwback content I have to flood you guys with it all before I start posting my brand new  https://t.co/WCj1DM2kbD
1847305161	FALSE	finalized	3	08/05/2018 13:50	1	Thu Jul 19 16:41:41 +0000 2018	",1019985638135910405,"	21690	dont_know	 Fenerbahce Janssen ve bas dost ile biter bu flood
1847304203	FALSE	finalized	4	08/05/2018 2:00	1	Thu Jul 05 00:07:51 +0000 2018	",1014662103951605762,"	5954	dont_know	I shall be back to flood the TL with more ignorance soon
1847306092	FALSE	finalized	3	08/06/2018 11:01	1	Mon Jul 04 04:56:05 +0000 2016	",749829109706944512,"	2225	dont_know	Yeah it's the Fourth of July. There's fireworks. Everyone has seen some. Don't flood your freaking Snapchat story.
1847304287	FALSE	finalized	4	08/06/2018 4:48	1	Thu Jul 05 02:16:31 +0000 2018	",1014694483638669312,"	15551	dont_know	Bro flood yourself with hype
1847305466	FALSE	finalized	3	08/05/2018 23:32	1	Thu Jun 21 21:31:05 +0000 2018	",1009911608154484746,"	20483	dont_know	JustDaga Hw3 I fit talk say ano go go? Like mommy saf she go kill me. But Accra boys you fit use the flood as excuse ooooo.
1847304371	FALSE	finalized	4	08/05/2018 6:01	1	Thu Jul 05 11:14:56 +0000 2018	",1014829979991863299,"	44436	dont_know	Water heater leaking so bad it's starting to sorta flood the downstairs hoo  љ пёЏ Not like I've slept and I work tomorrow haha
1847305591	FALSE	finalized	3	08/05/2018 19:35	1	Thu Jun 21 21:24:52 +0000 2018	",1009910042571804675,"	19837	dont_know	Remember the story of the little boy with his finger in the dam to stop the flood? The dam is breaking. #CSA #CSE https://t.co/2pg4bJAW4z
1847305480	FALSE	finalized	3	08/05/2018 20:31	0.6364	Thu Jun 21 21:51:04 +0000 2018	",1009916640069341184,"	22635	dont_know	" danarel Millions from Honduras, Mexico and El Salvador flood into the country, with no police.... what could possibly go wrong?"
1847306083	FALSE	finalized	3	08/05/2018 4:39	0.6856	Tue Jul 05 00:25:50 +0000 2016	",750123485855354880,"	42114	dont_know	TamiHoshiyama  ShawnDnaruto  Jomc20  MYirrell I confused tami how can the flood both create and not create rick
1847305672	FALSE	finalized	3	08/06/2018 2:49	1	Thu Jun 21 20:26:48 +0000 2018	",1009895432976306177,"	13979	dont_know	since i'm bored i'll flood your tl with my photography skills from my school trips xx
1847304535	FALSE	finalized	4	08/05/2018 6:01	0.5004	Thu Jul 05 21:00:24 +0000 2018	",1014977316425031681,"	95568	dont_know	"What about wetlands? #Wetlands provide water filtration, flood and drought management, climate change adaptation, a  https://t.co/wYroxljASx"
1847304176	FALSE	finalized	3	08/05/2018 14:11	1	Wed Jul 04 23:53:47 +0000 2018	",1014658562470170624,"	4908	dont_know	Slate People need to flood hers and Lisa Murkowski's phone lines like they did before the ACA.  GOPers ran on over  https://t.co/sH0SHRVYjq
1847304731	FALSE	finalized	3	08/05/2018 1:17	1	Fri Jul 06 13:36:42 +0000 2018	",1015228042980012032,"	64987	dont_know	"For Kim Stanley Robinson not even the apocalyptic flood is enough to kill capitalism, that cockroach. #afterfantastika"
1847304299	FALSE	finalized	4	08/05/2018 0:17	0.4993	Thu Jul 05 02:44:00 +0000 2018	",1014701398510927874,"	17524	dont_know	caulkthewagon I low key wish I hadn t read it. Bail support would flood in. They could set up a paypal in 5 second  https://t.co/QbePAsi0JN
1847305310	FALSE	finalized	3	08/06/2018 2:15	1	Thu Jul 19 21:41:18 +0000 2018	",1020061039625371653,"	76973	dont_know	 FoxNews Let the flood gates of liberal tears begin.......AGAIN
1847304123	FALSE	finalized	3	08/04/2018 20:03	1	Wed Jul 04 23:11:11 +0000 2018	",1014647840499490816,"	1884	dont_know	"One day, we ll be able to sit across from one another and past memories won't flood my heart like a tsunami."
1847305753	FALSE	finalized	4	08/04/2018 23:55	0.7358	Thu Jun 21 21:45:14 +0000 2018	",1009915170582343680,"	21916	dont_know	#HighRiver couple sue over impact #flood mitigation will have on their property https://t.co/aekNFv3JUS
1847304882	FALSE	finalized	5	08/06/2018 2:05	1	Fri Jul 06 16:12:24 +0000 2018	",1015267226390355969,"	83026	dont_know	 minjastars what the heck your mom is so cute!!! all mine does in texts is a flood of typos bad enough to sometimes  https://t.co/cTdhkCjBnl
1847304482	FALSE	finalized	3	08/05/2018 4:51	1	Thu Jul 05 18:38:56 +0000 2018	",1014941716074369025,"	82300	dont_know	Just want to point out that Hill attendance only became unreliable when the AD decided to flood the hill with the m  https://t.co/PFBZrQt9WU
1847305926	FALSE	finalized	3	08/05/2018 20:24	1	Mon Jul 04 06:41:14 +0000 2016	",749855571126394880,"	6217	dont_know	Can't survive in the mud. But they causing the flood.
1847305447	FALSE	finalized	4	08/05/2018 11:05	0.7556	Thu Jun 21 21:01:47 +0000 2018	",1009904234710609920,"	17485	dont_know	"biohazard cleaning, trauma cleaning, needle clean up, flood clean  https://t.co/IBRMX9z06o"
1847304487	FALSE	finalized	3	08/06/2018 3:24	0.371	Thu Jul 05 19:09:03 +0000 2018	",1014949295437512705,"	85254	dont_know	Did you know that only 6 inches of moving water can make you fall? PCI has more flood safety tips  https://t.co/uULLON7GMP
1847305792	FALSE	finalized	4	08/05/2018 22:44	1	Sun Jul 29 20:03:45 +0000 2018	",1023660368902598656,"	200	dont_know	KelloggsUS since plastic straws are banned in California now why don't you flood the market with these? https://t.co/IA3iYuhgns
1847305442	FALSE	finalized	3	08/06/2018 12:09	1	Thu Jun 21 21:01:12 +0000 2018	",1009904088006447104,"	17405	dont_know	"Annually coral reefs protect thousands of miles of coastlines from flood and storm surges, saving humans billions o  https://t.co/fPnwL4nmu5"
1847305493	FALSE	finalized	3	08/05/2018 0:43	1	Fri Jun 22 02:00:06 +0000 2018	",1009979310466306055,"	49784	dont_know	Canada Basketball hopes flood of talent turns tide to global success  #bc https://t.co/parhNefM9f
1847305315	FALSE	finalized	3	08/05/2018 3:24	0.3455	Thu Jul 19 21:41:47 +0000 2018	",1020061160685547520,"	77035	dont_know	I might regret hoping for a suspension lol but it s better than getting stuck in the flood
1847305517	FALSE	finalized	5	08/06/2018 2:13	0.8068	Thu Jun 21 18:10:49 +0000 2018	",1009861209095589894,"	674	dont_know	I think it s disgusting how the liberals caused a flash flood to interfere with the First Lady s trip. lol
1847304861	FALSE	finalized	3	08/06/2018 2:15	1	Fri Jul 06 13:44:04 +0000 2018	",1015229900419207168,"	65737	dont_know	NormEisen  VoteforMenzim  nytopinion EXACTLY!  Now is the time to flood them w/our outrage!     Mr. Pruitt s case d  https://t.co/t3AJBT5WEH
1847304759	FALSE	finalized	4	08/05/2018 2:39	0.7519	Thu Jul 05 23:49:43 +0000 2018	",1015019927030456326,"	6107	dont_know	" martycormack  SeanBakerMN  NWS Hi all, it doesn t feel quite right to hit   like  on these posts about the flood. I  https://t.co/mARQBvjKrC"
1847305633	FALSE	finalized	3	08/05/2018 21:54	0.6866	Fri Jun 22 00:52:13 +0000 2018	",1009962226168614912,"	40639	dont_know	Solar flare - judgement upon the earth???  Remember sodom and g  Remember Gods promise to never flood the earth aga  https://t.co/YexXlX7dcS
1847304466	FALSE	finalized	4	08/05/2018 22:29	1	Thu Jul 05 18:01:40 +0000 2018	",1014932336293613568,"	78697	dont_know	 EveryLibrary Yay! Nothing like annoying public officials with an e-mail flood until they do the right thing. :)
1847304099	FALSE	finalized	4	08/06/2018 9:04	1	Wed Jul 04 22:54:39 +0000 2018	",1014643682371350528,"	781	dont_know	"if you want to flood the usa with drugs go ahead and try to abolish ice ,don't be fooled ,don't be an asswipe."
1847305201	FALSE	finalized	4	08/05/2018 17:12	1	Thu Jul 19 18:45:07 +0000 2018	",1020016703319621632,"	46781	dont_know	"themariocorrea  AsherCaffe  Asher_Concepts I don't agree with separating families, but I don't care for the flood  https://t.co/X1aDwTbXau"
1847304749	FALSE	finalized	3	08/05/2018 4:23	1	Fri Jul 06 19:02:07 +0000 2018	",1015309939970134017,"	100142	dont_know	 KierzOfWar did you flood your house???? hahaha
1847304782	FALSE	finalized	5	08/05/2018 23:22	0.3975	Thu Jul 05 23:48:45 +0000 2018	",1015019683152621574,"	6031	dont_know	FYI  albanywater and  AlbanyCityHall   ” Buckingham Pond is up over a foot! The south portion of the pond near Lenox Ave is starting to flood.
1847305479	FALSE	finalized	3	08/06/2018 2:18	1	Thu Jun 21 21:50:29 +0000 2018	",1009916490127233036,"	22556	dont_know	 SkallEdit mf you flood my TL with cats
1847304627	FALSE	finalized	3	08/06/2018 2:12	1	Thu Jul 05 20:50:06 +0000 2018	",1014974723690778629,"	94638	dont_know	"I hate when all these old memories flood my mind, it makes me miss the people that are no longer in my life."
1847305526	FALSE	finalized	3	08/06/2018 2:12	1	Thu Jun 21 22:51:21 +0000 2018	",1009931810434961409,"	28644	dont_know	"realDonaldTrump You just blew the wall up. Now begins the real flood of illegals.drugs, trafficking.the border pat  https://t.co/QqrwNS0YiU"
1847304235	FALSE	finalized	4	08/06/2018 1:52	1	Thu Jul 05 00:40:18 +0000 2018	",1014670269884063744,"	8687	dont_know	That flood gate open and well-established by white men. https://t.co/tQ1wfxtRkQ
1847305057	FALSE	finalized	3	08/05/2018 4:21	1	Thu Jul 19 15:04:42 +0000 2018	",1019961234035265536,"	6147	dont_know	"Listen, America is a racist nation. And as a racist nation, we need to flood this country with third world immigran  https://t.co/UO163sUSTV"
1847305502	FALSE	finalized	5	08/05/2018 21:59	1	Fri Jun 22 02:23:05 +0000 2018	",1009985094914904066,"	53474	dont_know	#KeepFamilesTogether OpEd: The main disappointment we have regarding  FLOTUS McAllen trip is WX &amp; flooding cxld  https://t.co/S1tqVDV7Y2
1847305671	FALSE	finalized	4	08/05/2018 22:29	1	Thu Jun 21 20:26:36 +0000 2018	",1009895381612843010,"	13963	dont_know	Roses blush red sleepy horn worn olfactory mums flood hydrangeas
1847305106	FALSE	finalized	5	08/05/2018 1:20	0.5951	Thu Jul 19 15:56:27 +0000 2018	",1019974254316490752,"	14103	dont_know	Hundreds of calls flood in as #Arizona launches nation's first #opioid hotline #12News  Ѓ¦ AMejia12News Ѓ©  https://t.co/CYF0DsfWG6
1847305058	FALSE	finalized	4	08/05/2018 14:22	1	Thu Jul 19 15:05:01 +0000 2018	",1019961314138034177,"	6187	dont_know	ragnarrex  BreitbartLondon The liberals would eventually want to flood the U.S. with Muslims along with people fro  https://t.co/ltjJK4oLsy
1847305183	FALSE	finalized	3	08/06/2018 2:15	0.6984	Thu Jul 19 17:20:20 +0000 2018	",1019995367792889857,"	28975	dont_know	monday: toilet water flood tuesday: water spout storm wednesday: rearrange entire store thursday: pipe explosion do  https://t.co/vpEDLGcQKy
1847305147	FALSE	finalized	3	08/05/2018 4:47	1	Thu Jul 19 16:31:53 +0000 2018	",1019983172342251520,"	20168	dont_know	flood #yeniden
1847305159	FALSE	finalized	4	08/05/2018 6:01	1	Thu Jul 19 16:38:01 +0000 2018	",1019984715334418432,"	21107	dont_know	JetBlue  rainydayinnyc They're replying to your compliments to flood out my complaints. They screwed my elderly di  https://t.co/Ue7o4R65TF
1847305311	FALSE	finalized	3	08/05/2018 3:14	1	Thu Jul 19 21:41:18 +0000 2018	",1020061041982607363,"	76975	dont_know	We have told you that for two yrs after watching the deliberate flood of men from Africa not to assimilate but a st  https://t.co/KDdaVfxSei
1847305755	FALSE	finalized	3	08/05/2018 23:42	1	Thu Jun 21 23:17:41 +0000 2018	",1009938434536951808,"	30790	dont_know	oliverbcampbell You getting any of that flooding my man? We are good here but still on flood watch till the 27th.
