_unit_id	_golden	_unit_state	_trusted_judgments	_last_judgment_at	please_choose_a_category:confidence	created_at	id_str	rownames	please_choose_a_category	text
1847304430	FALSE	finalized	4	08/05/2018 2:00	0.7487	Thu Jul 05 14:39:50 +0000 2018	",1014881546245984256,"	60318	dont_know	Panic as threatening leaflets flood girls' school https://t.co/SteWuXc76I
1847304635	FALSE	finalized	3	08/05/2018 22:05	1	Thu Jul 05 17:44:24 +0000 2018	",1014927992504676352,"	77013	dont_know	We have lived through the flood time of fascism and of the nazism which ran its meteoric course at a cost to mankin  https://t.co/QbeFvJ9LFT
1847305953	FALSE	finalized	3	08/06/2018 9:05	1	Mon Jul 04 20:03:42 +0000 2016	",750057517997289472,"	34045	dont_know	"To all the men who flood my inbox, I have an intense focus on my business, I am not interested in dating, a... https://t.co/Af18mTmt6G"
1847305546	FALSE	finalized	4	08/05/2018 16:17	1	Fri Jun 22 01:05:08 +0000 2018	",1009965476074741761,"	42171	dont_know	"membersonlydave That's why I just keep adding RMG people &amp; Cleveland fans, trying to flood my TL with nothing but  https://t.co/oikJdbR3gt"
1847304700	FALSE	finalized	3	08/05/2018 20:25	1	Fri Jul 06 12:16:35 +0000 2018	",1015207880583208960,"	56940	dont_know	Hoses daffodils beat nostril drip bathe stale mums flood scarlet
1847304640	FALSE	finalized	4	08/06/2018 0:26	1	Wed Jul 04 22:57:47 +0000 2018	",1014644470875394048,"	988	dont_know	taotu SAME im about to flood the timeline like 50 people are gonna unfollow me bc it s all ab yellamo salohcin tmr  https://t.co/rzTLrJEDRp
1847305026	FALSE	finalized	3	08/06/2018 3:29	1	Fri Jul 06 09:12:11 +0000 2018	",1015161476548448257,"	43255	dont_know	The flood of assignments in sem 2 is gonna be torture
1847305532	FALSE	finalized	3	08/05/2018 20:07	1	Thu Jun 21 23:26:41 +0000 2018	",1009940701373714437,"	31544	dont_know	To the #NBADraft that's wearing the flood pants and shoes with no socks ... you look stupid and your feet are going  https://t.co/P5Z9f1qNbZ
1847304836	FALSE	finalized	3	08/05/2018 23:06	1	Fri Jul 06 12:25:02 +0000 2018	",1015210008773087232,"	57725	dont_know	 J_Dot_J pretty good rates available on the pineapple tho  however not sure i can get flood insurance
1847305284	FALSE	finalized	4	08/06/2018 2:16	0.7644	Thu Jul 19 21:32:51 +0000 2018	",1020058912458977280,"	75739	dont_know	RyanNannuDavies Hate 3G mate. Only good in the winter if it s terrible conditions but they even flood then! More f  https://t.co/wa2GCrkEE6
1847305970	FALSE	finalized	3	08/06/2018 3:08	1	Tue Jul 05 00:38:11 +0000 2016	",750126594237227009,"	42490	dont_know	10 Panama Papers myths busted: The release of the so-called Panama Papers has generated a flood of media cove... https://t.co/5cmiJFbCzn
1847305899	FALSE	finalized	4	08/05/2018 0:17	0.743	Mon Jul 30 18:14:54 +0000 2018	",1023995366516162563,"	87329	dont_know	I need the money to flood my account too though I'm a girl
1847304576	FALSE	finalized	4	08/05/2018 7:20	1	Thu Jul 05 10:18:39 +0000 2018	",1014815814153728000,"	41115	dont_know	Mothers can't help it when we flood your feeds with pic and videos of our kids.  When you have your adventures and  https://t.co/NS48m5YGow
1847305611	FALSE	finalized	3	08/05/2018 20:28	1	Thu Jun 21 23:47:56 +0000 2018	",1009946049681739776,"	33198	dont_know	honestly im glad that i stopped playing fortnite because im sick of the flood of kids playing it  they're fucking annoying
1847305643	FALSE	finalized	3	08/05/2018 3:08	1	Thu Jun 21 19:57:17 +0000 2018	",1009888004343726080,"	11105	dont_know	Meadow Street (CV1 3HL) Coventry flood protection and trash screen monitoring https://t.co/lXOBPwazaW
1847304411	FALSE	finalized	3	08/06/2018 8:07	1	Thu Jul 05 13:37:07 +0000 2018	",1014865762916298757,"	54902	dont_know	"JenMsft  FPieces  bdsams Yea, I heard a few around 2 or 3pm, followed by a flood of cop cars. Then nothing until the evening."
1847305210	FALSE	finalized	3	08/05/2018 1:54	1	Thu Jul 19 18:58:32 +0000 2018	",1020020080447328256,"	49341	dont_know	LA is forsure OD now... outsiders bout to flood the city  Ќ  ‚пёЏ Thanks LeBron.
1847305179	FALSE	finalized	3	08/05/2018 2:47	0.6646	Thu Jul 19 17:19:20 +0000 2018	",1019995113530052608,"	28785	dont_know	Climate action has been repeatedly drowned by a devastating surge and flood of money from the fossil fuel industry  https://t.co/h97L0eu52D
1847304616	FALSE	finalized	4	08/05/2018 3:36	0.7559	Thu Jul 05 18:29:13 +0000 2018	",1014939271638073344,"	81354	dont_know	Dell_IN The water pipe in my house broke and there s a flood here now #SacredGameWithDellCinema #Challenge3
1847305102	FALSE	finalized	3	08/06/2018 11:08	1	Thu Jul 19 15:55:16 +0000 2018	",1019973956902666240,"	13943	dont_know	њ No matter what comes fire or flood i will hold on YOU are still good and I ll still HOPE for it  ќ  https://t.co/b95xyrSIyd
1847304797	FALSE	finalized	3	08/05/2018 22:29	1	Fri Jul 06 06:36:56 +0000 2018	",1015122407265329159,"	35621	dont_know	"sorry for the flood , I just got so much shit on my chest and nobody to talk to   Ќ  ёЏ  Ќ ёЏ"
1847304384	FALSE	finalized	3	08/05/2018 20:49	1	Thu Jul 05 12:40:58 +0000 2018	",1014851629433139201,"	50630	dont_know	".: ""It s not the 2.7-million-lumen flood lights now screwed into each of the right choice for keeping"
1847304502	FALSE	finalized	3	08/06/2018 8:47	0.6554	Thu Jul 05 21:30:51 +0000 2018	",1014984981679099906,"	98335	dont_know	I wanna smell like a chorus of flash flood warnings to wake up early to do with this name.
1847305003	FALSE	finalized	3	08/05/2018 2:06	0.6923	Fri Jul 06 04:55:00 +0000 2018	",1015096755396866049,"	30096	dont_know	" shownusthigh i m about to flood my room,,, bawls some more"
1847305642	FALSE	finalized	4	08/05/2018 23:16	1	Thu Jun 21 19:56:35 +0000 2018	",1009887829172871170,"	11058	dont_know	tired blush snout water spent carnations daisies soak flood scarlet
1847305741	FALSE	finalized	3	08/05/2018 4:05	1	Thu Jun 21 21:36:29 +0000 2018	",1009912968409120768,"	20958	dont_know	Let me get this right- #MAGA and #AmericaFirst means to flood the Industrial complex with immigrants that the gov't  https://t.co/4tI3PsUUYG
1847305379	FALSE	finalized	3	08/06/2018 9:06	0.6375	Thu Jun 21 18:26:00 +0000 2018	",1009865030609915904,"	2205	dont_know	Netflix &amp; chill w this flood?
1847305744	FALSE	finalized	3	08/05/2018 13:53	1	Thu Jun 21 20:33:29 +0000 2018	",1009897111998091265,"	14630	dont_know	WendyMo48794698  BillOReilly  tci92 Left just wants to flood our nation with democrat future votes.What a joke they https://t.co/CNVKNjQ5nq
1847306070	FALSE	finalized	3	08/05/2018 4:38	1	Mon Jul 04 23:35:19 +0000 2016	",750110773964206080,"	40593	dont_know	"mirriam71 It kind of works like inflation.The less the word is worth, the more people try to flood conversations with it as social currency"
1847305440	FALSE	finalized	6	08/06/2018 2:05	1	Thu Jun 21 20:53:44 +0000 2018	",1009902210082361344,"	16652	dont_know	 ChrisJabberwock  vanessa_cohen ...&amp; flood backgrounds with cgi nonsense for an anniversary collection!
1847304467	FALSE	finalized	3	08/05/2018 21:57	1	Thu Jul 05 18:01:53 +0000 2018	",1014932392564461570,"	78718	dont_know	Nicki opened the flood gates to very poor quality Boo'd Up remixes and I'm sad now
1847304542	FALSE	finalized	3	08/06/2018 9:15	0.3522	Thu Jul 05 21:10:22 +0000 2018	",1014979824811732994,"	96470	dont_know	" Seth_Kaplan If it s not flood related, it would be incredible to know how that could have occurred."
1847304634	FALSE	finalized	4	08/05/2018 2:03	0.7268	Thu Jul 05 17:44:21 +0000 2018	",1014927981570088962,"	77009	dont_know	Don't :) fucking :) flood :) my tml :) with :) negativity :) you :) bitch :) https://t.co/CQYkL5S9uZ
1847305136	FALSE	finalized	4	08/05/2018 1:19	0.7629	Thu Jul 19 16:26:46 +0000 2018	",1019981886049857536,"	19253	dont_know	Idea flood to idea drought. Not sure which is worse.
1847305838	FALSE	finalized	6	08/05/2018 10:33	0.5043	Mon Jul 30 14:39:01 +0000 2018	",1023941034735267840,"	67806	dont_know	Fire flood hurricane tornado political back lash monsoon God bless us all I love my car
1847305843	FALSE	finalized	3	08/06/2018 5:03	1	Mon Jul 30 14:39:28 +0000 2018	",1023941148396535809,"	67839	dont_know	"Oh god the earthquakes, floods and volcano eruptions "
1847304579	FALSE	finalized	3	08/06/2018 2:14	1	Thu Jul 05 13:34:07 +0000 2018	",1014865004569464832,"	54686	dont_know	Existential crises have become rather monotonous. Any other suggestions as to what i should flood my brain waves wi  https://t.co/QdT0jxRYXs
1847304433	FALSE	finalized	3	08/05/2018 3:08	1	Thu Jul 05 15:23:02 +0000 2018	",1014892418070712321,"	63961	dont_know	Dear Nigerians in diaspora Just bcos ure in the abroad doesn't give you the right to flood my WhatsApp wit messages  https://t.co/h5U8GfbkN4
1847304387	FALSE	finalized	3	08/06/2018 9:41	0.6884	Thu Jul 05 12:43:35 +0000 2018	",1014852290346389504,"	50808	dont_know	Manipulation of flood insurance leads to repeat disasters. Important story by  chronMC and  mizzousundevil  https://t.co/CIqN0NO2I0
1847304148	FALSE	finalized	3	08/05/2018 17:50	0.6769	Wed Jul 04 23:36:52 +0000 2018	",1014654305905725440,"	3707	dont_know	The money for #climate scam is drying up. Quick Batman! Another fire and flood and drought and heatwave prediction!  https://t.co/iw2HzN0y8k
1847304224	FALSE	finalized	3	08/05/2018 2:50	1	Thu Jul 05 00:36:49 +0000 2018	",1014669393446354944,"	8405	dont_know	Guys. Once I give the go signal. Please flood me with new memes. I need new memes. But not now. First I need storage. Thanks.
1847304604	FALSE	finalized	4	08/06/2018 0:26	0.497	Thu Jul 05 15:51:13 +0000 2018	",1014899510286446593,"	66739	dont_know	Needed to go to Home Depot to get some stuff to help my parents' house not flood. It's 1.6 miles from Home Depot to  https://t.co/PltuVslXMo
1847305779	FALSE	finalized	5	08/04/2018 23:36	1	Mon Jul 30 18:55:43 +0000 2018	",1024005638567981057,"	91004	dont_know	 ArrocharAlps  argyllandbute The Succoth locals will love the new flood of parked cars clogging their roads
1847305791	FALSE	finalized	3	08/05/2018 20:20	1	Sun Jul 29 20:03:34 +0000 2018	",1023660324002586624,"	175	dont_know	KAI wants to cook... but the dirty dishes flood the kitchen.... Why do I have to clean them!?
1847305014	FALSE	finalized	3	08/05/2018 14:02	1	Fri Jul 06 06:00:00 +0000 2018	",1015113110800216065,"	33838	dont_know	So much iconic legendary throwback content I have to flood you guys with it all before I start posting my brand new  https://t.co/x9IlDsenSr
1847305039	FALSE	finalized	6	08/05/2018 0:45	0.828	Fri Jul 06 14:18:23 +0000 2018	",1015238536294002688,"	69320	dont_know	get right with God. How many warnings did Noah give? The flood was an actual event. Sodom and Gomorrah was an actua  https://t.co/RBLULQlqTV
1847306047	FALSE	finalized	3	08/05/2018 4:41	1	Mon Jul 04 16:43:05 +0000 2016	",750007031986348032,"	26937	dont_know	 sarahEyacco I'll flood the yard for you
1847304971	FALSE	finalized	4	08/05/2018 4:14	0.4952	Fri Jul 06 19:27:08 +0000 2018	",1015316234819309569,"	102729	dont_know	Help as you are able AND advocate for state policy to prevent future flood damage and improve disaster relief and r  https://t.co/NSpcDGtFG0
1847304110	FALSE	finalized	3	08/04/2018 21:09	1	Wed Jul 04 23:03:05 +0000 2018	",1014645802000633856,"	1343	dont_know	When the enemy shall come in like a flood The SPIRIT of The LORD will lift up a Standard of The  BLOOD of JESUS CHRIST against them.
1847304769	FALSE	finalized	3	08/06/2018 10:12	1	Fri Jul 06 02:21:55 +0000 2018	",1015058227707502592,"	19291	dont_know	" TomiLahren They seem like good guys, open the flood gates."
1847305963	FALSE	finalized	3	08/05/2018 2:42	1	Tue Jul 05 00:35:40 +0000 2016	",750125961140641793,"	42409	dont_know	I tell a hoe to beat it I don't need you to love me I need a plug in my life that's gone flood me 
1847305180	FALSE	finalized	4	08/05/2018 7:20	1	Thu Jul 19 17:19:40 +0000 2018	",1019995198829473797,"	28845	dont_know	President1Trump  POTUS This is what happens w/an open door policy. Letting the migrants flood in has proven over &amp;  https://t.co/H6NVQAKzgG
1847304786	FALSE	finalized	4	08/05/2018 2:52	1	Fri Jul 06 02:27:51 +0000 2018	",1015059724021231616,"	19788	dont_know	Let's flood this Twitter thread with kindness and joy!!
1847305614	FALSE	finalized	3	08/05/2018 1:17	0.6765	Thu Jun 21 23:48:22 +0000 2018	",1009946156611166209,"	33226	dont_know	 tinyarmoredone Those screams came back as volcano's and floods and crazy earthquakes - the earth can only take so  https://t.co/vCCJUkplaJ
1847304434	FALSE	finalized	3	08/06/2018 2:54	0.376	Thu Jul 05 15:24:16 +0000 2018	",1014892725001334784,"	64098	dont_know	SteveUyehara That's crazy. Possibly 4 months before it is clear to get out? And that's only if it doesn't completely flood them out.
1847305364	FALSE	finalized	3	08/06/2018 1:38	0.661	Thu Jun 21 18:22:59 +0000 2018	",1009864273093382145,"	1902	dont_know	"A giant wave of plastic garbage could flood the U.S., a study says https://t.co/5vqrsrhtf4"
1847304534	FALSE	finalized	7	08/05/2018 0:13	0.7065	Thu Jul 05 21:00:23 +0000 2018	",1014977313249738753,"	95566	dont_know	Evan Almighty (2006) 1hr 35m [G] God summons narcissistic Evan to build an ark in preparation for a flood. Meanwhil  https://t.co/uf6B0MGGLG
1847304134	FALSE	finalized	3	08/04/2018 20:08	1	Wed Jul 04 23:31:36 +0000 2018	",1014652979637518336,"	3300	dont_know	Potus Trump should go on and use Rex84 for the borders to stop the chain migration its globalists agenda to flood u  https://t.co/b06uK1ALzk
1847304438	FALSE	finalized	4	08/06/2018 4:48	1	Thu Jul 05 15:25:17 +0000 2018	",1014892983861293056,"	64193	dont_know	milwaukee 2144-20 m18 tool oly compact site light w/ flood mode! Radius! NR!LQQK https://t.co/uHQnHA5u1S
1847305239	FALSE	finalized	3	08/05/2018 2:11	0.6831	Thu Jul 19 19:36:00 +0000 2018	",1020029506441138181,"	56264	dont_know	Finally home and I have my car back and no flood to clean. Naturally to celebrate - I nap! https://t.co/H3V5Fbo8UT
1847304316	FALSE	finalized	4	08/05/2018 2:00	1	Thu Jul 05 03:03:08 +0000 2018	",1014706216407166976,"	18801	dont_know	Trying my best not to flood Instagram with all the photos I ve taken on this trip so far. The west coast really is magical.
1847305924	FALSE	finalized	3	08/05/2018 14:26	1	Mon Jul 04 06:40:44 +0000 2016	",749855446702362624,"	6200	dont_know	#ITrustHillary to fuck this country hard.every waking moment&amp; flood America with disease ridden illegals  HillaryClinton #trumptrain
1847305142	FALSE	finalized	3	08/05/2018 1:08	1	Thu Jul 19 16:31:02 +0000 2018	",1019982959762214912,"	20027	dont_know	O p s flood tweets sorry not sorry hakhak
1847305255	FALSE	finalized	3	08/06/2018 9:22	1	Thu Jul 19 20:34:28 +0000 2018	",1020044221762424835,"	66522	dont_know	RVAwonk If Putin comes to Washington we flood the streets with 2 million patriotic Americans and shut the whole fucking thing down.
1847304266	FALSE	finalized	3	08/05/2018 22:08	1	Thu Jul 05 01:38:41 +0000 2018	",1014684963839586304,"	12874	dont_know	Thank you Jesus for the amazing response tonight at Crossroads. I love seeing students flood the altar and lay thei  https://t.co/WGGASuJSC0
1847306063	FALSE	finalized	4	08/05/2018 2:02	0.5051	Mon Jul 04 20:23:43 +0000 2016	",750062556966887424,"	34936	dont_know	Even if you don't live in a flood zone your home may be susceptible to flooding during heavy rains. Read how you... https://t.co/O6N3RvoGMJ
1847304340	FALSE	finalized	5	08/05/2018 1:06	1	Thu Jul 05 04:44:08 +0000 2018	",1014731631976828929,"	24920	dont_know	DavidBriers6  Shrimo2  sweetatertot2  SenKamalaHarris That s what the dems want to flood your mind with.  Watch a  https://t.co/dmaQJutQ9y
1847304376	FALSE	finalized	3	08/05/2018 2:05	0.6515	Thu Jul 05 12:06:15 +0000 2018	",1014842893004165123,"	48044	dont_know	We are currently live with our flood risk webinar! It's still not too late to join us: https://t.co/qRder0hTGi https://t.co/43oFNQWERv
1847305252	FALSE	finalized	3	08/04/2018 23:16	1	Thu Jul 19 20:26:23 +0000 2018	",1020042185398521858,"	65211	dont_know	" clowncursed Recurrently, nobody should grease and don't try flood, and then shakily decay.  clowncursed"
1847305121	FALSE	finalized	3	08/06/2018 2:27	1	Thu Jul 19 16:01:05 +0000 2018	",1019975421939494912,"	14835	dont_know	Im gonna flood  SueRamirez BirthdayMoNa
1847304173	FALSE	finalized	4	08/04/2018 20:02	1	Wed Jul 04 23:52:29 +0000 2018	",1014658236476096512,"	4810	dont_know	"And like a flood His mercy reigns.  ~unending love, amazing grace."
1847304117	FALSE	finalized	4	08/04/2018 20:02	0.7266	Wed Jul 04 23:07:53 +0000 2018	",1014647011600199680,"	1657	dont_know	SylvesterTurner You're so worried about cutting fire fighter's benefits you can't do anything about flood control.  https://t.co/nhR2OZfkYd
1847305116	FALSE	finalized	4	08/05/2018 17:48	1	Thu Jul 19 15:59:57 +0000 2018	",1019975136831664128,"	14620	dont_know	"ippatel  unexpected response frm public for ur tweet huh....did u think ""nationalists"" will flood in,in ur s  https://t.co/vmTWAB43Zi"
1847305896	FALSE	finalized	3	08/05/2018 20:35	1	Mon Jul 30 18:10:23 +0000 2018	",1023994229339709440,"	86921	dont_know	We Don't want to flood your page...So...Check out our FB Page/Instagram for the Combine Results! We appreciate all  https://t.co/3LajihIAxH
1847305623	FALSE	finalized	4	08/05/2018 3:23	1	Thu Jun 21 23:04:20 +0000 2018	",1009935076409430016,"	29690	dont_know	"Prime example of a duplicitous open borders politician wanting to flood our country with illegal immigrants. No, no  https://t.co/fRqLlpPirf"
1847304362	FALSE	finalized	4	08/05/2018 21:57	0.4908	Thu Jul 05 09:11:28 +0000 2018	",1014798909816705025,"	37906	dont_know	 thaimythbuster Similar to water-pushing by boats to relieve the flood....
1847304957	FALSE	finalized	4	08/05/2018 2:32	0.7421	Fri Jul 06 12:44:15 +0000 2018	",1015214843144622081,"	59404	dont_know	So you mean to tell me NJ went from everyone outside in the sun loving life to waking up to flash flood warnings? M  https://t.co/07PtvWetae
1847305302	FALSE	finalized	3	08/05/2018 2:53	1	Thu Jul 19 21:39:15 +0000 2018	",1020060525500088321,"	76694	dont_know	C70  cardinalsgifs I did...but I m never sure whose to respond to...flood the market!
1847306076	FALSE	finalized	3	08/05/2018 13:37	1	Tue Jul 05 00:24:42 +0000 2016	",750123202399965184,"	42073	dont_know	"an ocen flood, or' tere there' an ocean flood' an' major numbers ofe te' 'beta 'males te' ofe'"
1847304544	FALSE	finalized	6	08/06/2018 2:17	1	Thu Jul 05 21:10:34 +0000 2018	",1014979873918423041,"	96485	dont_know	Time to flood the phone lines &amp; demand that this confirmation FAILS!!  #BlockBenczkowski https://t.co/ZAXckcNdtN
1847304415	FALSE	finalized	3	08/05/2018 21:05	1	Thu Jul 05 13:37:44 +0000 2018	",1014865918520905729,"	54938	dont_know	We're looking to recruit #flood wardens in the #Ponteland area - be the eyes and ears for your local community! Cal  https://t.co/BxbmnWi8JI
1847305987	FALSE	finalized	3	08/06/2018 5:03	1	Mon Jul 04 06:37:18 +0000 2016	",749854583460077568,"	6076	dont_know	halcyondon  MrsAmer1caFirst world wide flood ? Ever been to a place of geologic interest ? I have. Evidence of Noahs flood all around.
1847304488	FALSE	finalized	5	08/04/2018 23:49	1	Thu Jul 05 19:09:18 +0000 2018	",1014949358066794496,"	85286	dont_know	"Yes,  verafiles, the infrastructure agenda of Duterte is nationwide. Guess what, flood control was included in the  https://t.co/dGOZjOpeeH"
1847305345	FALSE	finalized	3	08/05/2018 19:19	0.6622	Thu Jul 19 21:57:18 +0000 2018	",1020065067470147585,"	79395	dont_know	" hawleydp Shamash, please strike this one with the flood..."
1847304244	FALSE	finalized	3	08/06/2018 2:46	1	Thu Jul 05 00:45:08 +0000 2018	",1014671487129620480,"	9077	dont_know	flood 
1847304972	FALSE	finalized	5	08/05/2018 22:31	1	Fri Jul 06 19:27:36 +0000 2018	",1015316350426726400,"	102759	dont_know	 SwarajyaMag If yogi asks Shiva will give even flood!!
1847305789	FALSE	finalized	3	08/06/2018 9:11	1	Sun Jul 29 20:02:56 +0000 2018	",1023660162869940224,"	127	dont_know	the flood
1847304155	FALSE	finalized	3	08/04/2018 20:38	1	Wed Jul 04 23:40:35 +0000 2018	",1014655240384196609,"	3991	dont_know	Mexico's passionate fans flood Russia for World Cup and make a lot of amigos along the way https://t.co/xEf6yp7xli
1847305771	FALSE	finalized	3	08/06/2018 2:07	1	Mon Jul 30 05:49:48 +0000 2018	",1023807852169846785,"	34836	dont_know	And maybe don t flood our feeds with more ADs than the content we actually want to see #stoptheads #notmyfeed
1847305082	FALSE	finalized	5	08/05/2018 7:33	0.8045	Thu Jul 19 15:27:25 +0000 2018	",1019966948631691269,"	9715	dont_know	"GourHitakshi  HTmind Either it is flood or any other disaster, Sant Shri Asaram Bapu Ji s devotees are always ther  https://t.co/7DKWcFvzsw"
1847304958	FALSE	finalized	3	08/05/2018 19:46	1	Fri Jul 06 12:44:38 +0000 2018	",1015214940708311040,"	59433	dont_know	 ChronBrianSmith Stopping landscapers from doing this won't prevent flooding but it would help to lesson flooding a  https://t.co/dsjuovZPaG
1847306114	FALSE	finalized	4	08/05/2018 16:01	1	Mon Jul 04 11:01:29 +0000 2016	",749921066416480256,"	14587	dont_know	"Liberal media financier George Soros openly admits plan to destroy national borders, flood  https://t.co/NfyobNeFdC https://t.co/Ee6TMnbBsK"
1847305524	FALSE	finalized	3	08/06/2018 1:50	0.3442	Thu Jun 21 22:51:10 +0000 2018	",1009931761357328384,"	28621	dont_know	HaleyKHorton  txpoker1  PeterAlexander Here at border high was 83 today...no flash flood...that was their excuse f  https://t.co/Gi4iH6UKVN
1847305976	FALSE	finalized	3	08/06/2018 12:30	1	Mon Jul 04 16:00:28 +0000 2016	",749996305745846272,"	25359	dont_know	500eurot i love ur cat such an adorable flood
1847305563	FALSE	finalized	3	08/05/2018 20:27	1	Thu Jun 21 19:40:07 +0000 2018	",1009883685145972736,"	9477	dont_know	"davidhogg111 I've seen kids flood offices, make noise, mess with stuff, lie down, etc... several times w/o even ha  https://t.co/qlOZ7E3MYF"
1847304223	FALSE	finalized	6	08/05/2018 11:04	0.3457	Thu Jul 05 00:36:17 +0000 2018	",1014669260210229248,"	8357	dont_know	Staydown046 Damn...still thats alot...glad y'all didn't flood
1847305430	FALSE	finalized	3	08/05/2018 1:09	1	Thu Jun 21 20:51:58 +0000 2018	",1009901764814962690,"	16476	dont_know	congress and  senators flood their ling  and mail boxes it only  take  about 15 to 30  mins to send these greedy me  https://t.co/YslqxsnOHI
1847304804	FALSE	finalized	5	08/05/2018 22:44	1	Fri Jul 06 10:42:22 +0000 2018	",1015184171462021120,"	49075	dont_know	#trumpSTUPIDonSTEROIDS #trumpLYINGFASCISTTRAITORinCHIEF America is drowning in the cascading flood of #LIES  https://t.co/GdrVYbVkn7
1847304184	FALSE	finalized	3	08/06/2018 2:41	1	Thu Jul 05 00:02:18 +0000 2018	",1014660708053798912,"	5551	dont_know	young_mb23 I should flame yo ass just to flood yo Mentions corn flake face ass boy
1847304865	FALSE	finalized	4	08/05/2018 1:06	0.7554	Fri Jul 06 14:57:28 +0000 2018	",1015248368803680256,"	73803	dont_know	Yall add me on sc im tryna flood my whole shit 
1847304768	FALSE	finalized	3	08/06/2018 2:16	1	Fri Jul 06 01:42:17 +0000 2018	",1015048254365429760,"	15928	dont_know	I'm stuck in the same old mistake that I'm trying to forget It became chains that entangled me to drown in the flood of misery
1847304955	FALSE	finalized	5	08/05/2018 0:21	0.7878	Fri Jul 06 12:48:56 +0000 2018	",1015216024394911745,"	59924	dont_know	"How exciting, I finally got a response to my insanely high property tax assessment that puts my hurricane flooded n  https://t.co/lO9ugG9fpG"
1847304263	FALSE	finalized	3	08/06/2018 8:45	1	Thu Jul 05 01:37:02 +0000 2018	",1014684547521400832,"	12743	dont_know	I flood my bitch and idc what they say bout it..
1847305962	FALSE	finalized	4	08/05/2018 3:58	1	Tue Jul 05 00:35:39 +0000 2016	",750125956321378304,"	42407	dont_know	I can't cope with how many memories flood back when I listen to this omg Freeze (ft. Chris Brown) [OFFICIAL SONG] https://t.co/0olb9lkLPO
1847304874	FALSE	finalized	4	08/05/2018 3:08	1	Fri Jul 06 16:14:44 +0000 2018	",1015267813227982849,"	83262	dont_know	This corner used to flood like crazy when I was a kid and when I was a kid I loved walking in the puddles. They rer  https://t.co/ENuFma5DRq
1847304127	FALSE	finalized	3	08/06/2018 2:51	1	Wed Jul 04 23:12:12 +0000 2018	",1014648098482634752,"	1945	dont_know	Asking for a friend would it be rude to flood the hashtag full of right wing dog owners with pictures of happy gay  https://t.co/8wmjQ4JsK6
1847305094	FALSE	finalized	3	08/05/2018 13:50	0.6356	Thu Jul 19 15:44:54 +0000 2018	",1019971348188233728,"	12378	dont_know	 Ruby_Lancer is there a flood WAS I SPOILED  Man exciting. I have absolutely no idea what to expect from it.
1847305757	FALSE	finalized	4	08/06/2018 0:46	1	Thu Jun 21 23:18:15 +0000 2018	",1009938579794034688,"	30836	dont_know	"All this too is part of the libtard scam to flood our systems and break the bank. They are anti American, not for a  https://t.co/X5ZmFBt6Xf"
1847304322	FALSE	finalized	3	08/05/2018 13:53	1	Thu Jul 05 03:13:00 +0000 2018	",1014708698705358850,"	19484	dont_know	I hope these guys are getting paid double-time for standing around and watching the field flood  њЉ. https://t.co/53dwLMhma6
1847305653	FALSE	finalized	3	08/04/2018 23:06	1	Thu Jun 21 20:12:18 +0000 2018	",1009891781972905984,"	12610	dont_know	theage How to fuck up a country in 10 years or less. Turn it into a population flood.
1847304427	FALSE	finalized	3	08/05/2018 20:44	0.629	Thu Jul 05 14:04:33 +0000 2018	",1014872664152952833,"	57233	dont_know	Meadow Street Coventry flood protection and trash screen monitoring https://t.co/Fh3l2Z35mL
